"title","descrip","LiuyanType","answer","detail","type"
"世界上只剩下一头雄性白犀牛了","全球最后一头雄性白犀牛由40名全副武装的执勤人员昼夜守护，而如果他最终无后而终，白犀牛这个物种就将灭绝。",0,"\n		","<div class=""rumor-content"">\n	\n	<h2>论证</h2>\n	<div class=""content"">\n	说白犀牛只剩一头公的，是咒人家。根据IUCN2008年的报道，白犀牛（<i>Ceratotherium simum</i>）这个种还有1.7w+头野生个体。很显然，白犀牛这个物种不可能只有一头公的。<br>\n<br>\n<h2><strong>剩一只雄性的是“北白犀”的亚种</strong></h2>\n白犀牛，分为南白犀（<i>C. s. simum</i>）和北白犀（<i>C. s. cottoni</i>）两个亚种，上面说的1.7w头基本都是南方白犀牛。悲剧的是北白犀。截止今天，北白犀只剩5头。这5头北白犀全部属于捷克的Dvůr Králové Zoo。<br>\n<br>\n1970s，捷克从苏丹那儿搞了6头北白犀。捷克人非常厉害，全世界只有他们人工繁殖出了北白犀。而在同一时间内，全世界的北白犀都渐渐死光了，只剩他们有。为避免北白犀灭绝，捷克人一直在把剩下的北白犀往外送，推动繁殖。<br>\n<br>\n1989年-1990年，两头雌性北白犀Nola和Nadi被送往美国的San Diego Zoo Safari Park，同来自苏丹的雄性Angalifu进行繁殖。但是繁殖失败了。Nadi在2007年去世，Angalifu在2014年底去世。<br>\n<br>\n2009年，4头（2公2母）被送到肯尼亚的Ol Pejeta保护区，它们分别叫Sudan、Suni、Najin和Fatu，其中雄性Suni在2014年底去世。对于北白犀来说，2014年底真是个悲剧性的时间点。<br>\n<br>\n在送出4头北白犀后，捷克人还剩下两头，分别叫Nabire和Nesari，后者在2011年去世。<br>\n<br>\n至此，全世界的北白犀只剩下5头：Nola、Sudan、Najin、Fatu和Nabire。其中唯一的雄性，名叫Sudan，也就是新闻中的那头。所以更为悲伤的是，这5个个体中，可能只有1雄2雌有自然繁殖能力（准确来说只有1对繁殖过）。<br>\n<br>\n近些年有科学家发现，北白犀和南白犀基因上的差异，可能足以使得这两个亚种独立成种。现在唯一的希望，就是这5头了呢。<br>\n<br>\n<h4><strong>内容来源</strong></h4>\n<a href=""http://www.guokr.com/question/600700/"">世界上真的只剩下一头雄性白犀牛了吗？</a>花落成蚀，果壳网问答<br>\n<br>\n<br>\n<br>\n<br>\n\n	</div>\n</div>","自然环境"
"海底火山爆发会让海面出现红光","【太平洋海面惊现神秘红光（下图）】一架从香港飞往阿拉斯加的波音747-8客机，在途经俄罗斯勘察加半岛南部的太平洋上空时，飞行员突然发现一道闪电般的光束直冲云霄，海面冒出一片橘红色光。目前，相关部门已经前往事发地进行调查。据说这是一次海底火山爆发造成的。",2,"\n		","<div class=""rumor-content"">\n	\n	<h2>论证</h2>\n	<div class=""content"">\n	先说结论：会的，在火山学界，有明确的科学文献记录人们亲眼目睹（Eye Witness）水下火山爆发产生红色亮光的情形。<br>\n<br>\n火山学家在实际科研中往往会遇到这样的一个问题：那便是火山事件的高度危险性和不可预测性，说白了，就是火山并不是随时都会喷发给你看的，而且就算喷了，也不是人们随便就能凑上去看的，这还只是现代火山的Case；很多时候人们面对的对象还往往是地史时期里早已消亡的火山。基于这两点，学者们往往只能接触到大自然给我留下的第二手资料——即岩浆岩和地层。于是，很多火山学理论和火山行为机制模型的建立，便只能根据这些早已成为[结果]而无法见证[过程]的物质的性质，进行物理模拟甚至仅仅进行理论层面的推演。在这种情况，一次成功的[目睹]（Eye Witness），便往往是验证火山行为最珍贵的第一手数据，在火山学中，目睹，是有着最高公信力的一种观测手段，能够直接验证人一种火山作用理论或者假设是否真的成立。<br>\n<br>\n一直以来，人们对陆上的火山还勉强能做到目睹，可水下的火山，长久以来完全让人没有办法。万幸，我们亲爱的冰岛给人类提供了一个天然实验室—— 1963年的11月14日，坐落在北大西洋洋中脊上的冰岛其南侧水域中，突然出现了一个新的小卫星岛，人们将之命名为苏特塞（Surtsey）， 北欧神话中的火神。这个新岛屿不仅诞生了出来，而且在[某种机制]的驱动下一直持续地生长。对，这[某种机制]，正是人们一直梦寐以求想看到的“水与火之歌”——苏特塞岛，实乃岩浆在水环境中的喷发的直接造物。那苏特塞岛上一次次恐怖的爆炸，正是岩浆与水之间的剧烈的互动——所谓的，水汽岩浆爆发（Hydromagmatism）。<br>\n<br>\n水汽岩浆作用为何如此剧烈？很简单：岩浆有着约1200°C的高温。让足足有一千度温差的两种物质直接接触，会发生什么？会发生热冲击（Thermal Shock）。巨大的热量瞬间从岩浆输送到海水，使海水急剧升温。可是，水的沸点只有100°C啊，于是，海水瞬间被大量汽化，体积瞬间膨胀 ，接下来就是，爆炸（Hydromagmtic Explosion）。<br>\n<br>\n回到流言中的这次目睹事件中，现在已经知道了岩浆在水中会发生热冲击，导致猛烈的爆破，那么，这位学者所看到的水中红光又是怎么回事呢？是爆炸中的闪光吗？不是的。<br>\n<br>\n在水汽岩浆爆发中，强势的岩浆虽然“残酷地”将水瞬间蒸发到沸点以上，但是它自身也会由于过多热量的散失而瞬间降温到自己的凝固点之下，这个瞬间凝固的过程叫做淬冷（Quenching），[岩浆]都一瞬间都冷凝成固体的[岩石]了。固然，爆破的一瞬间，会有“强光一闪”的情况，但那毕竟只有一瞬，而这次报道的可不仅仅是光芒一闪，而是持续的“火焰”（Fire Flash）。<br>\n<br>\n对，水里着火了。<br>\n<br>\n这又是怎么回事儿呢，原来，问题还出在[汽化]这个关键点上，大量海水的汽化，会在岩浆与水作用的空间中产生一个“完全气态区域（water-free zone）”，等于在水中建立了一个汽泡，被这个区域围限的岩浆，会与外界没被汽化的冰冷海水完全隔绝，于是，岩浆就得以在这个安全的“水汽结界”中维持自己那极高的温度，产生持续燃烧的火焰，而不至于在热冲击下瞬间冷凝，被冰冷的海水扑灭了。<br>\n<br>\n<br>\n<h4><strong>内容来源</strong></h4>\n<a href=""http://www.guokr.com/question/575280/"">海底火山爆发会造成海面出现红光吗？</a>溯鹰，果壳网问答<br>\n<br>\n\n	</div>\n</div>","自然环境"
"雾霾和沙尘暴此消彼长，治理其一另一个就会加重","2015年4月16号，北京遭遇了13年来最强的沙尘暴天气。这些年沙尘暴的确减少了，但雾霾却大大增加，原因便是种植了三北防护林，挡住了北方来的风，所以没有风来吹散雾霾，所以在沙尘暴减少的同时雾霾就增多了。",0,"\n		","<div class=""rumor-content"">\n	\n	<h2>论证</h2>\n	<div class=""content"">\n	<h2><strong>雾霾和沙尘暴的最大区别是颗粒物大小？</strong></h2>\n习惯上的确会认为雾霾的颗粒物较小如PM2.5，而沙尘暴的颗粒物较大如PM10。不过这种区分方式太笼统了，事实上雾霾里也有PM10，沙尘暴里也有PM2.5——而且比例未必像大家想象中那么小。比如2002年3月，北京爆发过一次破纪录的特大沙尘暴，经过检测分析，在总悬浮颗粒物（TSP）中，PM2.5约占30%左右。<br>\n<br>\n雾霾和沙尘暴最明显的区别，在于风的作用。雾霾通常发生在没有风的静稳天气条件下，对流和扩散条件极差，污染物都淤积起来挥之不去；而沙尘暴恰恰相反，通常发生在大风时，沙尘随风而起、风息而止，来得快去得也快，风风火火闯九州。所以大家在雾霾时要“盼风来”，在沙尘暴时则要“盼风停”。<br>\n<br>\n<h2><strong>雾霾和沙尘暴之间到底有没有此消彼长的关系？</strong></h2>\n不得不说这个说法非常盛行。支撑这一说法的证据有两点：<br>\n<br>\n①是时间吻合：这些年沙尘暴的确减少了吧？这些年雾霾的确增加了吧？要说没关系哪有这么巧！<br>\n②是原因分析：因为要治理沙尘暴，所以种植了三北防护林，所以挡住了北方来的风，所以没有风来吹散雾霾，所以在沙尘暴减少的同时雾霾就增多了——这还不叫此消彼长？！<br>\n<br>\n关于第一点，这叫“偶合”——偶然巧合，就是这么巧。偶合的事情多了去了，不能都认为有因果关系；至于第二点，能把雾霾吹散的风，一般是北方冷空气南下，其前沿冷锋我们一般在850hPa或700hPa的天气图上标注，这意味着冷空气高度至少也有3000米以上——然而防护林根本不可能挡得住。<br>\n<br>\n有的人说，“快砍了三北防护林吧！我宁愿承受沙尘暴也不想承受雾霾！”其实根本就不存在这么理想的“二选一”。砍掉三北防护林以后，更可能发生的事情是：有风的时候沙尘暴，没风的时候起雾霾。一口沙尘一口霾，颗粒物豪华套餐强势登场。<br>\n<br>\n其实沙尘暴的治理和雾霾的治理并不矛盾，沙尘暴的治理主要是扼制土地荒漠化，而雾霾的治理主要是限制污染物排放，并不是一回事。<br>\n<br>\n<h2><strong>不是说治理沙尘暴很有成效吗，为什么还有沙尘暴？</strong></h2>\n首先沙尘暴治理确实有成效：<br>\n<br>\n<img src=""https://3-im.guokr.com/eqsNunlJ0UTj5jfVwbHSEMb1LDyFKOzwqy-mwaHKAOCQAQAA2QAAAEpQ.jpg"" style=""max-width: 480px"" data-orig-width=""400"" data-orig-height=""217"" data-hashkey=""eqsNunlJ0UTj5jfVwbHSEMb1LDyFKOzwqy-mwaHKAOCQAQAA2QAAAEpQ""><br>\n<br>\n大家可以看到，我国北方地区沙尘暴的平均天数总体上是在大幅度下降的。当然了，也不好说这完完全全就是治理的结果——事实上全球气候变化本来就使得我国的北方的风在持续减小，这也是沙尘暴减少的一个自然因素。<br>\n<br>\n不过，自然气候变化都是有周期的，风不会永远减弱下去。有研究表明，西北地区的沙尘暴存在以22年左右为周期的强弱变化，这意味着2000年以后极有可能进入沙尘暴高发期，事实上最近几年我国北方的沙尘暴确有反弹之势。<br>\n<br>\n对于沙尘暴而言，人工治理的结果，只能是叠加在自然本身的变化之上的综合结果。比如说，自然周期进入了沙尘暴较弱的时期，再加上人工治理，那就是锦上添花，沙尘暴会大幅度下降；而等自然周期进入了沙尘暴较强的时期，人工治理就只能部分抵消这种反弹，这就成了雪中送炭，或许你感受到的依然是沙尘暴在增加，但这不能说明治理无效，只能说明——假如不治理的话更可怕！<br>\n<br>\n而且，无论你怎样治理，沙尘暴都是不可能彻底杜绝的。因为沙尘暴中的沙尘来源可以分为两部分：<br>\n<br>\n一部分是自然来源。大自然本身就有的沙漠、干涸的湖床、缺乏植被覆盖的沙漠边缘等等。根据科学家对深海岩心和冰盖沉积物测定发现，早在距今7000万年前的白垩纪末，就已经有沙尘暴现象。我国古代方志也有很多关于沙尘暴的记载，一般叫做“降尘”“雨土”等等。比如公元351年，甘肃武威就发生了一次强沙尘暴灾害，造成了人员伤亡和房屋倒塌。还有一些传说也有间接描述，比如西晋张华在《博物志》里写“夏桀之时，为长夜宫于深谷之中……天乃大风扬沙，一夕填此空谷”——看这架势是强沙尘暴。<br>\n<br>\n这说明，早在古代人类对自然的改造能力还很弱、甚至于再早到根本就没有人类时，就已经有沙尘暴存在了，这部分沙尘暴是你无法彻底消除的——谁能消除所有干旱、半干旱地区？谁又能把所有沙漠和荒漠都变绿洲？<br>\n<br>\n而我们需要治理的沙尘暴，其实是另一部分部分，也就是受人类活动影响而产生的沙尘暴。<br>\n<br>\n比如，美国在30年代时曾经对西部大草原过度开垦，造成土地荒漠化、沙尘暴肆虐；还有前苏联在50年代时，在哈萨克和西伯利亚等地区盲目开发荒地，造成大面积地表裸露，沙尘暴也频繁发生。我国就更不用说了，建国后的几次农垦高潮，造成了空前的“人造荒漠”。大跃进时期，锡林郭勒农垦后的优良牧场，仅仅几年之后就开始大规模沙化，最终沦为荒漠；90年代后，国家大幅度提高粮食收购价，一时间各地垦荒种粮的积极性大涨，呼伦贝尔草原又来了一轮放垦，两三年翻耕之后土地就迅速退化……<br>\n<br>\n国外科学家曾做过一个估算，90年代时，大气中的沙尘有约50%左右是来源于“受过扰动的土壤表层”——也就是人类活动造成的。尽管这种估算还带有不确定性，但是不加节制的人为因素会加剧沙尘暴的严重程度，这几乎是不争的事实，我们治理沙尘暴要针对的就是这部分。<br>\n<br>\n<h2><strong>沙尘暴是自然现象而已，不用大惊小怪？</strong></h2>\n伴随着要求“彻底杜绝沙尘暴”的激进环保呼声的，是另一种反环保的极端呼声——沙尘暴无害论。他们认为沙尘暴最大的问题是“脏”，除此之外“没有更大危害”。<br>\n<br>\n首先，沙尘暴对人体健康一样有危害。2002年3月北京特大沙尘暴中，矿物质气溶胶在长途奔袭中裹挟进了沿路和本地的污染物，导致污染元素浓度高达平时的近10倍，这些污染物沉降之后还将继续污染水体和土壤，并有可能随着生物链进入到农业产品中。除此之外还有颗粒物——当大家在雾霾中谈PM2.5色变时，为什么就忽略沙尘暴中也能飙到30%的PM2.5呢？<br>\n<br>\n另外，沙尘暴会减弱土壤肥力、加剧土地退化，造成农业减产。沙尘暴所产生的风蚀、沙割和沙埋等效应，会让铁路受阻，甚至引起脱轨和颠覆事故；沙尘暴爆发时，航班停滞、交通堵塞，工业精密仪器磨损加剧……<br>\n<br>\n网络争吵经常把问题推向极端——A说沙尘暴不好，B要反对A，就非得说沙尘暴“其实无害”；而A要反对B，就得说沙尘暴“必须杜绝”。大家似乎都已经习惯于在不断的反对中偏离辨析问题原本的初衷。<br>\n<br>\n<br>\n<h4><strong>内容来源</strong></h4>\n<a href=""http://www.guokr.com/article/440186/"">沙尘暴治理到底有效吗？</a>大脸撑在小胸上，果壳网科学人主题站<br>\n<br>\n<br>\n<br>\n\n	</div>\n</div>","自然环境"
"有人拍到绿色的落日","日本冲绳县野田昭洋25日傍晚在濑长岛拍摄到了“绿色的落日”。（下图)据悉，这种现象被称为“绿光”，常在日落时发生，是非常罕见的天文现象。石垣岛天文台所长宫地竹史介绍说，发生该现象需要具备很多条件，包括能见度高、海面附近没有云等。",2,"\n		","<div class=""rumor-content"">\n	\n	<h2>论证</h2>\n	<div class=""content"">\n	这个其实是有名的“绿闪（green flash）”现象。是一个大气光学现象，当日落时，太阳光从接近于平行地面的角度射来，由于通常海面温度较低，因此大气上疏下密，因而阳光呈一个向下弯曲的曲线进行折射。<br>\n<br>\n然而，由于短波长的光更容易被折射，因此短波长的绿、蓝光被大气更强烈的偏折，那么从观察者角度看去，实际上太阳具有了多个像：在红橙色的像偏上位置还有一个蓝绿色的像。<br>\n<img src=""https://3-im.guokr.com/ytSj3l4LSJ1QJHTCUEwwF2nZj9gsDyNKPM52SlP-3ckAAgAA-wAAAEdJ.gif?imageView2/1/w/480/h/235"" style=""max-width: 480px"" data-orig-width=""512"" data-orig-height=""251"" data-hashkey=""ytSj3l4LSJ1QJHTCUEwwF2nZj9gsDyNKPM52SlP-3ckAAgAA-wAAAEdJ""><br>\n因此，当太阳徐徐落下后，当长波长的像被阻挡时，绿色的像就会显现出来，而此时海面也比较暗，从而形成绿闪。由于像之间位置差异极小，因此之内在日落后的十余秒中观察到绿闪。这也是“闪”字的来历。<br>\n<br>\n由于蓝光更容易被大气散射，因此波长更短的偏蓝色的像不容易被观察到。但如果观察条件良好，还能观察到更罕见的“蓝闪”。<br>\n<img src=""https://3-im.guokr.com/fFjJnW1hrG6wkrYwZxoD0UMkk6ZlLJOhzxUhzesLDPJdAgAAxgEAAEpQ.jpg?imageView2/1/w/480/h/360"" style=""max-width: 480px"" data-orig-width=""605"" data-orig-height=""454"" data-hashkey=""fFjJnW1hrG6wkrYwZxoD0UMkk6ZlLJOhzxUhzesLDPJdAgAAxgEAAEpQ""><br>\n<br>\n所以可以看出，如果要观察到绿闪，那么所需的条件有，海面不能有云，海水足够平静，大气扰动小，大气密度上疏下密等。所以还是一个比较难以观察到的现象。<br>\n<br>\n<br>\n<h4><strong>内容来源</strong></h4>\n<a href=""http://www.guokr.com/question/585522/"">绿色的落日是怎么形成的？需要满足哪些条件？</a>fengfeixue0219，果壳网问答<br>\n<br>\n\n	</div>\n</div>","自然环境"
"水库惊现吃人塘鲺","恐怖！水库惊现吃人塘鲺！每年都有几人莫名溺水死亡，最近有个高官的子弟与朋友一起到水库游水溺死，才发现惊天秘密——竟然是一条有三米多长，头有一米多宽的吃人塘鲺，其肚中竟然有人的骸骨[1][2]！",0,"\n		","<div class=""rumor-content"">\n	\n	<h2>论证</h2>\n	<div class=""content"">\n	<h2><strong>流言溯源</strong></h2>\n从06年开始，就不断地有帖子称“某地水库惊现食人塘虱”。近两年来，这些谣言帖子屡败屡战，还配了图，声称其肚中有人的骸骨<a href=""http://www.guokr.com/article/95405/#id9"">[1]</a><a href=""http://www.guokr.com/article/95405/#id11"">[2]</a>。实际上，这些帖子中的解剖图片都来源于06年5月围观群众拍摄的北海海洋之窗工作人员在海洋馆门口的空地解剖和制作鲸鲨标本的照片<a href=""http://www.guokr.com/article/95405/#id13"">[3]</a>。这头鲸鲨由北海渔民捕捞于雷州近海海域。制成的标本目前正在海洋馆中展出。这些照片贴到网上后，便被网友移花接木，放到了谣言贴中。<br>\n<img src=""https://1-im.guokr.com/gkimage/hu/wa/tb/huwatb.png"" style=""max-width: 480px""><br>\n北海海洋之窗工作人员在海洋馆门口的空地解剖和制作鲸鲨标本。（图片来源：[3]）<br>\n一组鲸鲨解剖现场的图片+钓鱼分子+无知群众=骇人的吃人塘鲺。在自然界中，吃人的塘鲺和吃人的鲸鲨一样，从不存在。如果要说它俩有什么相似的地方，可能是它们都是鱼，都有一个扁扁的头吧。<br>\n<br>\n<h2><strong>塘鲺：“躺枪，我很无辜！”</strong></h2>\n塘鲺，又叫胡子鲶，是餐桌上的常客。因为喜欢动物性饵料，其肉质细嫩而味美。在中国南方分布广又容易养殖，水塘、河流、甚至稻田中都能见到它鬼祟的身影。这两个特点让它在南方的菜系中占了一席之地。不过，这位一直默默献身的胡子先生竟然也躺着中枪了——在这些“水库惊现吃人塘鲺”的帖子中，它被描述成了一个神出鬼没的巨型吃人怪物。<br>\n<br>\n胡子鲶科（Clariidae）是辐鳍鱼纲鲶形目的一科淡水鱼，人们通常把这个科的鱼类统称为塘鲺鱼。而最常见的塘鲺，是胡子鲶（ <i>Clarias fuscus</i> ，又叫塘角鱼）和革胡子鲶（ <i>Clarias lazera</i> ，又叫埃及塘虱）。胡子鲶是夜行性的杂食鱼类，以小鱼，虾，昆虫等动物性饵料为主。成年的胡子鲶通常体长仅有20~30厘米，革胡子鲶及埃及塘虱体型稍大。在合适的条件下，有的革胡子鲶能长到一米多长，称为巨型塘虱。2011年7月，广州岐头村的村民就在水塘里捕获了4条一米多长的塘鲺。也许是这些巨型塘虱，使其演变出了吃人的骂名，看来，长得太高也不总是一件好事啊！<br>\n<img src=""https://3-im.guokr.com/gkimage/me/li/cz/melicz.png"" style=""max-width: 480px""><br>\n塘鲺：我喜欢吃小鱼小虾，但不吃人哦！<br>\n<br>\n<h2><strong>鲸鲨：“我不是鲸，也不吃人，我是温柔的大鱼。”</strong></h2>\n鲸鲨（ <i>Rhincodon typus</i> ），因为名字中有个鲸字，常常被误认为是鲸鱼。实际上，鲸鱼属于哺乳纲鲸目，而鲸鲨却属于软骨鱼纲须鲨目，是一条不折不扣的大鱼。此外，因为身上布满了白色的块状斑，它们还有一个可爱的名字：豆腐鲨。鲸鲨在IUCN红色物种名录中属于易危种，它们分布于南北纬三十度范围内的热带和温带海域，在深海、近海、珊瑚礁形成的泻湖中都可见到。鲸鲨是滤食性的动物，在它们的菜单中，浮游生物和成群活动的小鱼才是主食，偶尔也会吃一些水母、鱿鱼和小的金枪鱼当点心，灵长类的某无毛生物对于它们来说，实在太大太难吃了。在鲸鲨性感的大嘴中，长着由密密麻麻的倒钩形牙齿组成的齿列，觅食时，它们把海水吸入大嘴中，再闭上嘴，把水从牙齿缝挤出来，美味就都留在嘴里啦！<br>\n<img src=""https://3-im.guokr.com/gkimage/e5/ea/qg/e5eaqg.png"" style=""max-width: 480px""><br>\n鲸鲨<br>\n<br>\n鲸鲨虽然有一张大嘴，却几乎没有杀伤力。早期的电影《大白鲨》让人们对鲨鱼布满了三角形利齿的血盘大口，悄无声息的潜行和迅猛的攻击产生了畏惧。但实际上，鲨鱼并不吃人，它们只有在受到惊吓或极度饥饿时才会攻击人类，并且通常只会咬一两口，因为对它们而言，人类的味道实在不怎么样。我们的主角鲸鲨更是一个温柔的主儿，它拥有庞大的身躯，脾气却一点儿也不暴躁。有潜水员靠近时，它们常常温和地与人同游，甚至会让潜水员帮忙清理身上的寄生虫。因此，鲸鲨常被当做鲨鱼的“形象大使”用来教育小盆友们，不是所有的鲨鱼都会吃人。<br>\n<br>\n<br>\n<h4><strong>参考资料</strong></h4>\n[1] <a href=""http://www.guokr.com/article/95405/"">“吃人塘鲺”现形记</a> 鸟人桃之妖妖 ，果壳网谣言粉碎机<br>\n<br>\n<br>\n\n	</div>\n</div>","神秘现象"
