"title","descrip","LiuyanType","answer","detail","type"
"折耳猫有天生的骨骼病","折耳猫有天生的骨骼病，一旦发作终身疼痛，不治，主人需要花费大量的金钱给予治疗和保护，大量的精力和时间，现在很多国家已经禁止繁育折耳，他们的带病基因是百分百的。",2,"\n		","<div class=""rumor-content"">\n	\n	<h2>论证</h2>\n	<div class=""content"">\n	有一个名为“Fd”的基因，决定了猫耳朵的状态，这个基因和猫的软骨生长有关，猫带有Fd显性基因时，软骨的生长就可能变得不正常，最直接的表现就是猫的耳朵立不起来。Fd基因位于猫的常染色体上（就是说这个基因的传递与性别无关）。正常猫的这两个等位基因都是隐性，这猫的基因型就写作fdfd，它的耳朵肯定是正常直立的。 <br>\n <br>\n最要命的是，这种病是由猫本身的遗传缺陷造成的，根本没法根治，只能靠医疗手段缓解猫的痛苦。 <br>\n <br>\n现在，虽然人们通过将折耳猫与美国短毛猫或英国短毛猫等其他品种交配，能得到比较健康的折耳猫，但是，这些携带Fd基因的猫仍然存在不小的健康隐患，也有研究表明，只要带有显性的Fd基因，猫骨骼发生病变的危险就会增加，只不过与FdFd型的猫相比，发病程度更轻，发病年龄更大而已。 <br>\n <br>\n对想养猫的人建议，尽量还是不要饲养这种小猫了，因为过多的市场需求只会意味着让这种终生受苦的小猫更多。 <br>\n <br>\n <br>\n<h4><strong>参考资料： </strong></h4>\n[1] The Feline Patient <br>\n[2] Osteochondrodysplasia in Scottish Fold cats R MALIKa, GS ALLANa, CR HOWLETTb, DE THOMPSONc, G JAMESd, C McWHIRTERe and K KENDALLf Aust Vet J Vol 77, No 2, February 1999 <br>\n[3] Genetic Characteristic of the Usual Form of the Polydactyl Gene in Cats: Especially Maine Coon Cats By Janet Marr <br>\n[4] <a href=""http://www.guokr.com/question/349762/"">苏格兰折耳猫，养它图什么？</a>SILENTGHOST，果壳网自然控<br>\n \n	</div>\n</div>","宠物花草"
"“黑色星期天”听了真的会死人","原版的“黑色星期天”曲子听了真的会让人抑郁而自杀，但是考虑到其危险性，现在网络上流传的都不是原版了。",1,"\n		","<div class=""rumor-content"">\n	\n	<h2>论证</h2>\n	<div class=""content"">\n	 《黑色的星期天》是匈牙利自学成才的作曲家赖热·谢赖什（Rezső Seress，1899－1968年）谱写于1933年的一支歌曲。据说，《忧郁的星期天》是赖热·谢赖什和他的女友分手后在极度悲恸的心情下创作出来。据称由于歌曲中流露出慑人心魄的绝望神绪，导致了数以百计的人在听了它后结束了自己的生命。这支歌遂被冠以“匈牙利自杀歌”的称号，甚至一度遭到了BBC等国际知名电台的禁播。<br>\n<br>\n但是，并没有实质法律文献、期刊和出版物能证实该自杀数字。这有可能是当时的乐商为了促销而凭空捏造，而近些年来网络发展使《忧郁的星期天》的自杀传闻广泛流传。<br>\n<br>\n<a href=""http://www.guokr.com/post/8064/"">http://www.guokr.com/post/8064/</a>\n	</div>\n</div>","传说轶事"
"阿司匹林可以缓解鲜花枯萎","阿司匹林可以缓解鲜花枯萎",0,"\n		","<div class=""rumor-content"">\n	\n	<h2>论证</h2>\n	<div class=""content"">\n	影响瓶插时间的几个因素主要是杂菌生长阻碍吸水和缺乏营养（毕竟是无根之人了）。加阿司匹林是一个比较古老的方法，但是现代通过研究并没有发现有显著延长瓶插时间的效果，起码不如加勺糖简便有效。<br>\n<br>\n<a href=""http://www.guokr.com/question/427122/"">http://www.guokr.com/question/427122/</a>\n	</div>\n</div>","宠物花草"
"古人养青蛙灭蚊，效果拔群","在科技落后的古代，人们发明了一种神奇的办法来防蚊，就是在家里准备一个盛着水和石头的大缸，在缸里养一些青蛙，蚊子喜欢阴凉，一飞进缸里，自然而然就成了青蛙的口中餐。这足以见得古人的聪明智慧，不仅远离了蚊虫的困扰，而且还低碳健康，保护环境。",0,"\n		","<div class=""rumor-content"">\n	\n	<h2>论证</h2>\n	<div class=""content"">\n	蚊子为什么爱水缸？可不是为了清凉避暑，而是为了产卵。大多数蚊科的卵、幼虫、蛹都生活在水里。水里的生活大概要占蚊子一生的80%。一旦羽化，蚊子的成虫就会在几天内交配，之后雄虫死去，而母蚊子会去吸血。吸饱血，母蚊子会用大概一周的时间消化，等待卵成熟。之后便会找一块死水产卵。<br>\n<img src=""https://2-im.guokr.com/qbWUZbiRTRhZbiWPE-jarE2Y6ZVs47UidY3icVGDeti8AgAA4gEAAEpQ.jpg?imageView2/1/w/480/h/330"" style=""max-width: 480px"" data-orig-width=""700"" data-orig-height=""482"" data-hashkey=""qbWUZbiRTRhZbiWPE-jarE2Y6ZVs47UidY3icVGDeti8AgAA4gEAAEpQ""><br>\n对于城市或者家庭，防蚊的关键是消灭死水坑，而不是主动给它们提供幼儿园（水缸）。<br>\n<br>\n那蛙类是不是灭蚊能手呢？<br>\n<br>\n中国大陆常见的虎纹蛙、金线蛙、黑斑蛙、泽蛙、林蛙、中华大蟾蜍等，它们成体的食物中，蚊子所在的双翅目只占其数量的1%左右，占大头的是各种鞘翅目、鳞翅目。而它们的蝌蚪，可能会吃一些孑孓（也就是蚊子的幼虫），但也不是其主要食物。其实，生物灭蚊的话，还不如养一些金鱼，它们可能更爱吃孑孓。<br>\n<br>\n<h4></h4>\n<h4><strong>内容来源</strong></h4>\n<a href=""http://www.guokr.com/question/488312/"">古人用青蛙驱蚊？青蛙吃蚊子吗？ </a>瘦驼，果壳网果壳问答\n	</div>\n</div>","传说轶事"
"宠物猫狗吃巧克力会中毒","巧克力中含有可可碱，人可以很快地通过肝脏和肾脏将可可碱处理并排出体外，而猫狗排出可可碱就慢得多，吃多了会中毒而死。",2,"\n		","<div class=""rumor-content"">\n	\n	<h2>论证</h2>\n	<div class=""content"">\n	<h2><strong>人类美食，宠物毒药</strong></h2>\n巧克力是最让人愉悦的食物之一，不过，对狗和猫来说，它却是和除草剂、防冻液、耗子药齐名的致命剧毒。巧克力中含有可可碱，它是巧克力带给人快感的源泉，同咖啡因和茶碱一样，可可碱也是植物用来防备动物取食的毒剂。人可以很快地通过肝脏和肾脏将可可碱处理并排出体外，而猫狗排出可可碱就慢得多，吃多了会中毒而死。这方面猫比狗要走运，因为猫对甜味不敏感，巧克力和水果对猫来说味同嚼蜡，而大多数狗则喜爱甜食（这也与从小的饮食习惯有关）。<br>\n <br>\n根据著名的兽医手册Merck Veterinary Manual中的剂量说明，29g的牛奶巧克力（约1.5块最小号的德芙牛奶巧克力）会让一只3公斤的小型犬（博美、吉娃娃等）产生呕吐、痢疾、剧渴等症状，而80g牛奶巧克力（4块最小号的德芙牛奶巧克力）就可能让3公斤的小型犬类有死亡危险了。这方面猫比狗要走运，因为猫对甜味不敏感，巧克力和水果对猫来说味同嚼蜡，而大多数狗则喜爱甜食（这也与从小的饮食习惯有关）。 <br>\n<br>\n<br>\n<h2><strong>水果也可能带来问题</strong></h2>\n水果对人类好处多多，对猫和狗也不啻于毒药。比如葡萄和葡萄干，狗吃了有可能引起肾衰竭并可致命，虽然视狗的品种和体质不同，有的狗吃点葡萄看起来也没什么反应，但为了狗的健康，别给它们吃这些东西。而其他水果也有可能引起狗的呕吐和腹泻。<br>\n <br>\n <br>\n<h4><strong>参考资料：</strong></h4>\n[1] <a href=""http://www.guokr.com/article/2213/"">节日吃大餐，管住宠物嘴</a>，SILENTGHOST，果壳网自然控<br>\n\n	</div>\n</div>","宠物花草"
"百合花对猫有致命毒性","对猫而言，单咬一口百合叶或花瓣、从它的爪子舔舐百合花粉或喝下来自装有百合切花花瓶的水，都可能会致命，百合花中毒的症状包括呕吐、昏睡或失去食欲，百合简直就是猫咪的天敌。",2,"\n		","<div class=""rumor-content"">\n	\n	<h2>论证</h2>\n	<div class=""content"">\n	在人类的幻想中，如果世界上真有什么浪漫的动物觉得花瓣很美很香甜很轻舞飞扬，很想扑倒之后顺便吃下——那就必定是猫咪了。其实，猫科动物的生活真有那么浪漫。猫猫们确实爱吃花，而且吃的范围还很广泛。<br>\n<br>\n<h2><strong>猫猫都是花痴</strong></h2>\n不养猫的人很少注意到猫爱吃花。因为在绝大多数人的印象里，自愿和人类一起生活的猫都是独来独往的食肉猎手，猫也确实很难消化肉类以外的植物。猫甚至无法品尝甜味，因为它们已经在进化历程中丧失了消化碳水化合物的能力。<br>\n<br>\n尽管猫猫是肉食主义者，吃植物会使它们生病，但猫就是喜欢吃花花草草。许多花草猫吃了可能会呕吐、抽搐、肝功能衰竭，甚至死亡。但是这些吃花的孤独猎手就是不肯多长些记性，哪怕一吐再吐，好多猫也会反复吃那些让它们生病的花，所以猫主人要记得看好它们哦。<br>\n<br>\n<h2><strong>猫猫有意，花花无情</strong></h2>\n很多植物对猫都是有毒的。其中毒性较大的有：蓖麻子、熟地、山谷百合（铃兰）、日本红豆杉、夹竹桃、杜鹃花、绣球（八仙花）。一粒蓖麻子就能把猫咪活活毒死，而槲寄生也是致命的。<br>\n<br>\n喇叭花（牵牛花）、水仙、鸢尾、风信子、金银花等花草也都是有毒的。圣诞树（比如冷杉、云杉）、松针、甚至圣诞树底部周围的水都会让猫的口腔发炎、呕吐、腹泻、嗜睡、发抖、后腿无力。一品红不算很毒，但可能会导致肠胃刺激和呕吐。<br>\n<br>\n通常人们并不把百合科的植物放在常见有毒植物之列，但是百合科植物却能让猫咪们病得很重。一些兽医和毒理学家认为，百合科植物是引起猫急性肾功能衰竭的一个主要原因。<br>\n<br>\n<h2><strong>如果猫猫不幸吃了毒花怎么办？</strong></h2>\n为了救治吃花中毒的猫咪，你和你的兽医一定得猜中猫猫究竟吞下了哪种花儿。有时候，同一种花儿除了学名之外还会有各种不同的俗名，可能会让兽医误判病情。因此，一定要确保你说的花儿和兽医说的花儿是同一种植物。建议猫主人不妨带着被猫猫啃过的花一起去宠物医院，以便兽医核实。或者到花店或苗圃，请花店员工或苗圃园艺师帮助鉴定花的品种。<br>\n<br>\n<br>\n<h4><strong>参考资料：</strong></h4>\n[1] <a href=""http://www.guokr.com/article/110663/"">猫咪吃花，等于自杀</a>，神丙，果壳网谣言粉碎机\n	</div>\n</div>","宠物花草"
"牛奶可能引起猫咪消化不良","牛奶对人来说是营养丰富的饮料，但喂猫喝牛奶可不好。而猫成年之后体内这种酶的含量会下降甚至消失，在这种情况下，喝牛奶就会发生乳糖不耐症，所以有些猫喝了奶以后会拉肚子",2,"\n		","<div class=""rumor-content"">\n	\n	<h2>论证</h2>\n	<div class=""content"">\n	牛奶对人来说是营养丰富的饮料，还能补钙，但喂猫咪喝牛奶可不一定好。<br>\n<br>\n小猫喝牛奶其实是没事的，但很奇怪，大猫却不能喝。牛奶中有种成分叫乳糖，想消化乳糖就得能合成乳糖酶，而猫成年之后体内这种酶的含量会下降甚至消失，在这种情况下，喝牛奶就会发生乳糖不耐症，所以有些猫喝了奶以后可能消化不良拉肚子，还可能会因为过敏而发生皮肤瘙痒。<br>\n<br>\n<h4><strong>参考资料：</strong></h4>\n[1]<a href=""http://www.guokr.com/article/69/"">对猫有害的各种食物</a>，万恶的星期二，果壳网自然控\n	</div>\n</div>","宠物花草"
"百慕大三角灵异事件","传闻，由于百慕大三角的环境极度反常，许多经过的船只、飞机及人员会“神秘失踪”。",0,"\n		","<div class=""rumor-content"">\n	\n	<h2>论证</h2>\n	<div class=""content"">\n	美国海岸防卫队、各海洋保险公司及各界引用《全球海洋失事地点》统计资料证明，百慕大三角的船只和飞机的失踪数字，比其他繁忙地区还要少。保险业界也证实了百慕大三角并不是危险的海域。数十年间，不少所谓的“谜团”已经解开。根据许多精密的科学及事件起源考察，谜团不过是对失踪事件的长期误解、误传，甚至是夸大，并非想象中那样不可思议[1]。 <br>\n<br>\n早期人们在航海过程中，由于天气原因、海盗袭击、航海知识和舰船结构等问题，遭遇了非常多的事故。飞行器也是同理。这种事故在全球范围都有发生。由于这些事故通常都没有生还者，所以造成事故的具体原因不得而知[2]。<br>\n<br>\n另外，位于百慕大三角一顶点的百慕大群岛还是加勒比海地区著名的旅游胜地[3]。<br>\n<br>\n<h4><strong>参考资料</strong></h4>\n[1]<a href=""http://zh.wikipedia.org/wiki/%E7%99%BE%E6%85%95%E5%A4%A7%E4%B8%89%E8%A7%92#.E7.A7.91.E5.AD.B8.E7.A0.94.E7.A9.B6"">百慕大三角</a><br>\n[2]<a href=""http://www.history.navy.mil/faqs/faq8-1.htm"">The Bermuda Triangle</a><br>\n[3]<a href=""http://zh.wikipedia.org/wiki/%E7%99%BE%E6%85%95%E9%81%94%E7%BE%A4%E5%B3%B6"">百慕大群岛</a>\n	</div>\n</div>","传说轶事"
"猫发出呼噜声是意味着高兴","吃饱后或者被人抚摸时候的猫咪经常发出呼噜呼噜的声音，这是它们感到高兴的证据。",1,"\n		","<div class=""rumor-content"">\n	\n	<h2>论证</h2>\n	<div class=""content"">\n	绝大多数情况下是这样的，不过，猫发出呼噜呼噜的声音，就好比人微笑。人未必只有在自己高兴的时候才微笑，猫也是这样。呼噜声能让猫放松，也能稍微减轻猫的病痛，所以完整的说法应该是猫在高兴，受伤或者想让自己舒服时都会发出呼噜呼噜的声音。[2]<br>\n<br>\n科学家发现猫是通过喉部和膈肌的间歇性振动来制造呼噜声的。猫在呼气和吸气的过程中能持续地打呼噜，声音频率在25到150赫兹之间。许多研究显示，这一频段的声音能有助于提高骨骼密度，促进伤愈。[1] <br>\n<br>\n说猫咪呼噜的时候是高兴和满意听起来很有爱，但更靠谱的说法应该是：呼噜是猫的一种交流方式，同时也是自我疗伤的秘方。<br>\n<br>\n<h4><strong>参考文献：</strong></h4>\n[1]<a href=""http://www.scientificamerican.com/article.cfm?id=why-do-cats-purr"">http://www.scientificamerican.com/article.cfm?id=why-do-cats-purr</a> <br>\n[2] 养猫养狗，当心误区，SILENTGHOST，果壳网自然控 <br>\n\n	</div>\n</div>","宠物花草"
"地球是外星人囚禁人类的场所","美国生态学家爱丽丝·席尔瓦博士表示，人类是被外星人送到地球的：",0,"\n		","<div class=""rumor-content"">\n	\n	<h2>论证</h2>\n	<div class=""content"">\n	追溯了一下新闻的起源，最早是UFO探秘网在2011.1.1发表的。而UFO探秘网又给了一个台湾网站的原文链接。<br>\n<br>\n如果真是大新闻，相隔这么久才被各大网站竞相转载，反应也太慢了吧。最近火起来的原因，应该是所谓的美国生态学家爱丽丝·席尔瓦博士近日出版了新书《HUMANS ARE NOT FROM EARTH：A SCIENTIFIC EVALUATION OF THE EVIDENCE》。她在书中发表观点称，人类的起源并不在地球，而是在20万年至6万年前被外星人送至地球。<br>\n<br>\n<br>\n<img src=""http://img.jrjimg.cn/2014/04/20140408111055231.jpg"" style=""max-width: 480px""><br>\n至于后面所谓的证据，最有科学味儿的就是这张图了。查了下来源，是2001年的图，JAXA上有说明。<br>\n图中深色的部分被称为“质量瘤”(mascon)，重力较强。新闻中称：<br>\n<br>\n正面有几颗强力瘤的重力场是相当强大的，情况与地球完全不同，这些瘤的强大重力场发射出来后，会多次相交而巧妙的共振会合，之后被放大变成一道极其强大的光束磁场穿透入地球的重力场上，成功的改变地球的潮汐及地核运动，也会影响到动物的情绪，植物的生长周期及各种生命现象。<br>\n<br>\n仔细看下图示，重力的单位是mgal，即<img src=""http://img1.guokr.com/formula/b8101d592e8f030942fb70bb1ee814d58c6eed22.svg"" class=""edui-faked-insertmathjax"" data-code=""10^{-5}~m/s^2"" style=""max-width: 480px"">. <br>\n月球表面重力的差异，大约只有月球平均重力的1%，根本算不上“强大”。并且，JAXA上对此的描述如下：<br>\n<br>\n将月球重力分布图和月球形貌图对比，发现质量瘤的位置和大型环形山的位置一致。因此可以这么解释，在月球形成初期，陨石对月球的撞击引起了月幔下岩石的压缩，或是岩浆的聚集。<br>\n<br>\n至于其他的“证据”，全是捏造的，完全没有科学证据。<br>\n<br>\n<h4><strong>参考资料</strong></h4>\n[1]<a href=""http://www.guokr.com/question/551156/"">人类是被外星人囚禁在地球上的吗？</a> Fymanon，果壳网果壳问答<br>\n\n	</div>\n</div>","传说轶事"
"奥运会的游泳运动员会在水中尿尿","奥运会的游泳运动员会在水中尿尿。",2,"\n		","<div class=""rumor-content"">\n	\n	<h2>论证</h2>\n	<div class=""content"">\n	美国国家队的游泳运动员Carly Geehr 在Quora上回答了这个问题：<br>\n「Nearly 100% of elite competitive swimmers pee in the pool. Regularly. Some deny it, some proudly embrace it, but everyone does.」<br>\n<strong>几乎100%的游泳运动员在池里尿过。</strong>有些人拒绝承认，有些人很坦然，但每个人肯定都干过。<br>\n<br>\n更有趣的问题是“什么时候尿的”？<br>\n<ul><li>在蛙泳蹬腿的时候，很自然的就会尿出来。另外，比赛的时候神经都绷紧，根本没有心思在想自己是不是在尿尿。</li><li>比赛开始前是一个有趣的时间点。是否尿尿要看当时的情况。每个人都希望在游泳之前尿出来，但是有时候身体不听使唤，甚至你的膀胱又会不断被充满。肾上腺素和紧张感正在吞噬你，我知道成百上千的运动员不惜一切代价想在赛前尿出来。但是，爬上跳板了尿尿会被看穿，所以入水的那一刻是释放自己最好的时机。（剩下的自行脑补吧！）「译者云：原来脑补的英文是“I'll let you finish the rest of that thought”」</li><li>热身/练习时-绝对的好时机。作为一个游泳运动员，你不得不接受尿在泳池里。我曾有个队友会坐在池璧旁边大喊“我在尿尿！”，不觉得这很恶心，至少她在好心提醒我们。我很确定的告诉你们，我曾经跟着一个正在开闸放水的人后面游着。</li></ul>\n<br>\n提到水下摄像机拍到了（实际上没拍到）奥运会游泳选手在比赛时嘘嘘一事，他们根本不可能拍到 。﻿只有他们告诉你，或者他们坐过的地方有一滩水时，你们才能确定他是否尿了。尿在水中扩散的很快，你越动，他扩散的越快。<br>\n<br>\n<h4><strong>参考资料</strong></h4>\n[1]<a href=""http://www.guokr.com/question/297838/"">奥运会的游泳运动员会在水中尿尿吗</a>？ forkintheroad，果壳网果壳问答<br>\n\n	</div>\n</div>","传说轶事"
"汶川地震、日本地震和马航失联客机的日期有关联","2008+5+12=2025（汶川地震）2011+3+11=2025（日本地震）2014+3+8=2025（马航飞机失联) 每次时隔三年，每次相同数字，这是一种预示。",0,"\n		","<div class=""rumor-content"">\n	\n	<h2>论证</h2>\n	<div class=""content"">\n	这个现象确实值得认真讨论——要知道，年月日之和恰好相等，这并不是一件常见的事。从 2000 年 1 月 1 日到 2011 年 3 月 11 日，一共有 4087 天；其中年月日之和恰好也是 2025 的只有 135 天，只占大约 3%。而汶川地震的日期正好就在这 3% 里。<br>\n<br>\n真的就有这么巧吗？其实这一点也不奇怪。要想用心制造一个巧合，简直是易如反掌。如果年月日之和不相等，月和日之和没准是相等的；如果月日之和也不相等，加上时分秒之类的或许就相等了。即使怎么加都对不上，我们还能计算 20110311 和 20080512 中的各位数字之和，或者前四位与后四位之和等等。万一这还编不出巧合，还可以拿 2011 年 3 月 11 日跟玉树地震的日期比一比，或者跟唐山大地震的日期比一比，或者跟玛雅文明预言的末日 ——2012 年 12 月 22 日——也来比一比⋯⋯<br>\n<br>\n你别说，要花功夫多试一试，还真能把几个日期都联系在一起。唐山大地震是 1976 年 7 月 28 日，1976+7+28＝2011，是否就表明 2011年大地震将会卷土重来呢？看来，制造一个阴谋论并不难嘛。把其它几个日期也在纸上写写画画，没准也有惊人的结果。人的创意是无穷的，而数字翻过去翻过来也就只有那么几个。凑不出一个“巧合”来，反而奇怪了。<br>\n<br>\n英国数学家理查德•盖伊（Richard Guy）对数学上的巧合现象非常感兴趣。1988 年，他收集整理了 35 个纯数学领域中的巧合现象，在 《美国数学月刊》（American Mathematical Monthly）上发表了一篇极具幽默色彩的论文。 <br>\n <br>\n在论文中，盖伊对看似不可思议的数字巧合作出了一个解释：数学研究对象千奇百怪，而日常生活中用得到的正整数却只有那么多，因而难免会发生巧合。我们可以对数字进行加、 减、乘、 除、乘方、开方、阶乘、对数、取整、取余等上百种操作，利用这些运算又能定义出质数、组合数、三角形数、完全平方数等满足各种性质的“某某数”⋯⋯正整数可以做的事情太多了，可以用的正整数却只有那么多，发生巧合是很正常的事情。<br>\n<br>\n用一句最简单的话来说，就是“数学涉猎太广，小数不够用了”。“小数定律”（strong law of small numbers），这个解释各种数学巧合现象的定律，便由此得名。 <br>\n <br>\n<h4><strong>参考资料 </strong></h4>\n[1]<a href=""http://www.guokr.com/article/13181/"">【地震特辑】汶川地震＝日本地震？</a>matrix67，果壳网谣言粉碎机<br>\n \n	</div>\n</div>","传说轶事"
