"title","descrip","LiuyanType","answer","detail","type"
"太阳表面出现不明飞行物","且不论该物体是为何物，但毋庸置疑的是，它能够抵抗太阳表面的超高温度，也不受太阳耀斑的影响，这实在让众人疑惑：“它到底是什么”。据悉，发现此物体的是NASA“太阳与日光层观察卫星”，它于1995年2月启用，观测的范围范围包括太阳核心、外层日冕及太阳风暴。",0,"\n		","<div class=""rumor-content"">\n	\n	<h2>论证</h2>\n	<div class=""content"">\n	对于天文爱好者来说，很明显这张照片是NASA的太阳和太阳风层探测器（SOHO）的广角分光日冕仪C2（LASCO C2）拍摄的。顾名思义，LASCO观测的是太阳的日冕，也就是太阳的高层大气。在地球上，由于大气层的散射，靠近太阳的日冕完全被淹没在刺眼的阳光之中，只有在日全食那短短几分钟内，月亮把太阳全部遮挡时，我们才能用肉眼看见日冕。这也是天文学家要发射卫星到大气层外观测太阳日冕活动的原因之一。<br>\n<br>\n<img src=""https://1-im.guokr.com/gkimage/t8/pu/zy/t8puzy.jpg"" style=""max-width: 480px""><br>\n<br>\nLASCO由3台视场不同的日冕仪构成，橙色是LASCO C2的标志色，视场范围是太阳直径的2-6倍。上图就是一张典型的C2照片，中间的白圈标明了太阳的位置和大小，黑圈则是阻挡阳光用的遮板，再外圈呈发射状向外辐射的就是日冕了。这样的照片是单张曝光26拍到的，每12分钟拍摄一张并传回地球。所有照片都可以在SOHO探测器的主页[1]上查到，不存在任何阴谋论的可能。<br>\n<br>\n其次，这张照片真实吗？<br>\n<br>\n其实刚才用来举例子的图片，就是这次引起大家关注的那张照片，照片的左下角标明了拍摄时间，是2012年4月24日08点12分（世界时，北京时间16点12分）。这张照片是从SOHO主页上下载的，可见照片完全是真实的。但问题在于，照片是真实，照片上拍到的东西就真实吗？<br>\n<br>\n利用SOHO主页上下载了这张照片前后接连拍摄的另外几张照片，做了一段GIF动画。从这段动画中明显可以看出，这个所谓的“不明飞行物”，只出现在这一张照片上而已，前面两张和后面两张照片上完全没有它的踪迹。<br>\n<img src=""https://2-im.guokr.com/gkimage/w1/kf/he/w1kfhe.png"" style=""max-width: 480px""><br>\n<br>\n事实上，如果你足够仔细的话，在连续5张照片中，你会看到很多只在一张照片上闪现的条纹或者斑点。这些东西跟所谓的“不明飞行物”一样，都是太空中飞行的带电粒子撞上拍摄照片用的CCD而产生的不真实影像。CCD现在已被广泛应用于各类数码相机，原理是将光信号转换成电信号，从而记录图像。如果带电粒子撞上CCD，这样的电信号也会被记录下来，在照片上表现为一条光迹或者一个亮点，有时候也会产生“不明飞行物”这样的复杂形状。而在太空中，由于没有地球大气层的防护，这样的带电粒子（主要来自于太阳）更是会横冲直撞，所以几乎每张SOHO照片上，都可以看到这样的东西。<br>\n<br>\n<h4><strong>参考资料</strong></h4>\n[1]<a href=""http://sohowww.nascom.nasa.gov/"">http://sohowww.nascom.nasa.gov/</a><a href=""http://sohowww.nascom.nasa.gov/"">http://sohowww.nascom.nasa.gov/</a><br>\n[2]<a href=""http://www.guokr.com/question/164899/"">NASA图显示太阳表面现不明飞行物 形似航母(图)?是怎么回事？ </a>Steed，果壳网果壳问答\n	</div>\n</div>","神秘现象"
"人的尿液能把树木烧死","对树尿尿会把树根烧烂的，尿的浓度太高了",2,"\n		","<div class=""rumor-content"">\n	\n	<h2>论证</h2>\n	<div class=""content"">\n	腌黄瓜就是调味汁太浓了，把黄瓜里的水都吸出来了。“烧苗”的原理是一样的。土壤溶液浓度太浓了，把根里的水都吸出来了。<br>\n<br>\n正常人尿液中大概含有3%-4%的固体物质（大量喝水的人不算）。也就是说1升尿液中，大约有30-40克的。而盐碱地的土壤溶液浓度大约是30克/升。结果很清楚了，我们的尿液相当于盐碱地环境。另外，尿液有可能是弱碱性的（视食物种类而定），会改变土壤的酸碱性，这也会影响到植物，特别是喜欢酸性土壤植物（比如茶树）的生存。<br>\n<br>\n当然，我们的尿液不会非常多，偶尔一两次并不会引起变化，但是经年累月的在一个地方对着一棵树浇，恐怕还是会出问题的。<br>\n<br>\n<h4><strong>参考资料</strong></h4>\n[1]<a href=""http://www.guokr.com/question/201316/"">人的尿真能把树木烧死？ </a>史军，果壳网果壳问答\n	</div>\n</div>","宠物花草"
"向日葵一直面向太阳","向日葵顾名思义，会一直面向太阳，随着太阳的起落而转动。",0,"\n		","<div class=""rumor-content"">\n	\n	<h2>论证</h2>\n	<div class=""content"">\n	到目前为止，虽然向日葵转头的机制还不清晰，但是有一点是可以肯定的，向日葵并非一直会转动。在花芽时期，它们的花会随着太阳自东向西转动，但是在完全开放后，花盘基本上就固定不动了。并且绝大多数都指向东方了。<br>\n<br>\n至于转动的机制有两种观点：<br>\n<br>\n1.光对生长素影响，这是目前传播最广的观点。光照会影响生长素的分布，受光照一侧的生长素浓度低，背光一侧的生长素浓度高。这种分布的不均匀会影响不同部位的分裂速度，于是出现了随太阳转动的想象。至于夜晚的时候，转回来，是由于重力影响生长素的分布。在开花后，茎生长减缓，基本固定了，但是仍有很小范围的摆动。<br>\n<br>\n2.热的影响。还有一个观点认为，光对向日葵没有影响，特别是冷光对于向日葵的转动没有影响。但是，热却会影响向日葵的转动。通过影响花盘的纤维收缩，促使花盘转动。如果在向日葵旁边放置火盆，向日葵的花盘就会朝着火盆。但是未见到实验数据。<br>\n<br>\n总的来说，“光照·生长素”说还是比较靠谱的。<br>\n<br>\n<h4><strong>内容来源</strong></h4>\n<a href=""http://www.guokr.com/question/263075/"">向日葵有可能不向着太阳长吗？ </a>史军，果壳网果壳问答\n	</div>\n</div>","宠物花草"
"水果分公母，品质有差别","一、橘子和西瓜：“肚脐”大的是母，小的是公，母的味道好。二、脐橙：和橘子一样，也是按“肚脐”的大小分“公母”。三、番木瓜：公瓜椭圆形，身重，核少肉结实，味甜香。母瓜身稍长，核多肉松，味稍差。四、梨：母梨脐部圆而凹入，细腻味甜；公梨脐部不整齐而凸出，质粗味淡。",0,"\n		","<div class=""rumor-content"">\n	\n	<h2>论证</h2>\n	<div class=""content"">\n	<h2><strong>橘子和西瓜</strong></h2>\n位于果实顶部（即与果柄相对位置）的“脐”，其实就是脱落的花器官在果实上留下的永久疤痕。橘子的“肚脐”是花柱脱落的痕迹，多数是点状的；西瓜的“肚脐”有时还多了一个环，那是花冠（包括花瓣和萼片）曾经着生的证明。这些疤痕主要是运输水分和养料的维管束的残迹，因为下方的果皮组织发育速度通常比果实的其他部分慢（甚至不发育），所以形成一个略微凹陷的“脐”。并且因为不同果实这一部分的果皮发育速度也有很大差别，所以同一品种的橘子或西瓜中能看到不同大小、由点状到环状的脐部。脐部的大小在不同果实中是连续分布的，不存在明显的界限来划分公母（随机买二斤橘子，按脐部大小排成一排就看出来是渐变的了），也没有任何证据表明脐部这一小块果皮的发育与果实的味道相关。<br>\n<br>\n<h2><strong>脐橙按“肚脐”的大小分“公母”</strong></h2>\n脐橙的“肚脐”和橘子西瓜的成因不同，结构也比较复杂。由于基因突变，导致这个部位的细胞分化成果肉，形成了一个具有橘瓣状结构但发育不完全的副果。副果的膨大撑裂了脐部的果皮，在果实顶部留下了形如人类肚脐的疤痕，脐橙因而得名。在同一品种的脐橙中，副果的大小也是在一定范围内连续变化的，不存在明显的界限可供划分“公母”。国内外关于脐橙质量评定和分级的标准都没有提及副果[1][2]，也未见任何研究报道将副果的形态与果实品质建立关联，所以用“肚脐”形状判断脐橙的味道是不靠谱的。<br>\n<img src=""https://1-im.guokr.com/gkimage/z8/3a/dg/z83adg.png"" style=""max-width: 480px""><br>\n<blockquote><span style=""color: #999999;"">脐橙（右图示去皮副果位置和结构），图片来自orfresh.com和维基百科。</span></blockquote>\n<br>\n<h2><strong>番木瓜</strong></h2>\n研究发现，同品种番木瓜的果实重量和果肉厚度都与种子数量显著正相关，也就是说，种子越多，果实就越重，果肉也越厚[3]。这一事实和民间流传的判断截然相反。由于同品种番木瓜的果实形态（此处仅指商业化种植的、由雌株经异株授粉结出的果实）比较一致，传说中的分公母方法倒像是对两种不同品种番木瓜的描述——而比较品种间的优劣不是本文的讨论范畴。另外，因为两性植株的花和果实发育并不稳定，有可能结出形态各异的异型果。这样的果实品质不好，需要注意，不过它们通常也不会进入市场。<br>\n<img src=""https://1-im.guokr.com/gkimage/uy/yy/d9/uyyyd9.png"" style=""max-width: 480px""><br>\n<blockquote><span style=""color: #999999;"">番木瓜 *Carica papaya* ，从左至右为雄花、雌花和结满果实的雌株，图片来自维基百科。</span></blockquote>\n<br>\n<h2><strong>母梨味甜，公梨味淡？</strong></h2>\n所谓的“公梨”、“母梨“其实是“宿萼果”和“脱萼果“的区别。梨的果实是一种假果，大部分果肉由包围子房的筒状花萼发育而来，这种类型的果实叫“梨果”，是蔷薇科苹果亚科特有的果实形态，具有这种果实形态的水果除了梨还有苹果、海棠、山楂等。在梨的果实发育过程中，萼筒组织通常按果肉的方式发育，细胞壁薄，内含大量的水和糖分，萼片则很早脱落，成熟果实形成圆而凹入的脐部，称为“脱萼果“。然而，部分果实的萼筒组织顽固地按照花萼的方式生长，这可能导致果皮变厚，内部的输导组织更发达，大量的细胞壁增厚而形成坚硬的“石细胞“，萼片不仅不脱落，还长得更加肥厚，于是成熟后果实则具有不整齐而凸出的脐部，称为“宿萼果”。宿萼果严格来说是不正常的果实，吃起来硌牙（因为石细胞多），甜味也淡。梨的宿萼果和脱萼果比例在不同品种中不一样，同时还受到树龄、修剪、光照、授粉和植物激素等很多方面的影响，具体的机制现在还不清楚[4]。相关的研究几乎都见于库尔勒香梨，可能是因为这一品系宿萼果和脱萼果的品质差别比较大，而在其他品种中这二者的品质有时是相同的，比如“秋月”[5]。<br>\n<br>\n因此，按脐部形状判断味道的方式仅适用于库尔勒香梨，对其他梨没用。另外，苹果等其他蔷薇科苹果亚科的果实不存在宿萼果和脱萼果的区分，类似方法也是没有意义的。<br>\n<br>\n库尔勒香梨是常见水果中唯一一种能以外形差异判断口味的，而且这种判断方法是有科学依据的。不过，相信“公母”之说也只是来自新疆梨农的幽默感，和水果的性别并没有关系。然而这种方法被错误地推广到其他水果之中，如今甚至煞有介事地变成了“科学知识”广为传播……好在只是让人们在挑选水果时多做了点无用功而已，没有多大害处。<br>\n<img src=""https://2-im.guokr.com/gkimage/cl/dz/yo/cldzyo.png"" style=""max-width: 480px""><br>\n<blockquote><span style=""color: #999999;"">库尔勒香梨，左为宿萼果（“公梨”），右为脱萼果（“母梨”），图片来自51751.com和nes.gov.cn</span></blockquote>\n<br>\n<br>\n<h4><strong>参考资料</strong></h4>\n[1] Rangannaa S., Govindarajan V. S., Ramanac K. V. R. &amp; Keffordd J. F.，1983. <a href=""http://www.tandfonline.com/doi/abs/10.1080/10408398309527366"">Citrus fruits—Varieties, chemistry, technology, and quality evaluation. Part II. Chemistry, technology, and quality evaluation</a>. Food Science and Nutrition, 18(4): 313-386. <br>\n[2] <a href=""http://dzjy.85818.net/Html/20106985818.html"">脐橙电子交易市场交收质量标准</a> <br>\n[3] Garrett A., 1995. The pollination biology of papaw (Carica papaya L.) in Central Queensland. A PhD. Thesis summited to Central Queensland University. <br>\n[4] 刚明慧，2010. 库尔勒香梨宿萼果和粗皮果防治技术研究。硕士学位论文，新疆农业大学。 <br>\n[5] <a href=""http://www.freepatentsonline.com/PP12373.html"">Japanese pear tree named ""Akizuki""</a>. United States Patent PP12373. <br>\n内容来源：<a href=""http://www.guokr.com/article/88522/"">挑水果看公母，靠谱吗？</a>顾有容，果壳网谣言粉碎机<br>\n <br>\n\n	</div>\n</div>","宠物花草"
"纯银戒指慢慢变黑是因为吸取了身体的毒素","古装电视剧中市场会看到这样的场面：投毒案发生，御医用银针验毒断案。其原理是银遇毒药会变黑，屡试不爽。放到现在，佩戴在人们身上的银戒指会随着时间慢慢变黑，实际上是吸收了体内的毒素，有益健康。",0,"\n		","<div class=""rumor-content"">\n	\n	<h2>论证</h2>\n	<div class=""content"">\n	<h2><strong>银针验毒？不靠谱</strong></h2>\n砒霜（主要成分为As2O3）是我国古代最常见、最容易获得的毒物之一。砒霜毒性剧烈，一次大量摄入砒霜引起的急性中毒会出现呕吐、腹泻、出血不止、抽搐等症状，而少量多次摄入引起的慢性中毒多表现为肝、肾损害和皮肤色素改变。<br>\n<br>\n对应于砒霜的悠久历史，银针探毒的方法在我国古代断案中也被广为采用，包括《折狱龟鉴》、《洗冤集录》在内的多部历史古籍中都有相应的记载。除此以外，银针探毒还是武侠小说和影视作品的最爱。然而，银针探毒真的像书中所记载的那样科学和准确吗？答案是：否。<br>\n<br>\n之所以说银针探毒是不科学、不准确的，还得从砒霜的制法说起。砒霜是砷（As）的氧化物（砷古时候也称作砒）。砷在自然界中以硫化砷矿物的形式存在，常见的含砷矿物有斜方铁矿（FeAs2）、雄黄（As2S2）、雌黄（As2S3）、砷黄铁矿（FeAsS）等。古代炼取砒霜的方法是将矿物研碎，除去大块的杂石，在密闭容器中与木炭一起煅烧，待毒沙升华后，它所凝结成得白色粉末就是砒霜。<br>\n<br>\n由于古代冶炼技术差，工艺粗糙，制成的砒霜中往往含有大量硫化物。硫化物与银反应，生成的黑色硫化银（Ag2S）附着在银针表面，银针就这样变黑了。也就是说，银针试毒的方法实际上是检测出了砒霜中的含硫杂质而已，并不是检测出砒霜本身。所以，银针探毒在古代的成功应用纯属巧合。<br>\n<br>\n事实上，银是不能与纯净的砒霜发生化学反应的，所以用银针探砒霜不但不科学，更有可能造成冤案。<br>\n<br>\n人死后尸体内部产生大量含硫化合物，大家所熟知的尸臭（主要为硫化氢气体）就是其中之一。这些硫化物大多都能与银反应，生成硫化银。也就是说，即便是正常死亡的尸体，也很容易使银针变成黑色。就连富含硫元素的新鲜鸡蛋，也能使银针变黑，给人以含毒的假象。而且目前常见的毒物如敌敌畏、毒鼠强、氰化物等都无法用银针检出。<br>\n<br>\n<br>\n<h2><strong>银戒指变黑？硫作怪</strong></h2>\n日常生活中我们当然不会戴着纯银戒指去接触含硫的砒霜了，也不会特地拿戒指去验毒，那么为什么纯银戒指还是会变黑呢？当然这和“佩戴银戒指也可以吸出人体内的毒素”没有关系。虽然银单质在纯净的空气和水中的化学性质都十分稳定，但是日常生活中我们却很容易接触到硫合物，这些硫化物就是纯银戒指变黑的元凶。一般人生活中最容易接触到的硫化物大概就是空气中的常见污染物二氧化硫了，此外还有一些人洗脸用的硫磺皂。<br>\n<br>\n<h4><strong>参考资料</strong></h4>\n[1]<a href=""http://www.guokr.com/article/16662/"">银针探毒 ，是科学还是巧合？ </a>战士的后裔，果壳网谋杀 现场 法医\n	</div>\n</div>","医学健康"
"驱蚊草可以驱蚊","夏天时在家里摆一盆驱蚊草，撒发出的香味可以驱赶蚊虫。",0,"\n		","<div class=""rumor-content"">\n	\n	<h2>论证</h2>\n	<div class=""content"">\n	在商家的宣传信息中，貌似这些小草能解决所有人的驱蚊问题，首先，它是纯天然绿色植物，让你不用担心人工合成化学制剂的危害；其次，它的清香味可以让蚊虫退避三舍，同时对人还有提神醒脑的作用。可是这种草真有这么神奇吗？<br>\n<br>\n<h2><strong>驱蚊草，身世不明</strong></h2>\n目前，市面出售的驱蚊草主要是一种学名叫做香叶天竺葵的植物。网上盛传说是荷兰遗传学家迪克，经过多年潜心研究，动用遗传工程技术，将香茅醛合成基因导入香叶天竺葵培育出的高效驱蚊植物。奇怪的是，没有一篇正式发表的学术文献说明，驱蚊草是何人用何种原始材料在何时培育成的。再查询这位培育驱蚊草的欧洲遗传学家迪克，会发现除了驱蚊草这一个条目之外没有其他一星半点的相关资料。实际上，香叶天竺葵本身就会散发出一些香气，比如柠檬味（香茅醛也是柠檬香味）根本不需要多此一举。所以你买到的驱蚊草可能就是一株普通的香叶天竺葵。<br>\n<img src=""https://1-im.guokr.com/gkimage/3w/gq/uy/3wgquy.png"" style=""max-width: 480px""><br>\n驱蚊草的真身：香叶天竺葵（ <i>Pelargonium graveolens</i> ）<br>\n<br>\n<h2><strong>驱蚊草，不驱蚊</strong></h2>\n就在不久前，有科研人员检测了驱蚊草、艾蒿等驱蚊植物的效果，结果却令人大失所望，实验区域内的蚊虫对这些植物基本上无动于衷，除了不会落在驱蚊草上之外，在实验空间里还是自由自在。其实，这也很容易理解。这些植物体内的香叶醇、香茅醇、柠檬醛等物质确实都有一定的趋避昆虫的作用，它们本身就是植物的防御武器。比如，网络上传言驱虫草中含有的香茅醛，实验证明30%（野外实验）和15%（试管内实验）以上浓度的香茅醛注入驱蚊带中的确是有驱蚊作用，但仅靠叶片散发出来的气味驱蚊看来是远远不够的。<br>\n<br>\n因为这些物质平常可不是随便就释放出来了，只有在受到啃食等物理损伤是才会大量释放，就像我们搓揉一把艾蒿，才能闻到浓浓的艾蒿味一样。当然如果加热以后（抱一捧艾蒿放在篝火里，是童年乘凉时最喜欢干的事情），这些挥发性成分还是有一定作用的。在进化过程中，植物并不会对那些不啃花叶的蚊虫作出反应。植物主动释放驱蚊的气味，多半是人美好的愿景。<br>\n<br>\n<img src=""https://3-im.guokr.com/gkimage/1x/n3/fz/1xn3fz.png"" style=""max-width: 480px""><br>\n另外一种“驱蚊草”：草本夜来香 <i>Telosma cordata</i> (Burm. f.) Merr. <br>\n<br>\n这里要提一下，夜来香是一个俗称，包括很多种植物，除了这个草本夜来香外，还有茄科夜香树属的夜香木、石蒜科晚香玉属的晚香玉、柳叶菜科月见草属的月见草以及夹竹桃科的夜来香。<br>\n<br>\n这些同样被包装成驱蚊草的草本夜来香（萝藦科植物）的香味就更不靠谱了，这些香味的用途是吸引那些传粉者来给花朵授粉，而不是要跟蚊虫开战。据说吸人血的雌性蚊子不喜欢花香，但是没有一个实验能证实这种说法。况且那浓烈的香气，恐怕不单单针对蚊子，要小心连处于室内的我们也一并“关照”了。<br>\n<br>\n<h4></h4>\n<h4><strong>内容来源</strong></h4>\n<a href=""http://www.guokr.com/article/46978/"">驱蚊植物靠谱吗？ </a> 史军，果壳网自然控<br>\n\n	</div>\n</div>","宠物花草"
"掐住猫脖子后面的肉，猫就动不了了","掐住猫脖子后面的肉，猫就动不了了。图片如下：",2,"\n		","<div class=""rumor-content"">\n	\n	<h2>论证</h2>\n	<div class=""content"">\n	这种现象被称之为”clipnosis”，由”clip(夹子)”和”hypnosis(催眠)”两个词合成而来。<br>\n<br>\n有些人猜测猫脖子后面的肉是死的，怎样捏都不疼，所以老猫都是叼小猫这个位置；有些人猜测猫脖子后面是”神经通道”, 一捏就阻断了，所以猫咪会像被点穴一样。(其实, 这些猜测基本都不正确。)<br>\n<br>\n这么有趣、奇特又广为人知的”神秘现象“当然不会逃过科学家的眼睛，俄亥俄州立大学(Ohio State University)临床兽医学的教授Tony Buffington带领的小组就研究了出现在猫咪身上的这个现象。当然, 除了好奇以外，也是为了探索使用这个方法稳定猫咪进行医疗诊断的可行性。实验邀请了31只1到5岁不等，不同性别的猫咪参与,。<br>\n<br>\n经过对猫咪各项生理指标的测试, Buffington和同事们发现, 猫咪这种行为并不是由害怕或者疼痛引起的. 猫咪的瞳孔并没有放大, 心跳速度也没有加快, 呼吸速度也正常——受到惊吓的动物一般会产生的生理反应猫咪都没有出现。Buffington小组得出的结论是, 猫咪出现这种行为与”方便猫麻麻移动小猫有关”。<br>\n<br>\n其实Buffington文章中使用了一个更为贴切的词组描述猫咪这种行为：”捏掐诱导的行为抑制现象”(Pinch-induced behavioral inhibition)。这个词组只是单纯描述现象, 并不暗示任何现象背后的原因。然而Buffington小组认为这与”母猫运输小猫”有关是有一定道理的。事实上，幼年动物在被妈妈叼起后呈现”被点穴”状态的现象在很多物种中都存在，包括小鼠、大鼠、兔子、狗、荷兰猪等。（如果对这个现象感兴趣, 可以google scholar “dorsal immobility”）虽然这个现象在很多物种中都被发现，但是背后的生理原因却几乎没有人真正详细的解答过。<br>\n<br>\n终于在2013年， 一群日本的神经生物家研究了”动物在被母亲叼起”时一系列生理反应后发现，相似的”镇静效果”不仅在小鼠中存在，在人类婴儿中同样存在。“镇静效果”中最典型且在人类和小鼠间相似的三个生理反应是：停止哭泣(cessation of crying)，顺从(passivity)以及心跳减速(decreased heart rate)。<br>\n<br>\n这个研究意义重大，重大在于“物种间生理反应的一致性”可以让科学家们通过小鼠(而不是人类婴儿)来研究现象背后的原因，而且研究结果不仅解释了本文试图回答的”一个夹子冻住一只猫”的问题，还回答了与我们人类更为相关的另一个问题：”为什么在婴儿哭泣时抱起晃动可以让婴儿安静下来”。<br>\n<br>\n实验中，他们麻醉了幼鼠后脖子上动作感受的神经（somatosensory neurons），这之后由”被叼起”而产生的”镇静效果”就减弱了。同时，手术移除大脑的一部分以干扰小脑皮质的传入信号也会延长母鼠使幼鼠镇定下来的时间。如果不能感知脖子后方被叼住，幼鼠就不会蜷起身来；如果小脑不能接受到信号，幼鼠就不会出现顺从。而心跳的减弱和身体姿势上的改变则是由副交感神经以及小脑的传出神经来直接实现。这一系列的生理反应使得幼鼠安静、顺从、蜷起身体，方便母鼠将它们带到安全的地方。<br>\n<br>\n所以，并不是”猫咪脖子后面肉是死的”，相反，是脖子后方的感受神经使得小猫获得”我被叼起来了”的信号；而随后出现的与”被点穴”类似的生理反应并不是因为”神经通道被阻断”，而是因为来自大脑（both central nervous system and autonomic system）的信号引导他们出现方便”麻麻转移自己”的生理现象。<br>\n<br>\n<h4></h4>\n<h4><strong>内容来源</strong></h4>\n<a href=""http://www.guokr.com/question/541396/"">为什么掐住猫脖子后面的肉,猫就动不了了？</a> 山山DVM，果壳网果壳问答\n	</div>\n</div>","宠物花草"
