"title","descrip","LiuyanType","answer","detail","type"
"人能活到400岁以上","“泰定甲子，汤泉人陈俊(字克明)寿四百四十四岁。子孙无有存者，乡人轮流供养。遗骨塑象汤泉庙中。该乡有龙津鳌头宫，经三坏，俊三为修葺。有木牌记其事，至今不坏。距生于唐僖宗中和辛丑，历五代、宋、元而殁，人传为小彭祖云。","新","\n		","<div class=""rumor-content"">\n	\n	<h2>论证</h2>\n	<div class=""content"">\n	  文字片段似乎摘录自民国永泰县志-杂录，未见于正史。又有说见于清版永泰县志的，离记载中所说元朝的死亡日期相距甚远，不足为信。\n	</div>\n</div>","传说轶事"
"猫因无法忍受别离跳井自杀","跟了主人多年的猫，因为无法忍受和主人的分离，先后投井而亡。这猫也会自尽的消息不胫而走，令人啧啧称奇。","新","\n		","<div class=""rumor-content"">\n	\n	<h2>论证</h2>\n	<div class=""content"">\n	 \n	</div>\n</div>","传说轶事"
"蚂蚁会裹成一个球逃离火海","着火了，蚂蚁裹成一个球滚出火海。逃离之后外面的蚂蚁焦掉了，里面的蚂蚁或下来了。","新","\n		","<div class=""rumor-content"">\n	\n	<h2>论证</h2>\n	<div class=""content"">\n	 \n	</div>\n</div>","传说轶事"
"人类可以具有吸附金属物品的能力","克罗地亚的一位男孩具有超能力，他的身体能够吸附金属物体，最多可以承载25公斤的物件。","新","\n		","<div class=""rumor-content"">\n	\n	<h2>论证</h2>\n	<div class=""content"">\n	 其实这个事情谁都能做到。<br>\n<br>\n如果从原理上分析的话：皮肤表面有薄薄的粘性分泌物，包括油脂、汗水等。只要不是太干燥，一般来说都能产生足够大的摩擦力。特别是表面光滑平整的物体，因为与皮肤接触面积足够大，更容易产生较大的摩擦力。当然了，如新闻图片上的小胖子一样，丰满一些人更容易做出这项“神功”。<br>\n<br>\n<a href=""http://www.guokr.com/post/61149/"">http://www.guokr.com/post/61149/</a>\n	</div>\n</div>","传说轶事"
"轮回和前世是真实存在的","用佛经上的说法就是六道轮回，人的数量增加了，那么就是有其他道的众生转世为人","新","\n		","<div class=""rumor-content"">\n	\n	<h2>论证</h2>\n	<div class=""content"">\n	 我一直觉得用体系内的理论来解释体系外的事实有些无力，有些事要亲自经历过才知道是怎么回事。反过来说，如果轮回者真的存在，那么他要向众人解释这一事实也是很痛苦的事。毕竟你不能说只要能用魔术或者其它什么伪造出这一效果，那么他就一定在造假。这种做法也是有悖科学精神的。遗憾的是，有时候人们正是这样做的。<br>\n<br>\n信与不信很大程度取决于所接受的教育，神灭与不灭也少不了政治力量的博弈。信有信的道理，不信有不信的立场。如果人人都能做到真诚，宽容和良善。无神和有神又有何区别？<br>\n<br>\n<a href=""http://www.guokr.com/post/87491/"">http://www.guokr.com/post/87491/</a>\n	</div>\n</div>","传说轶事"
"一女子被市中心公园出现史前巨鳄吞吃丧命","某人偶然用摄像机记录下了这一段惊悚的镜头。 ","0","\n		","<div class=""rumor-content"">\n	\n	<h2>论证</h2>\n	<div class=""content"">\n	去翻这种假视频背后的信息其实没有任何意义，就说说鳄鱼的习性吧 <br>\n <br>\n国家地理频道有很多纪录片，专门或部分拍摄了鳄鱼的攻击行为。，总结下来就三点 <br>\n<ul><li>耐性</li><li>寂静</li><li>致命</li></ul>\n <br>\n鳄鱼的典型攻击方式分为两种 <br>\n<ul><li>主动勾引</li><li>守株待兔</li></ul>\n <br>\n主动型的鳄鱼以湾鳄等大型咸水鳄为主，因为体型庞大，根本不惧任何其他生物。所以 会用自己橙黄明亮的舌头为饵，或者假装病死来引诱食肉兽接近[1]。 以及国家地理录下的一只可怜老虎的故事[2]。 <br>\n <br>\n而守株待兔型的多为体型较小的淡水鳄，目前非洲正在进行大迁徙的角马群所要面对的就是这些横亘在迁徙必经河道中的鳄鱼。他们在发现合适的捕猎对象后会伪装成浮木接近并一击咬定（而不是咬死）猎物，然后将其拖到水下 然后不断翻滚，使猎物迅速溺亡后储存到洞穴里等半腐烂后再食用。因为鳄鱼的咬合力虽然堪比老虎钳，但他却没有合适用来咀嚼的臼齿，因此只能等食物腐烂发软后再撕咬或继续翻滚绞下肉块及肢体然后吞食，这也是为什么他需要牙签鸟来清理牙龈的原因。因为他根本不能和狮子那样通过啃咬骨头来清理牙齿[3]。 <br>\n <br>\n鳄鱼的尾巴不像鱼尾可以产生惊人的推力。重达一吨的身躯想像鲨鱼一样，从视频里的那种角度蹦出来，划一个弧线然后落回水里是根本不可能的，就算他能蹦跶出来，鳄鱼最脆弱的腰部也会因为不堪重负立即扭断。他们对待这些在岸边的生物最常用的手段就是转身用钢鞭一样的尾巴将他们直接抽下水或抽晕死过去再拖下水，就像下面视频里那只一直在装死的小鳄鱼在被蒙住眼的情况下依然将一个成年男子一尾巴抽翻在地[4]。 <br>\n <br>\n <br>\n<h4><strong>参考资料：</strong></h4>\n[1] <a href=""http://www.youtube.com/watch?v=sU6LyFfbcZE"">http://www.youtube.com/watch?v=sU6LyFfbcZE</a><br>\n[2] <a href=""http://video.nationalgeographic.com/video/animals/reptiles-animals/alligators-crocodiles/tiger_bengal_retakes_kill/"">http://video.nationalgeographic.com/video/animals/reptiles-animals/alligators-crocodiles/tiger_bengal_retakes_kill/</a><br>\n[3] <a href=""http://www.youtube.com/watch?v=28c-nsEf8PY"">http://www.youtube.com/watch?v=28c-nsEf8PY</a><br>\n[4] <a href=""http://www.ebaumsworld.com/video/watch/83063072/"">http://www.ebaumsworld.com/video/watch/83063072/</a><br>\n \n	</div>\n</div>","传说轶事"
"北冰洋有人拍摄到美人鱼","“美人鱼”的英文为mermaid，来源于古英语词汇“mere”（意为海洋）和“maid”（意为少女）的结合。现在我们印象中的美人鱼形象多来自西方传说，通常是上半身为人（多为女性），下半身为鱼尾。安徒生的童话《海的女儿》（The Little Mermaid）更使这种美人鱼的形象深入人心。与古希腊传说中的海妖塞壬（Sirens）相似，美人鱼会用歌唱迷惑人或者神，使他们倾听失神而从船甲板失足，或者诱使航船触礁沉没。《加勒比海盗4》里的美人鱼形象正是如此。","0","\n		","<div class=""rumor-content"">\n	\n	<h2>论证</h2>\n	<div class=""content"">\n	流言一： 【传说中的美人鱼？】这是欧洲一位深海摄影师，在北冰洋偶然拍摄到的一张相片。相片上清晰的显示出，这是一种奇异的生物，她拥有如同人类一样的下肢轮廓，并且拥有一个漂亮的尾鳍。真的是美人鱼。 <br>\n<img src=""https://1-im.guokr.com/r3X8netOZbZXozI2I7wrwBI3Egn53AtPzFjTWoCzjAAsAQAAkAEAAEpQ.jpg"" style=""max-width: 480px"" data-orig-width=""300"" data-orig-height=""400"" data-hashkey=""r3X8netOZbZXozI2I7wrwBI3Egn53AtPzFjTWoCzjAAsAQAAkAEAAEpQ""><br>\n流言二： 【美人鱼尸体】2006年07月27日据俄罗斯新闻网7月31日报导，美国佛罗里达州圣彼得堡市的一位居民日前在电子港湾（eBay）上拍卖出了一具奇特生物的尸体。 被拍卖的怪兽尸体长约1.5米，是一种海洋生物。尽管从外表上看有些恐怖，但卖家却将其称为美人鱼。 <br>\n真相： <br>\n<img src=""https://1-im.guokr.com/oN6m6Ob9FQ3lIdNz5gjvLRpAOLWeWkJlpyASASGgmKBeAgAACgEAAEpQ.jpg?imageView2/1/w/480/h/210"" style=""max-width: 480px"" data-orig-width=""606"" data-orig-height=""266"" data-hashkey=""oN6m6Ob9FQ3lIdNz5gjvLRpAOLWeWkJlpyASASGgmKBeAgAACgEAAEpQ""><br>\n<h2></h2>\n<h2><strong>我不是奇异的生物，我是白鲸啦</strong></h2>\n第一个流言中的“美人鱼”其实是白鲸。遍寻国外网站，这张图片的注释大多为“美人鱼般的白鲸”，或者“看到这张水下白鲸的图片，你就知道为什么水手们会说他们看到了美人鱼”。图片流传到国内，“白鲸”消失了，只剩下了“美人鱼”。谣言粉碎机调查员由衷的感叹，做人要厚道呀！生活在遥远的环北极区域的白鲸（学名：<i>Delphinapterus leucas</i>，英文名：beluga whale或white whale）确实长得很有美人鱼范儿[1, 2]。为适应寒冷的生活，白鲸具有厚厚的皮下脂肪层，使得腹面看起来很像人的下肢合并在一起。尽管小时候的白鲸还是灰不溜秋的，但是女大十八变，长大后却是通体雪白。白鲸的体态浑圆，并向头尾两端逐渐变细，在颈部，这种变细的程度突然加大，造成了“香肩外露”的视觉效果。白鲸不但体态婀娜，歌声也很是动听。叫声婉转多变，被早期捕鲸者誉为“海中金丝雀”，“高音的共鸣哨声与尖叫，多变的滴答声与咯咯声，让人联想到一队交响乐队，有时又有如猫叫或小鸟的啁啾声”（语出Bill Schevill，美国鲸类声学学者）。<br>\n <br>\n<h2><strong>不要相信姐，姐只是个模型</strong></h2>\n第二个流言中的“美人鱼”看上去颇为惊悚，和我们想象中美丽的美人鱼形象相去甚远。事实上，这是美国佛罗里达州坦帕市的一位艺术家Juan Cabana创作的“艺术品”[3]，这个创作于2006年的“美人鱼”是由动物骨架、鱼类和其他动物的皮肤、钢条、塑料和玻璃纤维等等材料制成的。最初Juan把它放在eBay上拍卖，由于描述的中规中矩，也说明了这是他制作的美人鱼模型，结果乏人问津。于是Juan编造了一个故事，也就是流言中提到的佛罗里达州圣彼得堡市居民在海滩上偶然发现这个怪物的尸体，还谈及其死亡原因可能是赤潮云云[4, 5]。这才引起大家的关注，最终在eBay上拍出了1550美元的高价。从拍卖结果看，这个故事的效果确实不错。不幸的是，这些图片和故事通过邮件、论坛和博客等传播开来，催生了更多在不同的海滩“发现”美人鱼或者怪物的故事，如来自菲律宾海滩的报告[6]。Juan还创作了许多其他的人鱼作品，大家可以前往他的网站[3]围观。 <br>\n <br>\n早在19世纪就有人制作了类似流言二里出现的东西，如曾经名噪一时的“斐济美人鱼”（Fiji mermaid，或Feejee Mermaid）[10]。该“美人鱼”半猿半鱼，作为费尼尔司•泰勒•巴纳姆（P.T. Barnum）的博物馆和马戏团众多怪异的展品之一，曾引起极大轰动。巴纳姆宣称斐济美人鱼是一位名叫“J. Griffin博士”的人捕获得到，但实际上它是由一只幼猴的躯干和头部，与鱼的后半部缝合而成。从生物学的角度来看，人鱼那类似灵长类能够灵活抓握的手臂，体现了对树栖环境的适应，而类似鱼类的下半身则意味着高度适应水生环境，动物很难同时在这两种迥然不同的环境中展开进化。从理论上这样的生物几乎不可能存在，至今也没有任何化石证据表明这种生物确实存在。 <br>\n<img src=""https://3-im.guokr.com/HsRNwM6YjIAmh0yXgeXhDLrmKlzOTE_zOeAlBw22RYaWAAAAbQEAAEpQ.jpg"" style=""max-width: 480px"" data-orig-width=""150"" data-orig-height=""365"" data-hashkey=""HsRNwM6YjIAmh0yXgeXhDLrmKlzOTE_zOeAlBw22RYaWAAAAbQEAAEpQ""><br>\n斐济美人鱼，来源wiki <br>\n <br>\n现实文化上的美人鱼很飘渺，现实中的美人鱼是什么样的呢？现实中常常被称为“美人鱼”的其实是同属于海牛目的儒艮（dugong）、海牛（manatee）等海洋哺乳动物。海牛目的学名“Sirenia”就来自于上面所提到的古希腊海妖塞壬“Sirens”。荷马的史诗《奥德赛》中描写道，塞壬是半人半鸟的怪物，她们试图通过甜美的歌声把奥德修斯引诱到自己的海岛上。用歌声引诱的情节很容易使人将塞壬和美人鱼混淆，这可能是之后将Sirenia作为海牛目的拉丁文命名[11]的原因吧。 <br>\n<img src=""https://2-im.guokr.com/B85jxBUcvM7hAYiLxBwgpNSXM_2z5uxH4rQpV5pg1fmQAQAAIgEAAEpQ.jpg"" style=""max-width: 480px"" data-orig-width=""400"" data-orig-height=""290"" data-hashkey=""B85jxBUcvM7hAYiLxBwgpNSXM_2z5uxH4rQpV5pg1fmQAQAAIgEAAEpQ""><br>\n儒艮，来源egyfouna.aun.edu.eg <br>\n <br>\n早期的欧洲航海者将海牛或儒艮当成美人鱼，可能是因为它们具有乳房的胸部，灵巧的前肢，以及鱼一样的尾巴。也许哺乳期的儒艮怀抱幼仔的情景也让古希腊的水手们感动过。1493年，哥伦布这样描述曾在加勒比海看见的“美人鱼”：在伊斯帕尼奥拉岛（Hispaniola）的海湾里，我看见了三只“塞壬”，但它们远没有贺拉斯（Horaz，古罗马诗人）所描述的那么美丽[14]。（如果哥伦布会中文的话，我想他要说的是“坑爹啊！”）非洲、澳洲和美洲的土著居民对海牛和儒艮并不陌生，对它们的由来也都有各自的传说。有的传说就认为海牛和儒艮来自人类的祖先，他们因为被诅咒或者遭受不幸，而只能生活在邻近陆地的海水里[11]。 <br>\n <br>\n值得一提的是，儒艮和海牛虽然都是水栖的大型食草性哺乳动物，外形长得也很像，但还是具有明显的差异。儒艮的尾部近似海豚的Y型尾，海牛的尾部则扁平略呈圆形。儒艮主要分布于西太平洋和印度洋海岸。海牛则生活在热带海域，主要分布于大西洋海盆一带。 <br>\n <br>\n<h2><strong>现实中的悲伤“小美人鱼”</strong></h2>\n现实中还有让人痛心的“小美人鱼”，患上美人鱼综合症[15]（Sirenomelia，或Mermaid Syndrome）的孩子。这是一种罕见的先天性缺陷疾病，约十万个新生儿中会有一例（与连体婴儿发病率差不多），并且同卵双生胎儿患此病的概率比单产或异卵双生胎要高近100倍。患儿的两条腿融合在一起，如同“美人鱼”一般。超过半数的美人鱼综合症胎儿都支撑不到出生，而是胎死腹中。即便顽强出生了的“小美人鱼”也会因为并发肾脏和膀胱异常，在出生后一两天内死亡。只有寥寥可数的几位患者幸运地躲开了并发症而存活下来，有的还成功地借助外科手术将融合的下肢分开，但由于骨骼非常脆弱，他们难以像正常人一样生活。 <br>\n <br>\n<h4><strong>参考资料： </strong></h4>\n[1] <a href=""http://www.eol.org/pages/328541?text_id=7741076"">Delphinapterus leucas (Pallas, 1776)</a><br>\n[2] wiki_<a href=""http://en.wikipedia.org/wiki/Beluga_whale"">Beluga_whale</a><br>\n[3] <a href=""http://www.thefeejeemermaid.com/"">Juan Cabana的网站</a><br>\n[4] <a href=""http://www.allvoices.com/contributed-news/8130245-the-mermaid-found-on-malaysian-island"">The mermaid found on Malaysian island</a><br>\n[5] <a href=""http://www.tampabay.com/news/bizarre/article414806.ece"">Tampa artist keeps mermaid myth alive</a><br>\n[6] <a href=""http://urbanlegends.about.com/od/mythicalcreatures/ss/Pictures-Mermaid-Found-in-the-Philippines_4.htm"">Pictures: Dead Mermaid Found in the Philippines</a><br>\n[7] wiki_<a href=""http://en.wikipedia.org/wiki/Mermaid"">Mermaid美人鱼</a><br>\n[8] wiki_<a href=""http://en.wikipedia.org/wiki/Siren"">Siren</a><br>\n[9] wiki_<a href=""http://en.wikipedia.org/wiki/Cabinet_of_curiosities"">Cabinet of curiosities</a><br>\n[10] wiki_<a href=""http://en.wikipedia.org/wiki/Fiji_mermaid"">Fiji_mermaid</a><br>\n[11] <a href=""http://www.sirenian.org/sirenians.html#5"">What are sirenians</a><br>\n[12] wiki_<a href=""http://en.wikipedia.org/wiki/Dugong"">Dugong</a><br>\n[13] wiki_<a href=""http://en.wikipedia.org/wiki/Manatee"">Manatee</a><br>\n[14] <a href=""http://www.hans-rothauscher.de/dugong/dugong.htm"">Mythical Mermaids</a><br>\n[15] wiki_<a href=""http://en.wikipedia.org/wiki/Sirenomelia"">Sirenomelia</a><br>\n[16] <a href=""http://www.guokr.com/article/38505/"">真假美人鱼</a>, linki, 果壳网谣言粉碎机\n	</div>\n</div>","传说轶事"
"蜗牛在脸上爬，其粘液可美容","蜗牛粘液可以美容，操作方式是让活蜗牛在人脸上爬。 因为蜗牛粘液富含蛋白质、抗氧化剂和玻璃酸，被指可有效的保持皮肤水分，减轻炎症以及去除死皮。并且这种方法并不是当代人创造发明的，早在2000年前就有使用蜗牛美容的记载。 ","新","\n		","<div class=""rumor-content"">\n	\n	<h2>论证</h2>\n	<div class=""content"">\n	 \n	</div>\n</div>","传说轶事"
"父亲的基因也会影响女儿胸部大小","父亲的基因也会影响女儿胸部大小。","2","\n		","<div class=""rumor-content"">\n	\n	<h2>论证</h2>\n	<div class=""content"">\n	从父亲那里遗传来乳房的性状，至少有一个众所周知的例子，奶牛：<br>\n<br>\n瑞典的奶牛场进口了北美的荷斯坛精液，研究者注意到牛奶产量有一个显著的提升。但乳房炎的发病率并没有随着产量的升高而升高，这一切都要归功于<strong>北美荷斯坛公牛的乳房遗传性状</strong>。正如作者评述的：“瑞典黑白花奶牛的‘荷斯坛化’，使得平均奶产量有一个显著的提升，也没有导致乳房炎的发病率增加，尽管两者之间有一个敌对的遗传关系。同时改善乳房形态的育种工作将一个潜在的负面结果消于无形。”<br>\n<br>\n<img src=""https://2-im.guokr.com/KTqn6QZdkINwzsG8QLIj5ohSt278y7UuZ9zQZNb250s4AgAAowEAAEpQ.jpg?imageView2/1/w/480/h/354"" style=""max-width: 480px"" data-orig-width=""568"" data-orig-height=""419"" data-hashkey=""KTqn6QZdkINwzsG8QLIj5ohSt278y7UuZ9zQZNb250s4AgAAowEAAEpQ""><br>\n<br>\n<br>\n父亲可能把乳房的性状（确切地说是“发育的乳房”，因为男人也有乳房）遗传给女儿，同理，母亲也可能把阴茎的性状遗传给儿子。男人或别的雄性动物可以携带关系乳房发育的基因，只是不表达而已。基因要有一定条件才能表达出来，最简单的例子，如果生下来不给吃奶，那不论发育不发育都白搭。<br>\n<br>\n男人和女人乳房的不同，是睾丸产生的激素所致的基因表达不同，深究到基因配置，除了性染色体，男女都是差不多的。不过，最早开启激素分泌，从而导致一系列不同的是Y染色体上的SRY基因，所以（哺乳动物的）性别确实是基因决定的。<br>\n<br>\n<h4><strong>参考资料</strong></h4>\n[1]<a href=""http://www.guokr.com/question/535599/"">父親的基因對女兒的胸部的大小有影響嗎？</a>红色皇后，果壳网果壳问答<br>\n\n	</div>\n</div>","科学技术"
"鱼水之欢原指同性恋","“鱼水之欢”一词是指搞破鞋。但最初意思不是搞破鞋，是搞基。此话出自《三国志-诸葛亮传》，刘备跟孔明天天扯，关羽张飞吃醋，刘备解释说：孔明的“孔”天天潮吹。我跟他在一起，就像鱼钻进了水里。“孤之有孔明，犹鱼之有水也。”","0","\n		","<div class=""rumor-content"">\n	\n	<h2>论证</h2>\n	<div class=""content"">\n	鱼水之欢现在所见最早出处是《管子·小问第五十一》引的一句逸《诗》：“浩浩者水，育育者鱼，未有室家，而安召我居？”所谓逸《诗》，是指古书说某首或某句是《诗》，但是今本《诗经》未收，一般认为是被删诗删掉了或者因为别的原因脱落了。这几句《诗》就是用鱼和水比喻家庭的和谐的。<br>\n<br>\n不过鱼和水这个比喻不止独立出现了这么一次。再有就是我们都很熟悉的《三国志》了。《三国志·诸葛亮传》介绍著名的隆中对：<br>\n时先主屯新野。徐庶见先主，先主器之，谓先主曰：“诸葛孔明者，卧龙也，将军岂愿见之乎？”先主曰：“君与俱来。”庶曰：“此人可就见，不可屈致也。将军宜枉驾顾之。”由是先主遂诣亮，凡三往，乃见。因屏人曰：“汉室倾颓，奸臣窃命，主上蒙尘。孤不度德量力，欲信大义於天下，而智术浅短，遂用猖蹶【獗】，至于今日。然志犹未已，君谓计将安出？”亮答曰：“自董卓已来，豪杰并起，跨州连郡者不可胜数。曹操比於袁绍，则名微而众寡，然操遂能克绍，以弱为强者，非惟天时，抑亦人谋也。今操已拥百万之众，挟天子而令诸侯，此诚不可与争锋。孙权据有江东，已历三世，国险而民附，贤能为之用，此可以为援而不可图也。荆州北据汉、沔，利尽南海，东连吴会，西通巴、蜀，此用武之国，而其主不能守，此殆天所以资将军，将军岂有意乎？益州险塞，沃野千里，天府之土，高祖因之以成帝业。刘璋闇弱，张鲁在北，民殷国富而不知存恤，智能之士思得明君。将军既帝室之胄，信义著於四海，总揽英雄，思贤如渴，若跨有荆、益，保其岩阻，西和诸戎，南抚夷越，外结好孙权，内脩政理；天下有变，则命一上将将荆州之军以向宛、洛，将军身率益州之众出於秦川，百姓孰敢不箪食壶浆以迎将军者乎？诚如是，则霸业可成，汉室可兴矣。”先主曰：“善！”於是与亮情好日密。关羽、张飞等不悦，先主解之曰：“<strong>孤之有孔明，犹鱼之有水也。</strong>愿诸君勿复言。”羽、飞乃止。<br>\n<br>\n参考资料<br>\n[1] <a href=""http://www.guokr.com/question/531075/"">“鱼水之欢”最初原意是搞基吗？</a>清洁工，果壳网果壳问答<br>\n\n	</div>\n</div>","科学技术"
"NSA造“量子计算机”可破解任何密码","斯诺登泄漏的文件显示,美国国家安全局(NSA)正在开发一个“量子计算机”，可以破解几乎任何类型的加密, 该项目是其总额为7970万美元的“穿透硬目标”项目的一部分，项目在马里兰大学帕克实验室运作。这种“量子计算机”能够帮助美国国安局破解任何类型的加密，包括银行、医疗、商业以及政府的密码。","0","\n		","<div class=""rumor-content"">\n	\n	<h2>论证</h2>\n	<div class=""content"">\n	<h2><strong>什么是量子计算机？</strong></h2>\n首先，<strong>量子计算机并不相当于一台能够做高速运算的经典的超级计算机</strong>。量子计算机能以高速度解决某些特定的问题，但却对别的问题无能为力。目前人们找到的高速度的量子算法大体有两类，一类是解决隐含子群问题的，比如因子分解问题、离散对数问题等，量子计算机在这些问题上有指数级的加速；另一类是 量子随机游走相关的，比如说Grover算法（在O(sqrt(n))时间内搜索大小为n的数据库）等，量子计算机在这些问题上有多项式级的加速。还有一些比较奇怪的就不说了。在这些特定的问题上，量子计算机能迅速解决问题，但出了这个范围，目前它跟经典计算机没什么区别。<br>\n<br>\n<h2><strong>会威胁到当前的密码体系，但并非无所不能</strong></h2>\n量子计算机能解决的问题，是否会威胁到当前的密码体系呢？答案是的确会。目前的密码体系大体有两种：对称密码与非对称密码。AES是前一种的例子，RSA是后一种的例子。对称密码的话，Grover算法能进行不小的加速，比如说AES-128的密钥空间是2^128，通过构造适当的可以量子化的数据库黑盒子，Grover算法能在大约2^64的时间内找到密钥，而经典计算机则需要大概2^128的时间。不过这个问题并不特别大，换用更长的密钥就可以了。问题在于非对称密码，无论是基于因子分解问题的RSA，还是基于椭圆曲线上离散对数的ElGamal，都可以用量子计算机在很短的时间内破解。而偏偏这些算法特别重要，无论是银行转账、身份识别、在线浏览，很多都需要非对称算法来进行密钥分发与身份验证。举个例子，上Gmail时候会自动SSL加密，这个东西就是用RSA来做密钥分发的。<br>\n<br>\n那么，一旦量子计算机做出来之后，是不是隐私就无处遁形呢？那倒不一定。<br>\n<br>\n学界早就关注这个现象了，也提出了一些能解决这个问题的非对称密码体系，比如说基于格（lattice）的体系（比如NTRU）、基于纠错码的体系（McEliece），还有基于多变量的体系。这些体系都不依赖于隐含子群问题，所以对量子计算机造成的威胁是免疫的。不过，这些体系各有各不太实用的地方，也有些弱点，所以目前没有很多人采用。不过一旦足够规模的量子计算机造出来了，我们也有足够的技术储备来维持我们的隐私，维护目前的秩序。<br>\n<br>\n<h4><strong>参考资料</strong></h4>\n[1]<a href=""http://www.guokr.com/question/530973/"">量子计算机真的可以破解任何密码吗？</a>方弦，果壳网果壳问答\n	</div>\n</div>","科学技术"
