"title","descrip","LiuyanType","answer","detail","type"
"炎热会让斑马生出更多条纹","猎豹也许不能改变自己的斑点，但是有些斑马可以改变它们身上的条纹：一项新研究显示，在更温暖的地方斑马有更多的条纹。","2","\n		","<div class=""rumor-content"">\n	\n	<h2>论证</h2>\n	<div class=""content"">\n	现生的三种斑马都有着显眼的黑白条纹，在其他颜色灰暗的非洲食草动物（比如水牛和羚羊）中间特别引人注目——尤其是当背景是平淡无奇的热带稀树草原时。而这显眼的外表似乎会让斑马更容易成为狮子的午餐。<br>\n<br>\n斑马的“条纹之谜”困扰了科学家一个世纪之久，连达尔文也无法解答。关于斑马的条纹有五大假说：驱赶蚊虫、通过某种视错觉形成伪装、让捕食者感到困惑、降低体温，以及让斑马辨认彼此。<br>\n<br>\n在一项由美国国家地理学会的研究与探索委员会赞助的项目中，加州大学洛杉矶分校生物学家布伦达·拉瑞森（Brenda Larison）与同事造访了非洲各地16个普通斑马（<i>Equus quagga</i>）种群，研究了它们的条纹图案。尽管还是没能弄清哪种假说才是最终赢家，不过与条纹最有相关性的因素是温度。具体来说，温度越高，斑马身上的条纹越多。<br>\n<br>\n普通斑马是最常见的一种斑马，从埃塞俄比亚到南非都有它们的踪迹。研究团队总共测量了29种环境因素，如土壤湿度、降雨量、携带病菌的采采蝇以及狮子的分布情形等，然后把这些环境因素输入到电脑模型中，以检测哪些因素和斑马条纹的差异有关。<br>\n<br>\n结果表明，对斑马的条纹影响最大的两个因素是当地气温的稳定性，以及该地区最冷月份的平均温度。<br>\n<br>\n随后，研究人员又进一步用这两个温度变量来预测研究范围之外的斑马种群身上的条纹图案。拉瑞森表示：“我们能够证明，我们预测得相当准确。”而至于为什么温度会影响斑马的条纹，那就是另一个问题了，不过她认为，可能的原因有两个：<br>\n<br>\n<strong>①一个可能的解释是“冷却涡流”理论</strong>（""cooling eddy"" theory）：当空气接触斑马的身体时，黑色条纹上方的气流更快、更强（因为黑色吸收的热量比白色多），而白色部分上方的气流较慢。在这两股相反气流的交汇处，空气中可能会形成小漩涡，从而降低斑马皮肤的温度。拉瑞森举例说，有证据显示，斑马的皮肤温度比同地区其他没有条纹的哺乳动物低5.4华氏度（3摄氏度）。<br>\n<br>\n②另一个可能的原因是，条纹也许是抵御疾病的屏障，因为如马蝇（<i>Tabanidae</i>）这类携带疾病的蚊虫通常喜欢更热的温度。田野实验也表明，这些蚊虫不喜欢降落在有条纹的表面上。<br>\n<br>\n加州大学戴维斯分校生物学家蒂姆·卡洛（Tim Caro）支持第二个理论。他表示：“我们的研究发现有很多相似之处。”他自己的研究也显示，条纹与驱赶蚊虫有关。“马蝇携带的疾病对斑马来说很严重。”他说，“它们可以携带多种疾病，比如马流感，而且这些疾病在较为温暖潮湿的条件下可能会变得更危险。”<br>\n<br>\n然而，不论是这项新研究还是卡洛的研究，都没有发现条纹和狮子的数量之间有任何相关性。许多人认为条纹是为了让捕食者感到困惑。这项研究可以说是终结了这种假说。<br>\n<br>\n<br>\n<h4><strong>内容来源</strong></h4>\n<a href=""http://www.guokr.com/article/439854/"">炎热天气，让斑马生出更多条纹？</a>环球科技观光团,果壳网科学人主题站<br>\n<br>\n<br>\n\n	</div>\n</div>","科学技术"
"飞机越大越安全","人们买机票时的决定往往关乎命运！大飞机由于质量大、发动机引擎系统更优秀，受到的气流影响小，所以更佳舒适和安全，相反，小飞机虽然质量轻，但是相应的引擎系统就不那么强大，遇到强气流颠簸的很厉害，危险性大。所以，以后出行尽量选择大飞机吧！","0","\n		","<div class=""rumor-content"">\n	\n	<h2>论证</h2>\n	<div class=""content"">\n	通常情况下，飞行大体可以分为:起飞、初始爬升（离场程序）、爬升、巡航、下降、进近（进场程序）、最终进近、着陆这八个阶段，通常容易出现特情的关键阶段是起飞和着陆阶段。<br>\n<br>\n而对于不同的机型而言，其中七个阶段的操作程序和其相对的外界环境都是没有差别的，唯一的存在的不同便是巡航时的高度，通常大型机的巡航高度在10000米以上，而小型机的高度在9000米左右。在中纬度地区（大多数航线覆盖的区域），对流层在10000米-12000米以下，也就是说小型机的巡航是在对流层中，而大型机的巡航则在平流层之中。平流层中的大气相对于对流层稳定得多，所以大型机巡航时乘客们会发现很少有颠簸，而小型机中的乘客会时常遇到颠簸，但是这些颠簸都是在飞机承受范围内的，不然飞行员会根据雷达以及塔台提醒，果断地选择其他航路航行。<br>\n<br>\n<br>\n<h4><strong>内容来源</strong></h4>\n<a href=""http://www.guokr.com/article/69092/"">坐飞机，你被这些谣言骗过吗？</a>植物Dante，果壳网科学人主题站<br>\n\n	</div>\n</div>","科学技术"
"HPV疫苗无效且对人体有害","HPV疫苗是最恶劣的医疗谎言和欺骗，这个疫苗不但无效，还极度危险。它的效果只有0.2%，并且会带来各种严重的副作用。","0","\n		","<div class=""rumor-content"">\n	\n	<h2>论证</h2>\n	<div class=""content"">\n	<h2><strong>宫颈癌不是“冷门癌症”</strong></h2>\n流言中声称宫颈癌是一种“很偏门的癌症”、“占目前所有癌症种类的百分一还不到”，这种说法是没有道理的。根据globocan2012的统计数据，宫颈癌是女性中发病率排名第四的癌症，在整体发病率中排名第七，在2012年一年内，全球约有528000新发宫颈癌病例，约造成266000例死亡。在所有女性的癌症死亡中，宫颈癌导致的死亡约占7.5%[2]。随着筛查和早期治疗的推行，现在在发达国家宫颈癌的发病和死亡风险率确实有了明显的下降，不过从世界范围内来看，宫颈癌依然是威胁女性健康的重要因素。在中国，女性癌症发病率中宫颈癌也位列前十，2009年在肿瘤登记地区，女性宫颈癌的发病率约为万分之1.3[3]。<br>\n<h2></h2>\n<h2><strong>预防HPV16与18，挡住的只是小缝隙吗？</strong></h2>\n流言中说到，HPV疫苗只针对了两种与宫颈癌有关的HPV亚型（HPV16和18），还有很多种高危病毒亚型未纳入其中，因此“只能挡住大门的一个小缝隙”，这种说法也很有误导性。<br>\n<br>\n与宫颈癌相关的高危HPV确实有多个亚型，除了HPV16和18以外，31、 45、 52 、58等病毒亚型也被证明与宫颈癌风险有关。不过，这些病毒亚型的流行程度和对癌症发病的贡献相差很大。在世界范围内，HPV16与50%左右的宫颈癌发病相关，而HPV16加上HPV18总共与70%左右的宫颈癌有关[4]。由此看来，从预防HPV16和18入手来预防宫颈癌，就不能算是“只挡住一个小缝隙”了。<br>\n<h2></h2>\n<h2><strong>“有效性0.2%”之说的漏洞</strong></h2>\n流言中提到的关于HPV疫苗有效性的研究，是2007年发表在新英格兰医学期刊上的一篇HPV4价疫苗的三期临床试验数据报告[5]，这项研究是一项随机对照试验，共纳入了1万余名受试者，主要考察的有效性指标是严重性较高的宫颈上皮病变（包括CIN2、3以及原位腺癌）。该研究显示，与安慰剂对照组相比，接受3剂疫苗受试者当中疫苗预防这些病变的有效率为98%。流言中对这一数据进行了若干批驳，并提出在“注射的实际作用只有0.2%”的惊人结论，然而这段论证中存在不少漏洞。<br>\n<br>\n流言中说，这个数据没有考虑“不遵医嘱”没有完成接种的情况，如果把这些情况算上这个数字就要缩水到44%。用“不遵医嘱”的情况作为疫苗效果差的例证本来就是不合理的，更何况在论文中44%的数据并也不能用“不遵医嘱”来解释。这个数字是将所有参与了试验最初随机分组的受试者（intention-to-treat population）都纳入之后计算得出的结果，而在这些受试者当中，未能继续参加试验的首要原因并不是出现不良反应要求退出，而是在基线时检测发现HPV16或HPV18感染而被排除。这些HPV感染会可增加宫颈细胞病变的风险，因此把这些受试者重新纳入计算后，在给疫苗组和安慰剂组增加病变例数的同时，也会在一定程度上“拉平”两组之间的差距，导致计算得出的有效率下降。<br>\n<br>\n在流言后文中同样出现了明显的漏洞。前一句还写着“这个数字就急剧缩水成可怜的13%”，在下一句中这个数字就毫无来由地变成了比“没注射的有效率”还要低的1.3%。而且，“没注射的有效率”这种说法本身就是不成立的。在所有关于HPV疫苗有效性的临床研究中，疫苗对某一指标的预防有效率都是要以安慰剂对照组或未接种人群作为基线来计算的。按照这个定义，作为基线的未注射疫苗人群的有效率就应该是0，又怎么可能计算出“1.5%”这个数字呢？ <br>\n<h2></h2>\n<h2><strong>有效率，取决于评判标准</strong></h2>\n那么，HPV疫苗的有效率究竟有多少呢？这个问题很大程度上取决于研究中选择的评判标准。<br>\n<br>\n人们研发HPV疫苗，最重要的一个目的是预防宫颈癌的发生。因此，打疫苗与不打疫苗的女性人群中宫颈癌的发病率和死亡率差别是显示疫苗效果最有力的证据。然而，直接用癌症发病来评判HPV疫苗的有效性要面临很多困难。从持续的HPV感染到宫颈上皮病变、最终发展为癌症，中间要经历相当长的时间，HPV疫苗从上市到现在也还不到10年时间，目前在接种疫苗的人群中还很难收集到宫颈癌发病率变化的确切数据。一篇论文指出，“HPV疫苗对宫颈癌发病的作用要到世界范围内推进免疫接种的20~30年后才能最终确定”[6]。因此，目前的“有效率”一般是通过其他一些能在较短时间内检验的替代指标得出的。<br>\n<br>\n宫颈上皮内瘤样病变（CIN）是一个常见的替代指标。这是在组织和细胞学检查中发现的细胞形态异常。根据严重程度从轻到重，CIN一般可以分为1、2和3期。CIN本身不是癌症，轻度和中度的CIN也有不少可以随时间推移自行消退，不过仍有少数病变可进展为癌症，严重程度较高的病变恶变风险更高一些。有数据显示，大约70%未明确诊断意义的不典型鳞状上皮细胞（ASCUS）和CIN1病变可在6年内消退，而有6%的CIN1病变可进展至CIN3或更加严重，而CIN3病变约有10~20%风险进展为癌症[7]。因此，并不能将CIN简单理解为“会自愈的良性病变”。<br>\n<br>\n在临床研究中，当研究指标为与疫苗覆盖的HPV亚型相关的宫颈上皮病变时，疫苗与安慰剂组相比的预防有效率往往可达到90%以上，有时甚至接近或等于100%。不过，如果将指标放宽到与所有类型HPV感染相关的病变时，有效率数据确实会出现明显的下降。HPV4价疫苗的三期临床试验数据显示，疫苗大约可以预防所有与HPV相关分级较高的宫颈病变中的20%[8]。另一项较新的病例对照研究认为，接种疫苗对所有较高分级宫颈病变的预防有效率约为46%[9]。从这些结果来看，HPV疫苗确实不是万能的。毫无疑问，它不能预防全部的宫颈上皮病变，更不能替代常规筛查的作用。<br>\n<br>\n另外一个常用的替代指标是持续的感染。HPV16、HPV18的持续感染是诱发宫颈癌的主要风险因素，因此如果能减少持续感染的发生率，就应该能够减少宫颈癌的风险。在临床试验中，HPV2价和4价疫苗对HPV16和HPV18持续感染都表现出了较好的预防效果，有效率可达90%以上[10]。2007年一项对临床试验的系统评价显示，HPV疫苗大约可使HPV16和HPV18的持续感染发生率降至对照组的10~20%[11]。<br>\n<br>\n对于4价疫苗，生殖器疣的预防也是一个重要指标，它考察的是HPV6和HPV11免疫接种的效果，这两种病毒与大约90%的生殖器疣有关。一项纳入2209263名女性的队列研究发现，如果在14岁前接种，HPV4价疫苗对生殖器疣的预防有效率可达到93%，而在20岁之前开始接种并完成全部3剂接种的情况下有效率为76%[12]。<br>\n<br>\n目前关于HPV疫苗有效性的数据依然存在不少局限性，直接证明防癌效果以及长时间保护效果的数据不足，在这方面，还需要持续进行研究。有一些研究根据现有数据建立模型计算了HPV疫苗预防宫颈癌的效果[13]，但这些计算都涉及对疫苗长期有效性的假设，其结果的可靠性仍有待进一步研究检验。<br>\n<h2></h2>\n<h2><strong>HPV疫苗不会显著增加健康风险</strong></h2>\n除了质疑有效性，流言中也着重渲染了HPV疫苗的健康风险，声称有大量受害者在接种疫苗后出现“堵塞血管”、“癫痫”、“孕妇流产”等严重后果。而事实上到目前为止，并没有发现HPV疫苗导致这些不良后果风险增加的证据。<br>\n<br>\n首先必须要承认，在HPV疫苗接种之后，确实有不良事件的个案发生，死亡案例也同样有过报告。不过在这里，有两个方面需要特别注意：一是这些“不良事件”与疫苗接种的关系，二是不良事件发生率与基线发生率的关系。<br>\n<br>\n与有效性不同，HPV安全性的数据很多都来自上市后的监测数据。这些监测数据库记录的是实际疫苗接种后使用中发生的“不良事件”（Adverse events following immunization ，AEFI）。根据世界卫生组织的定义，AEFI包括了所有在疫苗接种后发生的不利的医学事件，它们不一定与疫苗使用存在因果关系[14]。这些案例值得警惕和分析，但除非得到进一步确认，否则它们不能直接作为疫苗危害的证据。例如，在HPV安全性监测中，人们发现了一些静脉血栓的案例报告，但在对这些病例进行追溯时发现，这些病例大部分都同时具有其他已知会导致血栓风险增加的因素，比如服用口服避孕药、吸烟、家族史或怀孕等等。以美国疫苗不良事件报告系统（VAERS）的数据为例[15]，这个数据库在2006年到2008年底一共记录了56例在接种HPV四价疫苗后出现静脉血栓的事件，其中31例有完整的临床数据可供追溯，而这31个病例中就有28个都存在已知的血栓风险因素。因此，这些病例报告并不能直接说明HPV疫苗与血栓风险有关。<br>\n<br>\n另外，在关注这样的报告病例时，也要同时了解这些不良事件的发生频率，以及它们与基线发生率的关系。依然以VAERS数据库为例，从2006年6月到2008年底这一检测系统共记录了32例发生在接种4价HPV疫苗之后的死亡病例，根据同时期美国疫苗接种的总数（23051336剂）可计算出报告率为10万分之0.1。和上面提到的静脉血栓情况类似，这些死亡事件中也存在药物滥用、感染、基础疾病等众多混杂因素，而且与同年龄青少年死亡率的基线数据相比，它也并没明显上升的趋势。因此，这些死亡病例并不能证明HPV疫苗导致了死亡风险的增加。<br>\n<br>\n来自疫苗安全数据链（Vaccine Safety Datalink）的数据显示，在接种HPV疫苗的人当中，并未发现卒中、血栓、癫痫发作、晕厥、格林-巴利综合征等不良事件的发生率显著高于基线数值[16]。对VAERS数据的分析也得出了类似的结果。此外，虽然曾有研究提示HPV疫苗可能与多发性硬化有关，但最近发表的大样本研究也显示，并未发现HPV疫苗导致多发性硬化及相关疾病风险增加的证据[17]。在过敏反应方面，HPV疫苗带来的风险也不比其他常用疫苗更高[16]。<br>\n<br>\n这些报告的数据有一定局限性，不过至少到目前为止，上市前和上市后的研究数据都显示HPV疫苗不会显著增加严重不良事件的发生风险，说它“极度危险”是毫无根据的。<br>\n<h2></h2>\n<h2><strong>孕妇接种HPV疫苗：不推荐，但也无需担心</strong></h2>\n由于研究尚不充分，目前并不推荐孕妇接种HPV疫苗。如果在接种尚未完成时发现怀孕，推荐将剩余的疫苗接种推迟到生产之后再进行[18]。<br>\n<br>\n不过，目前的研究数据显示，在怀孕期间接受HPV疫苗注射的孕妇中并未发现流产、胎儿畸形等不良后果增加的证据。因此美国CDC也指出，如果不小心在怀孕期间进行了接种，也不需要进行特殊处理[18]。<br>\n<br>\n一篇论文研究了3620名无意中在怀孕期间参与了HPV疫苗临床试验的女性，她们中有1796名接受了疫苗接种，其他分入了安慰剂组。结果显示，在疫苗接种组和对照组当中，婴儿活产率和自然流产率等指标没有出现显著差异[19]。在疫苗上市后的相关数据中，也没有发现疫苗导致出生缺陷和自然流产发生率上升的迹象[19,20]。<br>\n<br>\n<br>\n<br>\n<h4><strong>参考资料</strong></h4>\n<ol><li><a href=""http://mp.weixin.qq.com/s?__biz=MzA3MTM4NDQyNw==&amp;mid=203452533&amp;idx=1&amp;sn=7bd90b8d765041a165557c36c257c346&amp;scene=1&amp;key=79cf83ea5128c3e5112c64e684f9434a4b037f49f9dd9fb034465a53734cc6405686610b91980d49aeba04a56fcd320b&amp;ascene=1&amp;uin=MTU2NzI0ODk0MQ%3D%3D&amp;devicetype=webwx&amp;version=70000001&amp;pass_ticket=azM0b1jelEvbAZTCKUKeuUa%2Fs%2B52HJi%2B7KsCdwC%2FwfKNlcVT540fUDxaddnsLZJV"">宫颈癌HPV疫苗是最恶劣的医疗谎言和欺骗</a></li><li><a href=""http://globocan.iarc.fr/old/FactSheets/cancers/cervix-new.asp"">http://globocan.iarc.fr/old/FactSheets/cancers/cervix-new.asp</a></li><li><a href=""http://www.cnki.com.cn/Article/CJFDTotal-ZHLU201301004.htm"">http://www.cnki.com.cn/Article/CJFDTotal-ZHLU201301004.htm</a></li><li><a href=""http://www.cdc.gov/vaccines/pubs/pinkbook/hpv.html"">http://www.cdc.gov/vaccines/pubs/pinkbook/hpv.html</a></li><li><a href=""http://www.nejm.org/doi/full/10.1056/NEJMoa061741"">http://www.nejm.org/doi/full/10.1056/NEJMoa061741</a></li><li><a href=""http://www.ncbi.nlm.nih.gov/pubmed/19823051"">http://www.ncbi.nlm.nih.gov/pubmed/19823051</a></li><li><a href=""http://www.cancer.gov/cancertopics/pdq/screening/cervical/HealthProfessional/page2"">http://www.cancer.gov/cancertopics/pdq/screening/cervical/HealthProfessional/page2</a></li><li><a href=""http://www.fda.gov/ohrms/dockets/ac/06/briefing/2006-4222B3.pdf"">http://www.fda.gov/ohrms/dockets/ac/06/briefing/2006-4222B3.pdf</a></li><li><a href=""http://www.bmj.com/content/348/bmj.g1458"">http://www.bmj.com/content/348/bmj.g1458</a></li><li><a href=""http://www.who.int/bulletin/volumes/85/9/06-038414/en/"">http://www.who.int/bulletin/volumes/85/9/06-038414/en/</a></li><li><a href=""http://www.ncbi.nlm.nih.gov/pubmed/17996990"">http://www.ncbi.nlm.nih.gov/pubmed/17996990</a></li><li><a href=""http://www.ncbi.nlm.nih.gov/pubmed/23486550"">http://www.ncbi.nlm.nih.gov/pubmed/23486550</a></li><li><a href=""http://www.thelancet.com/journals/langlo/article/PIIS2214-109X(14)70237-2/abstract"">http://www.thelancet.com/journals/langlo/article/PIIS2214-109X(14)70237-2/abstract</a></li><li><a href=""http://www.who.int/vaccine_safety/initiative/detection/AEFI/en/"">http://www.who.int/vaccine_safety/initiative/detection/AEFI/en/</a></li><li><a href=""http://www.ncbi.nlm.nih.gov/pubmed/19690307"">http://www.ncbi.nlm.nih.gov/pubmed/19690307</a></li><li><a href=""http://www.ncbi.nlm.nih.gov/pubmed/21907257"">http://www.ncbi.nlm.nih.gov/pubmed/21907257</a></li><li><a href=""http://www.guokr.com/article/439771/"">http://www.guokr.com/article/439771/</a></li><li><a href=""http://www.cdc.gov/vaccines/pubs/preg-guide.htm#hpv"">http://www.cdc.gov/vaccines/pubs/preg-guide.htm#hpv</a></li><li><a href=""http://www.cfp.ca/content/58/3/268.full"">http://www.cfp.ca/content/58/3/268.full</a></li><li><a href=""http://www.ncbi.nlm.nih.gov/pubmed/19935016"">http://www.ncbi.nlm.nih.gov/pubmed/19935016</a></li></ol>\n内容来源：<a href=""http://www.guokr.com/article/439906/"">HPV疫苗：安全有效绝非谎言</a>，窗敲雨，果壳网科学人主题站<br>\n\n	</div>\n</div>","科学技术"
"有智能手机配件可快速诊断艾滋病","伦比亚大学工程学院的生物医学工程副教授塞缪尔•K•西亚带领一个研究小组，开发出了一种价格低廉，用于即时检测的智能手机配件，该配件能在15分钟内同时检测手指采血样本中是否含有三种传染病标记物。","2","\n		","<div class=""rumor-content"">\n	\n	<h2>论证</h2>\n	<div class=""content"">\n	实验室的血检设备包括机械、光学、电子等系统，这个设备首次实现了上述系统的全部功能。特别的是，该设备无需储能就能进行酶联免疫吸附检测，检测所需的电能可以完全由智能手机提供。它能够进行HIV抗体、梅毒螺旋体特异性抗体和梅毒螺旋体非特异性抗体三联免疫分析，而目前尚无任何单一化验项目能包括这三个指标。<br>\n<br>\n这种创新配件(或者叫外接设备)是一种能够轻松连接到智能手机或电脑上的小型设备。最近，卢旺达的医护人员正在试用该配件，对预防母婴传播诊所和自愿咨询检验中心96位病人的手指采血血样进行检测。这一成果发表在2月4日的《科学转化医学》杂志上。<br>\n<br>\n工作成果证明，在智能手机配件上面，人们就能完成整套实验室水准的免疫分析。把微流体技术与消费电子产品的最新技术结合起来，让任何拥有智能手机的人都有条件进行实验室诊断检验。这种技术可能会改变全世界医疗服务的提供方式。<br>\n<br>\n团队希望在之前工作的基础上，研发用于快速即时诊断HIV、梅毒以及其他性传播疾病的小型诊断硬件设备。大家都清楚，如果孕妇能在早期得到诊断和治疗，会大大降低性传播疾病对母亲和孩子的不利影响。团队开发的这个外接设备又小又轻，一只手就可以拿住，用预填充了反应试剂的一次性检测盒进行化验分析，检测盒上有不同疾病的检测结果显示区域，很像ELISA分析的工具。西亚估计，这个外接设备的制造成本约为34美元，远低于标准ELISA设备18450美元的成本。<br>\n<br>\n该团队在这个外接设备上使用了两个重要的创新设计，使设备能耗显著降低，这样它才能在没有24小时供电的地方正常工作。他们用按压真空泵代替了功耗较大的电动泵，使用者能够用机械按压的方法制造一个负压室，从而推动预装在检测盒中的各种反应试剂流动。这种装置持久耐用，使用者也不需要什么训练，装置无需后期维护或者额外制造其它部件。第二个创新设计是，他们没有在里面装电池，而是利用耳机插口充电和传输数据。而且，由于所有智能手机都配有标准耳机插口，因此，它能够在任何一部兼容智能设备（包括苹果手机和安卓手机）上即插即用。<br>\n<br>\n在卢旺达实地使用时，医护人员先用手机应用进行30分钟的训练，手机应用界面方便使用，可以全程为使用者提供帮助，其中含有每个步骤的图片指示说明，并内置了计时器，用于提醒使用者进行下一步操作，并能记录下检测结果以备后用。绝大多数（97%）病人表示，他们会推荐别人使用这个配件，因为从检测到获得结果的时间很短，一次能够检测多种疾病，而且检测过程简单易行。<br>\n<br>\n开发的配件能够为从医务人员到患者的多种不同用户群体提供新功能。如果检测梅毒感染的能力得到了提高，也许人类能够将这种疾病的死亡人数降低到原来的十分之一。外接设备的灵敏度很高，而假阳性率很低，因而适合用于大规模筛查，或许，我们能够在对社区内的居民进行HIV普查并迅速让患者接受抗逆转录治疗，这几乎可能停止艾滋病的传播并消灭这种毁灭性的疾病。<br>\n<br>\n<br>\n<h4><strong>内容来源</strong></h4>\n<a href=""http://www.guokr.com/article/439913/"">智能手机配件，快速诊断艾滋病</a>，健康朝九晚五，果壳网科学人主题站<br>\n<br>\n<br>\n\n	</div>\n</div>","科学技术"
