"title","descrip","LiuyanType","answer","detail","type"
"理发师是外科医生的祖师爷","木匠拜的祖师爷是鲁班，老师拜的祖师爷是孔子，外科医师拜的祖师爷应该是理发师。","1","\n		","<div class=""rumor-content"">\n	\n	<h2>论证</h2>\n	<div class=""content"">\n	<img src=""https://3-im.guokr.com/qUZQAnYoEQtVcG0jl7QCApBQN6_vKuec2SBSbo8aZsTBAQAAgwIAAEpQ.jpg"" style=""max-width: 480px"" data-orig-width=""449"" data-orig-height=""643"" data-hashkey=""qUZQAnYoEQtVcG0jl7QCApBQN6_vKuec2SBSbo8aZsTBAQAAgwIAAEpQ""><br>\n<br>\n在中世纪的欧洲（约11到13世纪左右），当时的手术有很多是由理发师完成的。所以，你能看到第一张图中的理发师右手拿着剪刀，代表平常帮人们整理头发，而左手拿着的刀子可不只是替人刮胡子的剃刀，而是帮顾客割除身上的痔、皮肤肿瘤……等等赘生物的手术刀。<br>\n<br>\n这听起来或许很可笑，甚至是很可怕，但是在那个时代，医师间有个普遍的想法，就是手上沾染到鲜血有损自己的尊严。另外，当时的国家制度都是宗教凌驾政治之上，教会并不认为外科学是门重要的医学，只把它当作是一种附属的医疗行为，或是不到最后关头不得不使用的手段。这样的氛围让一些江湖术士得以乘隙而入，手术质量自然良莠不齐，历史书里有时用“巡游的庸医”来称呼这一群人。相比之下，遇到有经验的理发师还算是比较好的。<br>\n<br>\n<img src=""https://2-im.guokr.com/a16JZEDX4VetfqIBqoHwf4n6IYbdivYb9dKHbBHK_j4NAQAAigEAAEpQ.jpg"" style=""max-width: 480px"" data-orig-width=""269"" data-orig-height=""394"" data-hashkey=""a16JZEDX4VetfqIBqoHwf4n6IYbdivYb9dKHbBHK_j4NAQAAigEAAEpQ""><br>\n<br>\n第二张油画是尼德兰画家博斯（Hieronymus Bosch）的画作“愚笨的治疗”（The Cure of Folly），描述了荒唐的医疗行为——“取出疯狂之石”（Extractionof the Stone of Madness）。<br>\n<br>\n中世纪的时候，病理生理学薄弱得可怜，当时的人不仅认为祈祷可以治病，甚至认为智商低的人是因为脑里有石子造成的，所以教士和江湖郎中有时会合演一出闹剧，由头上戴着一顶所谓“智慧的漏斗”的理发师，切开病人的头皮，然后以预藏的石子欺骗病人，告诉病人已取出愚笨之石，然后将石子丢入河流中，就算完成了此一治疗行为。<br>\n<br>\n博斯的画作向来使用大量象征与符号，以艰涩难懂闻名，被认为是二十世纪“超现实主义”的启发者之一。但上述的作品却是简单而直接，以近乎戏谑的手法，嘲讽那个时代可说是“骗术”的外科治疗。或许，从事此手术的“理发师兼外科医师”才需要取出脑中的“愚笨之石”吧！<br>\n<br>\n另外一个让正统医师不愿从事外科治疗的原因更容易理解，因为不好的治疗结果会让医师人身安全受到危害。<br>\n<br>\n在中世纪之前，统治过意大利的东哥德王国（The Ostrogothic Kingdom）有条严苛的法律，依据国王的规定，医师从事外科矫治的行为要百分百成功，如果医师手术失败，甚至造成患者死亡的话，那医师就要被交给患者的亲戚朋友处置。<br>\n<br>\n这样的法律规定造成正规医师不愿轻易替病人动外科手术，即使不得不选择开刀治疗时，医师在手术前也要和病患及其家属订定契约，言明医师在手术失败后不会因其结果受到人身迫害。这应该是当代手术同意书的滥觞，只是在当时这是医师的保命符，而现行的手术同意书并无此功能，最多只是一份有法律效力的治疗前告知文书而已。<br>\n<br>\n中世纪的这些状况，逼得医师宁愿从事非侵入性的治疗，他们大多从事内科或药理学的研究。这么一来，外科学的发展停滞不前也就可以理解了。取代外科医师功能的理发师，地位自然不高，在当时的很多油画中，描绘出理发师从事的是放血、割割小疣，或者是取出愚笨之石的工作，让人看起来心里真不是滋味。<br>\n<br>\n<img src=""https://3-im.guokr.com/F30jrc1simhA8yxoTnYIgwOJcAOrJPPyUbzt0eWxrCMsAQAAXwEAAEpQ.jpg"" style=""max-width: 480px"" data-orig-width=""300"" data-orig-height=""351"" data-hashkey=""F30jrc1simhA8yxoTnYIgwOJcAOrJPPyUbzt0eWxrCMsAQAAXwEAAEpQ""><br>\n<br>\n第三张油画比较惊悚，这张十五世纪的画描绘的是一名贪官接受活生生剥皮的刑罚，这种刑罚虽不像中国古代的“磔刑（凌迟）”要受千刀万剐，但受刑的人遭受的痛苦也不相上下了。画中手脚利落的行刑人不是刽子手，而是经验丰富的“理发师兼外科医师”！<br>\n<br>\n身为当今的外科医师，读完了这些历史，觉得有不幸，也有幸运。不幸的是，民智已开，任何医疗的手术不管难易度，都被寄予厚望，只要有所闪失，医师虽不至于像东哥德王国的医师一样被交予病患家属发落，但要面对家属排山倒海而来的压力，诉诸媒体，对簿公堂，甚至活生生在大众面前被说长道短，即使一生救人无数，只要一次失手，便会被打入没有“医德”的阿鼻地狱。<br>\n<br>\n<br>\n<h4><strong>参考资料：</strong></h4>\n[1]<a href=""http://www.guokr.com/article/437140/"">理发师是外科医师的祖师爷</a>， PanSci， 果壳网健康朝九晚五<br>\n<br>\n\n	</div>\n</div>","传说轶事"
"萝莉脸的女性生育能力强","研究表明萝莉脸的女性生育能力更强。","0","\n		","<div class=""rumor-content"">\n	\n	<h2>论证</h2>\n	<div class=""content"">\n	<h2><strong>年龄和生育能力</strong></h2>\n萝莉脸的女性通常被认为比她们的同龄女性更年轻，而年轻不年轻与生育力有着密切的关系。早在20世纪60年代，法国历史学家路易•亨利就发现对于不同的文化群体来说，年龄与生育力之间的关系是相对稳定的。以20-24岁时女性的生育力为标尺，30-34岁时生育力降为原来的85%，这一比例在40-44岁时进一步降到35%，50-54岁以后，这一指标不再具有实际意义。相比男性，女性的生育力下降得更快。<br>\n <br>\n鉴于年龄可以作为评价女性生育力的一个有效指标，琼斯认为萝莉脸可能是女性年轻和生育力强的一个外在信号。这些信号，包括大眼睛、小鼻子、厚嘴唇、小下巴等等，就像一块无声的广告牌一样，向男性传达女性年轻和富有生育力的信息。因此，对具有萝莉脸的女性表现出由衷的兴趣，被她们自然而然地吸引，有助于帮助男人找到一个能生孩子的女人。而对女人来说，具有萝莉脸也有助于增加自己在择偶市场上的竞争力。<br>\n <br>\n2006年，来自伦敦大学学院的心理学家佛海姆和瑞夫斯也发现，具有萝莉脸的女性被男性认为更年轻，更健康，更有生育力。不过，这些研究只是间接地支持了琼斯的观点，萝莉脸的女性的确比普通女性显得更年轻，更讨男人喜欢，她们是否真的比普通女性有更强的生育力则是另外一回事，目前这一方面尚无实证资料。<br>\n<br>\n<br>\n<h4><strong>参考资料：</strong></h4>\n[1] <a href=""http://www.guokr.com/article/129619/"">面如萝莉，更有魅力</a>， 非言语， 果壳网性情<br>\n\n	</div>\n</div>","传说轶事"
"在手机充电时接电话会被电死","一人在家中给手机充电，电话铃响，他没有拔下充电器便直接接听。几秒之后，强大电源流过手机，年轻人被击倒在地。被发现时他已失去了意识，心跳微弱，手指烧焦，被立即送往医院，但是到达时即被宣布死亡。","0","\n		","<div class=""rumor-content"">\n	\n	<h2>论证</h2>\n	<div class=""content"">\n	<h2><strong>正常手机充电只输出5V以下电压</strong></h2>\n手机充电器的结构包括高压部分（220V交流）、变压器和低压供电部分（输出5V以下直流），只有低压供电部分是连接到手机上的。一般情况下，通过人体的直流电电压要超过36V才会造成危害，正常工作下的手机充电器，即使手机外壳漏电，5V以下的输出电压也是不会对人造成伤害的。 <br>\n <br>\n<h1><strong>特殊情况下会发生触电吗？</strong><strong> </strong></h1>\n那么是否有可能因为充电器内部发生短路，造成高压部分连接到手机上而导致触电呢？答案是，几乎不可能。充电器内部高压和低压部分最靠近的地方是变压器。变压器是由高压和低压两级线圈组成的，组成线圈的导线表面都涂有绝缘漆，就算是前后两级线圈的表面直接接触也不会短路。退一步说，就算人为地使得充电器内部短路，比如先破坏变压器线圈表面的绝缘漆，再把高压端和低压端焊接在一起，220V电压直接连到手机里。这时手机的电路已经被烧毁了，不会有来电，也不能用来打电话了。而即使是在这种情况下，只有手机是金属外壳，并且手机内部的电路和它的外壳连通，触碰手机才有可能触电。<br>\n<br>\n不合格的充电器、手机电池，可能会因为设计缺陷，散热不好，存在过热而爆炸的危险，也确实有类似的事故。至于在手机充电时接电话而被电死，完全是危言耸听。<br>\n<h2></h2>\n<h2><strong>流言溯源</strong><strong> </strong></h2>\n流言始于2004年，可能源于2004年8月11日刊登在印度报纸（the Press Trust of India和 the New India Express）上的一条新闻：K. Viswajith在手机充电时接电话被电击了。文章没有提到Viswajith是使用了什么牌子的手机，对于事件的原因也没有进一步的分析，之后也没有类似的事件被报道。 <br>\n <br>\n <br>\n<h4><strong>参考资料：</strong></h4>\n[1] 新闻来源 <a href=""http://www.snopes.com/horrors/techno/cellcharge.asp"">Snopes网站</a> ，报纸官网没有提供新闻原文<br>\n[2] <a href=""http://www.guokr.com/article/957/"">在手机充电时接电话会被电死？</a>冷冻过的鱼，果壳网谣言粉碎机<br>\n \n	</div>\n</div>","科学技术"
"长期服用伟哥能保护心脏","《BMC医学》10月19日公布了一项最新研究成果，研究发现，万艾可（伟哥）也许能够安全用于治疗心脏病。该研究表明，在不同心脏病病程中，长期每日服用伟哥都能起到保护心脏的作用，而且几乎没有副作用。","2","\n		","<div class=""rumor-content"">\n	\n	<h2>论证</h2>\n	<div class=""content"">\n	万艾可的主要成分是磷酸二酯酶5抑制剂，同时也是其他治疗勃起障碍常用药的主要成分。磷酸二酯酶5的作用是防止平滑肌组织舒张，而磷酸二酯酶抑制剂可以阻断这一作用。人们发现，心脏中同样存在磷酸二酯酶5，于是学者开始研究磷酸二酯酶5抑制剂能否治疗非泌尿系统疾病。尽管之前的研究得到了一些很有前途的结果，但是实验研究大多数是针对动物进行的，并且PDE5i的心脏保护作用仍然不明确。<br>\n<br>\n罗马大学的科学家通过检索2004年1月到2014年5月之间发表的文献，对多个随机对照试验进行了荟萃分析（Meta分析），从而对PDE5i心脏保护作用的有效性进行验证，并确定人体是否对其有良好的耐受性以及药物的人体安全性。研究人员最终从MEDLINE、EMBASE、考科兰图书馆和SCOPUS这4个数据库中筛选出24个匹配的试验用于分析。这些试验囊括了1662例病人，覆盖了多个种族，分别用PDE5i和安慰剂进行治疗。<br>\n<br>\n在此项研究中，科学家首次对磷酸二酯酶5抑制剂对心脏大小形状的影响及其效果进行了平行分析。左心室肥厚会导致左心室心肌增厚。分析结果显示，PDE5i能够防止左心室肥厚患者的心脏继续增大和发生形态改变。对于患有各种心脏疾病的患者，磷酸二酯酶5抑制剂也能够改善心脏功能，而且不会对患者的血压产生不良影响。<br>\n<br>\n论文的第一作者安德列·伊西多说：“我们发现，对于一些心脏病患者来说，万艾可的主要成分是一种安全有效的治疗药物。这些发现非常令人鼓舞，科学家现在需要立刻对此进行大量的临床试验。”<br>\n<br>\n<br>\n<h4><strong>内容来源：</strong></h4>\n<a href=""http://www.guokr.com/article/439362/"">伟哥新用途，为你提供“贴心保护”</a>，JacquelineShawn，果壳网科学人主题站<br>\n<br>\n\n	</div>\n</div>","科学技术"
"量子共振信息水可以治病","宇宙中存在一种量子的 “灵力场”。人体各器官都有其固有的共振频率，体内的“灵力场”紊乱之后，共振频率就会偏离正常，继而生病。如果把正常人体共振信息全部取出、放大、永久记忆在水上，做成量子共振信息水，放在患处附近，就可以“隔空治病”，把紊乱的人体频率恢复正常，从而恢复健康。","0","\n		","<div class=""rumor-content"">\n	\n	<h2>论证</h2>\n	<div class=""content"">\n	<h2><strong>堀尾忠正是谁？ </strong></h2>\n“量子共振信息水”的发明者叫堀尾忠正 [1]。他自称“从小喜欢物理学，1996年在暨南大学医学院获得医学硕士学位，大学毕业不久就成了当地名医。其后系统学习了量子学、心理学……分析了霍金的《时间简史》，指出其理论中的缺陷及其缺失的部分。同时补充上第五种力和第五种场，即灵力、灵力场，可以更利于揭开宇宙真相 [1]。” <br>\n<br>\n不过，在谷歌学术搜索引擎中，谣言粉碎机调查员找不到任何与“灵力场”、“量子共振信息水”有关的文献。 <br>\n <br>\n<h2><strong>汉字的排列组合不是科学研究 </strong></h2>\n共振和量子信息分别是物理学中的两个专有名词。“量子共振信息水”只不过是把这二者“嫁接”了起来。尽管找不到什么公开文献的佐证，他本人却多次透露“想做第一个获得诺贝尔奖的中国人”。事实上，从网上能找到的资料来看，他很可能只有观点，没有论据。 <br>\n<br>\n在现实生活中，要想证明存在一家新的养鸡场，首先要给出养鸡场的详细地址。在物理学中，要想证明存在一种新的量子场，也要先给出量子场在物理学理论中的详细地址，叫做“拉格朗日量”。例如，电磁场、引力场都有各自的拉格朗日量。有了这个地址，我们才可以深入场的内部，看看它占地面积多大，养了什么样的鸡，卫生是否达标。如果有人兜售养鸡场的股份，又没有主动公开养鸡场的地址，那八成是个骗子。同理，网络上那些所谓的“灵力场”、“信息场”、“全息场”、“生物场”，如果没有相应的拉格朗日量的话，就等于没有地址的养鸡场，万万不可轻信。 <br>\n<br>\n如果无法提供 “灵力场”存在的依据，我们就无法确认它的存在。人体器官的共振频率的情况也是类似的。我们知道，频率是一个物理量，可以写成一个有量纲的数。例如，一般微波炉产生的微波频率是2450兆赫兹[2]，表示一秒钟之内，电磁场能够在其中振荡24.5亿次。那么，健康人体的共振频率是多少赫兹呢？生病后又是多少赫兹呢？不同的疾病对应的频率是否相等呢？量子共振信息水中总共“记载”了多少个不同的频率数值呢？10ml的水和200ml的水分别能“记载”多少比特的信息呢？谣言粉碎机调查员没能找到堀尾忠正的回答。 <br>\n<br>\n从这个意义上说，“量子共振信息水”的概念只不过是几个汉字的排列组合，并不等于科学的研究成果。这些没有证据又要打破常识的观点，其实连“错”都算不上。 <br>\n <br>\n<h2><strong>未经证实的治疗效果 </strong></h2>\n从错误的理论出发，不一定碰不到正确的结果，那么，“量子共振信息水”有这样的好运吗？所谓将水“隔空”放在患处附近，就能治愈任何疾病的说法有什么科学依据吗？ <br>\n<br>\n堀尾忠正在网站上公布了很多无名无姓，无从考证的“个案”，其中包括“深圳有一位女的”，“多位癌症等严重的患者”，“一位从英国专程来找我治疗的”，“中国某开国元帅、国务院副总理的孙子” [1]等等。 <br>\n<br>\n也许他是为了保护个人隐私，才不透露“个案”的具体信息的。那么，“量子共振信息水”是否有其它的间接证据证明其效果呢？当被问到是否进行过动物实验时，堀尾忠正流露出强烈不满：“这同‘郑人买履’，不相信自己穿鞋时脚的感受、而只相信尺码一模一样……我直接选择了正常人体的共振信息记忆在水上，而不是选择动物的共振信息……结果是，在人身上人人有效，而在动物身上很多会不灵了。” [1] <br>\n<br>\n堀尾不但制售“量子共振信息水”，还主动提出为一名白血病患者治疗。2011年2月21日，大丰之都网报道说：堀尾称自己看到某媒体的报道后，“千方百计想”找到患者葛某，“希望她用灵力医学排列和量子共振信息水治疗白血病”。他声称“曾经治疗过不少白血病人，均是两星期就返校上学”，并断言葛某“3月2日就可回校上学”。记者表示，“（葛某）使用了信息水后，效果看上去也是非常明显的，随着我们的跟踪报道，我想大家也会一同见证。”2011年3月3日，患者葛某去世。 [3] <br>\n <br>\n<h2><strong>量子医学不过是海市蜃楼 </strong></h2>\n量子物理学是人类在20世纪最伟大的科学发现之一，它将我们对客观世界的认识深入到了比原子还微小的尺度，极大地改变了我们的生活方式。在中文文献检索系统中，也能查到数个“量子医学”的文献。那么，世界上真的有量子医学吗？ <br>\n<br>\n泛泛而论，一切已知的物质都是由基本粒子组成的。一切基本粒子都服从量子物理学的运动规律。因此，一切运动，包括生命现象，本质上讲都是一种量子的物理运动。然而，这并不意味着我们必须用量子理论来解释一切现象。一方面是因为，我们不可能知道每一个基本粒子在任何时刻的准确量子状态；另一方面，许多复杂现象都是宏观的集体的行为，不了解微观机制，并不一定会影响我们对问题的认识，这是物理学本身固有的性质。例如，量子物理学认为，电子没有固定的运动轨道，而是呈一种电子云的分布。但是，当我们做电学实验时，只要知道导体中电子的集体运动可以看作电荷的流动就可以了。这种解释是量子物理的一种近似的等效表述，并不与之矛盾。 <br>\n<br>\n所以，研究人体疾病的发展规律，最重要的理论基础是生理学、化学或者经典物理学，而不是量子物理学。在人体疾病的层次上，它们的可操作性要比直接解量子物理方程高的多。检测和治疗疾病的手段也是多种多样，其中一些运用了量子物理学的研究成果，例如核磁共振、PET扫描、放射性治疗等等，但这并不等于是量子医学。因为在所有检测结果、治疗效果中，对疾病的描述和对疗效的评估都不是建立在量子理论的基础上的。 <br>\n<br>\n在现有的“量子医学”文献中，有关量子物理的表述存在诸多错误，体现出文章作者缺乏基本的常识。例如，有文献说：“电子、质子、中子等都是基本粒子” [4]，“物理学上量子是电磁辐射最小的能量描述, 因此量子医学上使用的电磁场辐射的能量最低、最安全[5]”。实际上，中子和质子都是由夸克组成的，并不是基本粒子。量子不单单用于描述电磁辐射，而是涵盖了所有物质的微观形态，甚至包括真空。如果光子的密度很大，即使单个光子的能量很低，总的能量密度也会很高，不见得最安全，因此这个因果关系也不成立。 <br>\n <br>\n <br>\n<h4><strong>参考资料：</strong><strong> </strong></h4>\n[1] <a href=""http://news.dfzs.cc/local/depth/2011/0303/29274.shtml"">某销售量子共振信息水的公司主页</a><br>\n[2]<a href=""http://en.wikipedia.org/wiki/Microwave_oven"">http://en.wikipedia.org/wiki/Microwave_oven</a> <br>\n[3] <a href=""http://news.dfzs.cc/local/depth/2011/0303/29274.shtml"">“感恩女孩”葛文倩带着满足离开人世</a> <br>\n[4] 王簃兰. 量子医学在临床诊断及研究中的进展. 中国医师杂志. 2004:6(3). <br>\n[5] 史新中. 量子医学的发展及临床应用. 东南国防医药. 2006:8(2). <br>\n[6]<a href=""http://www.guokr.com/article/66963/"">量子共振信息水，到底有多不靠谱？</a><a href=""http://www.guokr.com/i/0884326152/"">Sheldon</a>，果壳网谣言粉碎机<br>\n \n	</div>\n</div>","传说轶事"
"台湾餐厅供应烤婴儿","在台湾，死掉的人类胚胎或者婴儿会被卖给餐厅，餐厅将这些胚胎或者婴儿做成烧烤，供食客享用。（图片可能引起不适）","0","\n		","<div class=""rumor-content"">\n	\n	<h2>论证</h2>\n	<div class=""content"">\n	照片中的男子名叫朱昱，是中国一位饱受争议的行为艺术家。这张照片出自他在2000年上海艺术节上展出的一组行为艺术作品：《食人》。流言中的照片是该系列作品中的一幅[1]。但是照片中的婴儿确实是真的[2]。<br>\n<br>\n参考资料<br>\n[1]<a href=""http://www.snopes.com/horrors/cannibal/fetus.asp""> Fetus Feast </a><br>\n[2]<a href=""http://www.baike.com/wiki/%E6%9C%B1%E6%98%B1"">朱昱 </a>\n	</div>\n</div>","传说轶事"
"地暖的六大危害","最近，网上罗列出地暖的六大危害，每一种危害都让人触目惊心：危害一是地热极有可能是造成儿童患白血病的原因之一，称医学研究证明，长期处于地热供暖辐射的环境中，会使血液、淋巴液和细胞原生质发生改变；危害二是能够诱发癌症并加速人体的癌细胞增殖，称地暖辐射污染会影响人体的循环系统、免疫、生殖和代谢功能；危害三是影响人的生殖系统，称主要表现为男子精子质量降低，孕妇发生自然流产和胎儿畸形等；危害四是可导致儿童智力残缺，称地暖也是导致婴儿发育不良的罪魁祸首；危害五是影响人的心血管系统，主要表现为心悸、失眠、白细胞减少、免疫功能下降等；危害六是对人们的视觉系统产生不良影响，称过高的地暖辐射污染会引起视力下降。","0","\n		","<div class=""rumor-content"">\n	\n	<h2>论证</h2>\n	<div class=""content"">\n	流言中的描述均属于我们所关心的“电离辐射危害”，指的是人们在利用射线和核能时受到超过一定剂量的电离辐射而造成的健康影响，和地暖有本质不同，实属偷梁换柱，李代桃僵。<br>\n<br>\n<h1><strong>什么是电离辐射？有什么危害？</strong></h1>\n所谓电离辐射，顾名思义是指能够使物质发生电离的辐射。电离辐射通常可分为两类，一类为高频率的电磁波，如X射线、γ射线；另一类为高能粒子束，如α、β 粒子或中子束等。引发电离辐射的放射性物质是人类居住环境的组成部分，日常生活中的电离辐射41%来自石头、泥土及建筑材料中的放射性气体；28%来自岩石、土壤中的放射性物质；15%来自X射线等医疗辐射；9%来自食物和饮料中的天然放射性核素；6%来自宇宙射线；1%来自高空飞行等。天然辐射源所致平均辐射剂量就世界范围来看，每人每年大约为2.4mSv。<br>\n<br>\n电离辐射对生物体的效应是通过电离辐射的能量作用于生物大分子和水，使得后者发生分子不稳定、分子重排、产生自由基并造成损伤。在这其中受影响最大的就是 DNA分子。受损的DNA可以经体内酶系统修复，但也可能发生错误修复，这是电离辐射可能诱发癌症的原因之一。分子电离、自由基产生、化学键断裂使得亚细胞结构破坏，表现为细胞代谢、结构、功能的改变。相同辐射剂量作用下，不同细胞出现的损伤程度不同。一般来说，淋巴组织、骨髓、小肠上皮和性腺对辐射最为敏感；其次是角膜、晶状体、内皮细胞等；肌肉、骨骼、软骨和结缔组织对辐射最不敏感。<br>\n<br>\n<br>\n<h1><strong>地暖的”辐射“又是什么？</strong></h1>\n能让你感觉到暖和的，那是红外和远红外辐射，只要是热的东西都会发出。地暖的原理，就是将常见的外露的水暖气或电暖气，做成管道或电热管状埋设在地板下而已。发热原理和暖气一样，只不过发热位置不同而已。地暖辐射主要是以热的形式放出，这正是其能取暖的原因。<br>\n<br>\n<br>\n<br>\n<h4><strong> </strong><strong>内容来源</strong></h4>\n[1] <a href=""http://www.guokr.com/article/13318/"">电离辐射为什么会对健康造成风险</a>,赵承渊,果壳网科学人主题站<br>\n[2] <a href=""http://www.guokr.com/question/575736/"">地暖六大危害是真的吗？</a>fengfeixue0219,果壳网问答<br>\n<br>\n<br>\n\n	</div>\n</div>","科学技术"
