"category","date","title","descrip","LiuyanType","answer","detail"
"食品安全","2013-10-16","喝可乐会二氧化碳中毒","一个人喝了8听可乐之后，因为血液中二氧化碳浓度太高去世。","假","","<div><div class=""rumor-desc""><strong>流言</strong><span class=""arrow-right""></span>一个人喝了8听可乐之后，因为血液中二氧化碳浓度太高去世。<br></div></div><div><p class=""rumor-truth"">		<strong>真相</strong><span class=""arrow-right""></span>少量的二氧化碳和氧气一起被人吸入时没有危害。而吞下的二氧化碳会随着打嗝或者粪便排出体外，也可通过胃粘膜进入血液最后到达肺部随呼吸排出，也不会对人体造成任何危害。中毒事件纯属捏造。\r</p></div><div class=""rumor-content"">		<h2>论证</h2>	<div class=""content"">	这则流言最早是1999年开始在互联网上流传的。我们查阅了报纸并没有发现与之相关的报道。<br><br>二氧化碳是一种无色、无味的气体，充填在碳酸饮料中用来产生气泡。尽管高浓度的气态二氧化碳可以致命，但是充填在饮料里的二氧化碳则没有这种危害。二氧化碳的危害性并不是因为它本身有毒，而是因为过量的二氧化碳会使人窒息，因为它会阻碍人获得足够的氧气。这和溺水会使人死亡的道理一样，并不是说水本身是有毒的。少量的二氧化碳和氧气一起被人吸入时是没有危害性的，因此人们喝碳酸饮料时吸入的那些二氧化碳完全不会对人造成危害。<br><br>吞下二氧化碳所造成的危害甚至比吸入还要小，因为人的胃是不需要担心“窒息”的。吞下的二氧化碳会随着打嗝或者粪便排出体外，也可能通过胃粘膜进入血液最后到达肺部随呼吸排出。<br><br>可口可乐公司对此事的解释是：<br>碳酸化时加入到饮料中的二氧化碳通过消化道摄入是不会对人体造成危害的。和其他食品添加剂一样。二氧化碳的安全性是经过了世界范围内的权威机构评估，并证实对人体无害的。没有证据表明碳酸化过程对消化道或者整个人体的健康有任何危害。有人因喝可乐致死的事件是虚构的。<br><br>参考资料<br>[1]<a href=""http://www.snopes.com/cokelore/deadly.asp""> CO2 Fast, 2 Furious </a>	</div></div>"
"科学技术","2013-09-03","月球到达近地点将引发超级强震","2011年3月19日，“超级月亮”即将展现在我们面前。这一轮满月将比以往要大而亮，因为它是19年来最接近地球的一次。月球的引力增大将会使得地球的板块受到影响，从而诱发大规模的地震、火山、海啸等自然灾害。日本发生的8.8级强烈地震就是这次“超级月亮”作用的结果。","假","","<div><div class=""rumor-desc""><strong>流言</strong><span class=""arrow-right""></span>2011年3月19日，“超级月亮”即将展现在我们面前。这一轮满月将比以往要大而亮，因为它是19年来最接近地球的一次。月球的引力增大将会使得地球的板块受到影响，从而诱发大规模的地震、火山、海啸等自然灾害。日本发生的8.8级强烈地震就是这次“超级月亮”作用的结果。</div></div><div><p class=""rumor-truth"">		<strong>真相</strong><span class=""arrow-right""></span>“超级月亮”带来超级地震的说法最初肇始自一个美国占星师。这个说法完全没有科学依据。地月距离变化带来的引力差异，可能会给地球上带来一些诸如潮汐变化之类的影响，但目前没有任何可靠证据显示，它足以引发地震。</p></div><div class=""rumor-content"">		<h2>论证</h2>	<div class=""content"">	“超级月亮”的出现是由月亮运行的轨道决定的。和很多天体的运行轨道一样，月球围绕地球运动的相对轨道是椭圆形的。所以，月球在绕地公转时，与地球的距离并非固定不变的。 <br><br>月球轨道上距离地球最近的那点我们称为“近地点”，反之则是“远地点”。月球每绕地球旋转一圈，都会经过一次近地点一次远地点。据测量，月球位于近地点时，距离地球的平均距离为36.3万千米，而位于远地点时，平均距离为40.6万千米，两者相差达到10.41%。[7]所以，如果仔细观察，不难发现月亮位于近地点的时候比它在远地点时要大出不少。在今年3月19日，月亮与地球的距离只有35.7万千米，比近地点的平均距离还要近1.84%。[8]所以看起来就会更大一些。 <br><img src=""https://3-im.guokr.com/gkimage/za/ra/kd/zarakd.png"" style=""max-width: 480px""><br><br><blockquote><span style=""color: #999999;"">近地点的月亮和远地点的月亮大小对比图 </span></blockquote> <br><h2><strong>更近的月亮对地球有多大的影响？ </strong></h2>地球上的物体会受到月球引力的影响。当月球处在远地点的时候，地球上每1千克的物体会受到3.019×10 -5 牛的引力，月球处在近地点时，这个引力的平均值是3.761×10 -5 牛。而3月19日这一次，“超级月亮”造成的引力是3.903×10 -5 牛。这样的引力对于地球上的物体而言是微乎其微的。对一个成年人来说，这次的“超级月亮”带来的影响只相当于一两根头发的重量。<br><br>相对而言，太阳对地球的影响就大多了，1千克的物体会受到太阳5.737×10 -3 牛-6.141×10 -3 牛的引力，是月球引力的100多倍。所以，仅根据地球与月亮的距离来预言地质灾害，而完全不考虑太阳的参数的做法显然是不科学的。 而且在前文已经提到过了，月球与地球的距离每天都是变化的。3月11日的日本大地震与3月19日的“超级月亮”之间相隔8天，而在5天之前的3月6日，月球正处于它的远地点上。事发当天，地月距离大于平均距离，将这次地质灾害归咎于月球引力实在是有些说不过去。 <br> <br><h2><strong>地月距离会影响地震发生的频率么？ </strong></h2>数据不会说谎，统计了最近30年来每年6.5级以上地震发生的次数以及每年月球近地点的最近距离，并把这些数据画在了下面这张图表里：[8] [9] <br><img src=""https://3-im.guokr.com/gkimage/ma/x8/j2/max8j2.png"" style=""max-width: 480px""><br><br><blockquote><span style=""color: #999999;"">注：2011年地震数据系根据至今地震发生频率推算而得。 </span></blockquote><br>我们不难发现，在2005年、1993年、1992年和1990年，月球与地球的最近距离比今年的“超级月亮”还要更近些，但这些年份中6.5级以上灾害性地震的数量却并不算突出。特别值得一提的是，即使在月球距地球较近，且6.5级以上地震较多的年份中，地震发生的频率与地月距离之间也并不存在固定的联系——虽然2008年5月12日汶川大地震的伤痛依然刻骨铭心，但那一年地月距离最近的日子却是12月12日。 <br> <br>关于此次“超级月亮”引发极端天气乃至大灾难的说法，英国《每日邮报》在其3月8日的报道中已经进行了批驳。报道援引国际射电天文学中心科学家惠勒（Pete Wheeler）的话称：“不会有地震或是火山喷发，除非它本来就会发生。届时，地球只会经历幅度稍微偏大一点的潮汐，没什么值得兴奋的。”相关流言最初传播并不广，经过媒体的批驳，自然也就渐渐湮没无闻了。不过，3月11日“日本大地震”发生之后，“超级月亮”引发超级地震的说法再度抬头。“末日党”似乎借着大地震看到了“2012”的“希望”。<br> <br><h2><strong>流言溯源</strong></h2>“超级月亮”（supermoon）这个术语最初由美国占星师理诺勒（Richard Nolle）发明。诺勒在自己的网站上发表了一系列文章，指出2011年3月19日的满月正处“近日点”上。那天的月亮不仅会比平时的更大、更亮，而且会引发严重的地震、火山或者其它自然灾害。[1] <br><br>这个预言沉寂了一段时间，但随着“超级月亮”的迫近，人们对它的关注越来越高。很多媒体对该预言作出了反应。2011年3月9日，英国《每日电讯报》发表文章表示，这次抵达近日点的月亮，只是看起来大一些而已，并不会引起地震和火山爆发。[2]同日，美国space.com发表了题为“3月19日的‘超级月亮’会引发自然灾害吗？”的文章，驳斥了这则预言。[3]次日，著名天文学网站Universe today发表文章“2011年3月19日，是‘超级月亮’还是‘超级炒作’？”，更尖锐地批驳了这个由占星学家做出的预测。[4]在维基百科英文版的“月球轨道”词条中，甚至也一度加入了对“超级月亮”的批判。[5] <br><br>就当人们发觉辟谣文章比流言文章还要多，逐渐对这则预言渐渐失去兴趣的时候，日本大地震爆发了。2011年3月11日下午，日本东北海域发生了8.9级强烈地震（矩震级，USGS数据），海啸伴随着地震波对日本本州岛东北沿海造成了巨大的破坏。流言又重新活跃了起来，不少人认为这则预言应验了，日本的这次地震、海啸是“超级月亮”降临的结果。 <br><br>于是，当天破解天文流言的排头兵、科学博客Bad Astrology又发表了名为“不，不是‘超级月亮’导致了日本地震”的长篇博文。[6] <br> <br> <br><h4><strong>参考资料：</strong><strong> </strong></h4>[1] <a href=""http://www.astropro.com/features/articles/supermoon/"">supermoon</a><br>[2] <a href=""http://www.telegraph.co.uk/science/space/nightsky/8369718/Moon-to-look-bigger-next-weekend-during-lunar-perigee.html"">Moon to look bigger next weekend during 'lunar perigee'</a><br>[3] <a href=""http://www.space.com/11084-supermoon-earthquake-storm-natural-disasters.html"">Will March 19 'Supermoon' Trigger Natural Disasters?</a><br>[4] <a href=""http://www.universetoday.com/83960/march-19-2011-supermoon-or-superhype/"">March 19, 2011… “SuperMoon” or “SuperHype”?</a><br>[5] <a href=""http://en.wikipedia.org/wiki/Orbit_of_the_moon"">Orbit_of_the_moon</a><br>[6] <a href=""http://blogs.discovermagazine.com/badastronomy/2011/03/11/no-the-supermoon-didnt-cause-the-japanese-earthquake/"">No, the “supermoon” didn’t cause the Japanese earthquake</a><br>[7] <a href=""http://nssdc.gsfc.nasa.gov/planetary/factsheet/moonfact.html"">Moon Fact Sheet</a><br>[8] <a href=""http://www.fourmilab.ch/earthview/pacalc.html"">Lunar Perigee and Apogee Calculator</a><br>[9] <a href=""http://earthquake.usgs.gov/earthquakes/eqarchives/significant/"">Significant Earthquakes of the World</a><br>[10] <a href=""http://www.guokr.com/article/12800/"">【地震特辑】月球“近地点”将引发超级强震？</a>老猫，果壳网谣言粉碎机<br><br> <br> 	</div></div>"
"食品安全","2013-10-24","不法商贩用洗衣粉炸油条","有不法商贩会在炸油条的面粉里放适量洗衣粉，这样炸出来的油条色泽金黄，断面空洞大，甚至顺光时还可见亮晶晶的颗粒。","假","","<div><div class=""rumor-desc""><strong>流言</strong><span class=""arrow-right""></span>有不法商贩会在炸油条的面粉里放适量洗衣粉，这样炸出来的油条色泽金黄，断面空洞大，甚至顺光时还可见亮晶晶的颗粒。</div></div><div><p class=""rumor-truth"">		<strong>真相</strong><span class=""arrow-right""></span>理论和实验都表明，洗衣粉不能代替传统成分炸制油条；但是不能排除有黑心商人用其他非食用物质来代替食品原料，还需执法部门严加监管。</p></div><div class=""rumor-content"">		<h2>论证</h2>	<div class=""content"">	对于这个流言，《杭州都市报》和《华西都市报》分别做了实验，用事实证明：洗衣粉揉面能够让面团发泡，但是下锅炸却不能让油条炸“发”，根本炸不出个大金黄的油条。这到底是为什么呢？<br><br><h2><strong>传统油条是如何制成的</strong></h2>首先我们来了解一下油条的传统制作方法。传统油条制作是往面粉里加入明矾、小苏打（或者苏打）、盐等，调制成矾碱面团，再将面团拉条，最后经油炸而成。明矾即硫酸铝钾，是一种水解呈酸性的复盐（又叫重盐）。而小苏打（碳酸氢钠）或者苏打（碳酸钠）经水解呈碱性。二者溶于水中后会发生化学反应，产生大量二氧化碳气体和絮状物氢氧化铝, 促使面团膨松。<br><br>这个反应在低温下进行的很慢，而高温油炸时会迅速反应，产生大量二氧化碳气体。高温还会使二氧化碳气体受热膨胀，面团中的水分汽化和淀粉糊化膨大，大量盐溶性蛋白质经受热变性也形成了维持油条膨胀结构的刚性支撑。另外，明矾的水解产物氢氧化铝能吸附水中的杂质，形成絮状物矾花，使油条发脆，这也是传统油条更钟情于使用明矾的原因。<br><br>氢氧化铝是两性化合物，原料中小苏打如果过量，会生成铝碱，使油条内部颜色发黄，苦涩味增重，不够酥脆；如果所加入的小苏打量不够，产物矾花量少，也会影响油条质量。所以掌握矾碱用量的平衡，是炸制油条工艺的关键，并需要根据经验调整用量和水温，达到很好的发泡效果。<br><br><h2><strong>洗衣粉炸出的油条真的蓬松吗？</strong></h2>那么洗衣粉能代替传统配方，炸出酥脆松软的油条吗？其实很好验证。《杭州都市快报》和《华西都市报》分别请面点师将洗衣粉揉进面团代替小苏打和明矾发泡，结果显示湿面团发泡膨胀效果很好，速度比常规的矾碱中和要快，表面有明显气泡，摸起来很光滑。但再进一步经高温油炸，面团则表面呈黄褐色，暗淡无光，完全没有气孔，形似一根木棍，完全没有油条的样子，凑近一闻，还有洗衣粉的刺鼻味道，绝对下不了口。<br><img src=""https://1-im.guokr.com/gkimage/xm/ib/hz/xmibhz.png"" style=""max-width: 480px""><br>从左到右分别是正常油条、加入部分洗衣粉发泡的油条、纯洗衣粉发泡的油条。<br><br>为什么洗衣粉能让面团发泡，但是却不能让油条炸“发”呢？这是因为，洗衣粉之所以能让湿面团发泡，是其主要成分阴离子表面活性剂——烷基苯磺酸钠——在起作用。表面活性剂有很强的起泡能力，经常被用作发泡剂。它发泡的原理是当气体进入水中被液膜包围形成气泡。表面活性剂富集于气液界面，以它的疏水基伸向气泡内，它的亲水基指向溶液，形成单分子层膜。这种膜的形成降低了界面的张力而使气泡处于较稳定的热力学状态。所以揉进湿面团的洗衣粉能很好的发泡膨胀。<br><br>但在大量高温食用油的包围下，面团里表面活性剂外向排列的亲水基团失去了稳定存在的水环境，打破了气液界面的平衡，原先被液膜包裹的气泡就迅速消失了。这就是为什么揉进了洗衣粉的湿面团能很好发泡，但油炸后却成了面棍的原因。 因此，用洗衣粉炸油条基本上是不可能的。<br><br><h2><strong>不含铝的油条工艺</strong></h2>传统的油条制作依赖于明矾，但明矾含有铝元素，在人体内代谢非常缓慢，容易沉积。沉积到骨骼中，会使骨质变得疏松；沉积在大脑中，可使脑组织发生器 质性改变，出现记忆力衰退，甚至痴呆。随着人们健康意识的不断提升，对传统油条的质疑声越来越多，于是很多商家就推出了不含铝油条。<br><br>不含铝油条配方不一，有些还属于商业机密，但原理都无非是采用了其他不含铝的发泡剂来取代明矾。例如，不含铝泡打粉是用酒石酸盐或磷酸盐（如磷酸钙和焦磷酸钠）代替明矾做固体酸，固体碱还是用小苏打；臭粉膨松剂主要成分是碳酸氢铵，经常用于油炸产气食品，像沙琪玛的制作等，臭粉在加热条件下会迅速 分解产生大量水、氨气和二氧化碳气体，但缺点是氨气会有一定臭味，如控制好产气释放速度，氨气在成品里残留量会很少；还可以用生物发酵剂酵母代替，酵母是 一种单细胞的兼性厌氧真核微生物，添加到面团后，可以通过自身的新陈代谢产生二氧化碳气体达到蓬松的目的，这个过程通常就叫发酵，它对人体没有副作用，并可以提供人类所必需的而又缺乏的营养物质和维生素。通常还会再加入适量小苏打，让膨胀效果更好。<br><br>不过，虽然理论和实验都表明，洗衣粉不能代替传统成分炸制油条，但我们并不能保证没有人会去尝试这样做。这就如同此前我们讨论过的“麻辣烫商贩在底料中加泻立停，预防顾客拉肚子”流言一样[1]。<br><br>另外，洗衣粉炸油条的传说由来已久，它到底是怎样产生的呢？有人认为可能是因为明矾、小苏打、盐和水混合产生的泡沫和洗衣粉产生的泡沫很像，由此使顾客产生误解；也有人指出，是因为某些不法商贩用工业泡花碱（洗衣粉原料之一）替代小苏打制作油条，于是就传出了洗衣粉做油条的说法。对于后者，使用非食用物质来代替食品原料，永远是黑心商人的“致富通道”，需要执法部门严加监管。<br><br><h2><strong>参考资料</strong></h2>[1]<a href=""http://www.guokr.com/article/46804/"">麻辣烫加泻立停，拉肚子也能预防？</a>窗敲雨，果壳网健康朝九晚五<br>[2]<a href=""http://www.guokr.com/article/75698/""> 洗衣粉真能炸油条吗？ </a>watchsnow，果壳网健康朝九晚五	</div></div>"
"食品安全","2013-10-24","麦当劳的食品只有半小时保质期，超过就不能食用了","麦当劳的员工工作手册和培训中规定，油炸食品比如鸡翅，炸出来后只能保存半个小时，超过以后还没卖出，就要扔掉（以下简称“半小时规定”）。所以麦当劳的食品只有半小时保质期，超过就不能食用了。","假","","<div><div class=""rumor-desc""><strong>流言</strong><span class=""arrow-right""></span>麦当劳的员工工作手册和培训中规定，油炸食品比如鸡翅，炸出来后只能保存半个小时，超过以后还没卖出，就要扔掉（以下简称“半小时规定”）。所以麦当劳的食品只有半小时保质期，超过就不能食用了。</div></div><div><p class=""rumor-truth"">		<strong>真相</strong><span class=""arrow-right""></span>麦当劳的“半小时规定”是基于对油炸食品感官性状的考量，不能等同于只有半小时保质期。油炸食品超过半小时也无须担心其安全性，但也不能长时间保存。</p></div><div class=""rumor-content"">		<h2>论证</h2>	<div class=""content"">	<h2><strong>麦当劳的“半小时保质期”</strong></h2>麦当劳是标准化生产，为了保证产品统一标准和产品质量，规定油炸食品只能存放半小时，在某种程度上就是考虑到了食品的感官性状。这些细节方面的严格规定，只是为了保证食物更好吃，也便于消费者接受，并不是说麦当劳的油炸食品只有半小时的保质期——因为油炸食品放置半小时并无腐败变质的风险，我们也无须对其安全过于担心。<br><br>在现代社会，人们选择吃一种食物，考虑的因素有很多：安全、营养、口感、外观……其中，口感、外观都是很重要的因素，有时直接决定了你是否选择这款食物。因此，评价食物的优劣不仅要考虑食物是否有营养，它们给人的感官享受也是食品品质的重要指标。<br><br>食物给人的感官感觉直接由品尝食物时的主观感觉，也称为感官性状（sensory attributes）决定。这种感官性状通常包括质构（texture）、外观（appearance）和风味（flavour）3个方面，同时也是食品可接受性的3个主要因素。<br><br>我所在的实验室就研究过烹调后的米饭、鱼肉等食材的质构特性，同时也对这些烹调后食材进行了感官评定。刚烹熟的食物和放一段时间后，食物的质构特性会有较大差异，食用时人的感觉也会完全不一样。比如，米饭刚熟，吃的时候会觉得很软很香而且有嚼劲，但是放一段时间后，米饭会变硬、变粘，口感就不如刚烹熟时。其实，大家应该也有过类似的体验，比如你会觉得刚出笼的包子、刚出锅的饺子更好吃更香，但是放一段时间之后，口感就会变差。<br><br>影响食品感官特性的因素有很多，产品种类、加工方法、加工温度、时间、营养素的含量等都与之有关。淀粉类食品烹熟热腾腾的很好吃，凉了之后淀粉老化变硬，给人不愉快的感觉。新鲜鱼的硬度与脂肪含量成反比，弹性与水分成正比，脂肪含量越多的部位，其硬度越小，水分含量越高，弹性越大。在低脂肠制品中，随脂肪量的增加，咀嚼性增加而弹性减小，水分含量越高，熏煮香肠的弹性越大。<br><br><h2><strong>超过半小时没问题，但也不能长时间保温保存</strong></h2>既然麦当劳的“半小时规定”考虑的是顾客的整体接受性，油炸食品存放半小时后并不会有太大安全问题，那是不是就可以敞开了肚子大吃特吃呢？其实不然。<br>油炸食品由于用油量比较多，而且通常温度比较高，会造成脂肪氧化，而脂肪氧化过程中会产生一些对人体有害的物质，如氢过氧化物的分解产物、二聚合物等。这些物质经消化道吸收后会慢慢移至肝脏及其他器官引起慢性中毒，目前有研究发现脂肪氧化产生的聚合物有致畸致癌的危险。<br><br>同时，脂肪氧化还会促进胆固醇氧化，产生一些胆固醇氧化产物。胆固醇氧化产物在人体内可引起细胞毒性、氧化DNA损伤、致癌性和致突变性，还会造成血管内膜损伤，诱发动脉粥样硬化和神经衰弱等慢性病，对人体健康也有很大的潜在威胁。<br><br>另外，研究发现油炸食品保温时间越久，温度越高，脂肪氧化会越严重，所以从健康角度来说，油炸食品保温存放时间过久是对健康不利的。<br><br>因此，对于油炸食品，脂肪氧化是需关注的一项重要指标。目前，我国国家标准《GB 16565-2003 油炸小食品卫生标准》对油炸小食品（指以面粉、米粉、豆类、薯类、蔬菜、水果、果仁为主要原料，按一定工艺配方，经油炸制成的各种定型包装的小食品）的脂肪氧化做出了规定。麦当劳的肉类油炸食品同样存在脂肪氧化的问题，但我国目前还没有明确的标准规定。<br><br>近年来，油炸食品由于其高脂肪高能量而备受人们指责，其实，从脂肪氧化和胆固醇氧化角度来说，油炸食品对健康也是不利的。而且，这种保温存放的油炸食品，其脂肪氧化和胆固醇氧化都更加严重，长期大量食用还是不适合的，不宜多吃。<br><br><h4><strong>参考资料</strong></h4>[1]<a href=""http://www.guokr.com/article/121325/""> 麦当劳只有半小时的保质期？ </a>阮光锋 ，果壳网健康朝九晚五	</div></div>"
