"category","date","title","descrip","LiuyanType","answer","detail"
"医学健康","2015-04-17","美甲可能会感染艾滋病","提到艾滋病的传播，很多人第一反应是性传播，血液传播，但您能想到吗，做一次美甲居然也有风险。据英国《每日邮报》报道，一名22岁女孩被诊断HIV病毒阳性，而她的感染途径仅仅是因曾与携带HIV病毒的姐妹共用一套美甲工具。","论","","<div><div class=""rumor-desc""><strong>流言</strong><span class=""arrow-right""></span>提到艾滋病的传播，很多人第一反应是性传播，血液传播，但您能想到吗，做一次美甲居然也有风险。据英国《每日邮报》报道，一名22岁女孩被诊断HIV病毒阳性，而她的感染途径仅仅是因曾与携带HIV病毒的姐妹共用一套美甲工具。</div></div><div><p class=""rumor-truth"">		<strong>真相</strong><span class=""arrow-right""></span>类似这样的传播是非常非常罕见的，与其他主要的传播途径相比，这样的暴露造成感染的风险也要低得多。不过确实需要留意，这样的可能性还是存在的。</p></div><div class=""rumor-content"">		<h2>论证</h2>	<div class=""content"">	这个病例中报告的是一个22岁的巴西女性，她在献血时检查出了HIV感染。她否认了各种形式的性行为史，在过去也没有经历过输血、手术、穿环或者文身。她有一个男朋友，不过也没有进行性行为，而且男朋友检测是阴性。她母亲也是阴性。也没有经历过性暴力。<br><br>由于这位患者看起来并没有什么显而易见的感染HIV的途径，所以医生们就更详细地追溯了她的既往史，寻找可能的暴露途径。在讨论过程中，他们发现了一个有可能的暴露途径：患者在12岁时使用了一位亲戚（一个现年36岁的女性）的指甲修剪工具（包括角质修剪用的剪刀），这位亲戚后来检查出了HIV感染。这个亲戚有进行过一些抗HIV的治疗，但是在这个事件发生的时候正好处于没有吃药控制的阶段。其他可能的暴露途径当事人都予以了否定。<br><br>当然了，考虑到很多患者会隐瞒性接触历史，只靠这些信息是不能确定什么的。于是医生们对这名患者和她的亲戚体内的HIV病毒进行了进化分析（phylogenetic analysis，指所有用基因变异推断带时间性的进化结果（感染时长是进化结果一种）），结果发现二者存在高度相关的序列，这两支病毒估计大约在11年前可以追溯到共同的祖先。基于这个结果，论文报告的作者认为，虽然不能完全确定，但因为这次指甲修剪工具的使用而传染还是有可能的。<br><br>新闻报道中也提到，类似这样的传播应该还是非常非常罕见的，与其他主要的传播途径相比，这样的暴露造成感染的风险也要低得多。不过确实需要留意，这样的可能性还是存在的。从卫生的角度来讲，这样的工具最好还是不要共用，或者就消毒。就算不考虑HIV，受污染的美甲工具造成其他感染的情况也不是没有。<br><br><h4></h4><h4><strong>内容来源</strong></h4><a href=""http://www.guokr.com/question/583806/"">美甲可能会感染HIV吗？</a>窗敲雨，果壳网问答<br>	</div></div>"
"医学健康","2015-05-05"," 长期画油画可能会导致慢性中毒","有报道称一学油画的小哥得了职业性肾损（有机溶剂性肾损害），因为画油画时所用的松节油、亚麻籽油等有挥发性和毒性。","真","","<div><div class=""rumor-desc""><strong>流言</strong><span class=""arrow-right""></span>有报道称一学油画的小哥得了职业性肾损（有机溶剂性肾损害），因为画油画时所用的松节油、亚麻籽油等有挥发性和毒性。</div></div><div><p class=""rumor-truth"">		<strong>真相</strong><span class=""arrow-right""></span>虽然油画的溶剂材料有低毒性，可能会引发慢性中毒，不过只要注意防护和定期检查健康就不会出现太大的问题。</p></div><div class=""rumor-content"">		<h2>论证</h2>	<div class=""content"">	松节油，属于低毒性溶剂。松节油在车间工作场所中允许的最高浓度是：每立方米空气中含有300毫克，低于这个数值下长期进行生产劳动，不会引起急性或慢性职业性危害。而这类低毒溶剂中毒，以慢性中毒最多，且多属于积累性毒性。所以室内注意通风，控制松节油挥发浓度，每隔一段时间中断接触有害物质，定期体检，出现身体不舒服及早治疗。<br><br>长期画油画是否会导致慢性中毒？有可能，就看会不会防护了：<br><br>1、尽可能采用低毒性的溶剂代替有毒和高毒的溶剂。<br>2、增设必要的通风装置，降低毒物在操作场所空气中的浓度。<br>3、严格遵守操作规程，使用口罩、防毒面具、橡皮手套、防护服等个人防护装备。<br>4、严禁吸烟，一是为了防火，二是防止吸入有毒气体。<br>5、人员预检和定期体检。预检是对新参加的人员进行体检，以便及早发现不适宜从事这项工作的某些健康问题，例如有哮喘、血液病、肝和肾的实质性疾病及精神病等。定期体检可以早期发现毒物对人体危害致病情况，早期治疗并采取必要的预防措施。<br><br><h4><strong>内容来源</strong></h4>长期画油画是否会导致慢性中毒？红色荒漠，果壳网问答<br>	</div></div>"
"医学健康","2015-04-20","家用电子设备对人体辐射危害大","家用的电器电子设备辐射大，因此手机不要放在床头、电脑一定要用防辐射的机箱，接电话的时候不要离耳朵太近。","假","","<div><div class=""rumor-desc""><strong>流言</strong><span class=""arrow-right""></span>家用的电器电子设备辐射大，因此手机不要放在床头、电脑一定要用防辐射的机箱，接电话的时候不要离耳朵太近。</div></div><div><p class=""rumor-truth"">		<strong>真相</strong><span class=""arrow-right""></span>现有研究表明，家用电器周围的电磁场强度远远小于安全准则的限值。手机的射频电磁场强度比日常居住环境中的其他电器都要高，但即使如此也并未显示出有害健康的效应。</p></div><div class=""rumor-content"">		<h2>论证</h2>	<div class=""content"">	<h2><strong>什么是电磁辐射</strong></h2>电磁波（又称电磁辐射）是由同相振荡且互相垂直的电场与磁场在空间中以波的形式传递能量和动量，其传播方向垂直于电场与磁场构成的平面。电磁辐射的载体为光子，不需要依靠介质传播，在真空中的传播速度为光速。 <br> <br>电磁波谱既包含了自然产生的，也包含了人造的电磁场来源。电磁场的特性由频率和波长反映。在电磁波中，这两个特性直接互相联系在一起，频率越高，波长就越短。 <br> <br>像X射线、伽马射线一类的电离性辐射包含了能量足以破坏分子间化学键的光子。工频（注：各种电力设备、电源、电器的频率，主要是极低频）和射频的电磁波的光子的能量则低得多，没有电离性作用。 <br> <br>在射频和微波的频率，电场和磁场作为电磁波的两个元素来一起考虑。以瓦/平方米(W/m2)为单位的功率密度被用来衡量此类电磁场的强度.低频率和高频率的电磁波以不同的方式影响人体。我们生活中低频率电磁场的主要来源是电源和电器，射频电磁场的日常来源主要是电信设备、广播天线和微波炉。 <br><br> <br><h2><strong>电磁场的生物效应</strong></h2>包括电磁场在内，环境中很多的因素都可以造成生物效应，生物效应不等同于健康威胁，需要专门的研究来鉴别和衡量健康的威胁。 <br> <br>在低频率下，外部的电场和磁场会在身体内感应出微弱的环流电流。在几乎所有的正常环境条件下，身体内的感应电流的强度小到不会产生任何明显的效应。 而射频电磁场的主要效应是加热人体组织——毫无疑问，高强度电磁场下即使短期暴露，也会对健康有害。但目前大众担忧的可以导致剧烈的生理反应的电磁场强度下的暴露，主要集中在低于对身体产生长期影响的标准。。 尽管有广泛的研究，到目前为止没有证据可以确认低强度电磁场下的暴露对健康造成影响。 <br> <br>根据现有的科学知识，国际非电离性辐射防护委员会（ICNIRP）制定了安全准则。而大多数国家则会根据国际安全准则制定自己国家的标准。低频电磁场的标准在于保证感应的电流，在人体内背景电流的正常强度以下。射频和微波的标准在于防止局部或者全身热效应导致的健康风险。日常生活中的最大暴露强度通常远远小于安全准则的限值。此外，由于电磁场的安全系数通常较大，即使高于安全准则限值的暴露也并不一定对健康有害。不仅如此，高频率的电磁场强度，按照平均使用时间和低频率电磁场之间最大耦合的假设，都增加了额外的安全范围。 <br><br> <br><h2><strong>家用电器的电磁场强度</strong></h2>家庭中背景电磁场强度主要来源于电力传输和分配设备，以及家用电器。不同电器产生的电磁场强度会明显不同。电场和磁场的强度都会随着与电器距离的增大而迅速减小。在各种情况下，家用电器周围的电磁场强度远远小于安全准则的限值。在电视机和电脑屏幕正常的使用距离，电场和磁场强度只有安全标准值的万分之一到千分之一。符合标准的微波炉也不会对健康造成威胁。 <br> <br>很多调查显示出日常居住环境的电磁场下的暴露强度是非常小的。只要公众不近距离接近雷达设施、广播天线和手机基站，就不会受到超过安全准则限制的射频电磁场。手机的射频电磁场强度比日常居住环境中的其他电器都高出很多，但即使这样的强度也没有显示出有害健康的效应。 <br> <br>针对公众对于低强度电磁场可能风险的担忧，世界卫生组织启动了“国际电磁场项目”来提供科学客观的回答。 <br> <br>普通公众虽然对电磁学和生物学并不了解，但还是普遍认为手机辐射有害，其中一个重要的依据是核辐射和X射线会伤害人体健康，大剂量和长时间照射有引发癌症的危险。但是，这种辐射与手机辐射有着本质的不同，前者是电离性辐射，辐射能量能被人体组织大量吸收而导致化学键断裂。而手机辐射属于非电离辐射，其频率远远低于电离辐射，产生的热效应微乎其微，根本没有产生使化学键断裂的危险。事实上，即使长年接收更大功率的非电离低频率电波辐射，也不会对健康造成损害，国内外的军队都有不少大功率电台和雷达，其频率覆盖了手机频段，辐射功率比手机大了成千上万倍，大型天线就架设在楼顶上。工作人员长年在这种高强度辐射环境下工作，也未见健康受损的可靠科学报道。 <br><br> <br><h2><strong>相关科学研究</strong></h2>近年来，各国研究人员针对手机辐射对人体健康是否有危害进行研究，选列如下： <br><ul><li>2006年1月，英国伦敦癌症研究学会联合3所英国大学对966名脑瘤患者和1716名健康人进行了长达4年的跟踪研究后，发表研究报告，结论是使用手机与脑瘤的发病率无关。</li><li>2006年4月，瑞典的国家职业病研究学会通过对905名成年手机用户的研究，在职业与环境健康的国际文献上发表研究结果，称使用手机并不会增加脑瘤的发病率。</li><li>2006年12月，丹麦科学家对42万名手机用户进行了长达21年的跟踪研究后，公布了他们的研究结果，称手机辐射与癌症发病率无关。</li><li>2008年12月，日本东京女子医科大学对比了322名使用手机的脑癌患者和683名健康人，发现使用手机与脑癌发病率无关。</li></ul> <br><br><h4><strong>参考资料：</strong><strong> </strong></h4>1 <a href=""http://http//zh.wikipedia.org/wiki/%E7%94%B5%E7%A3%81%E6%B3%A2"">维基百科：电磁波</a><br>2 <a href=""http://www.guokr.com/article/437253/"">WHO告诉你，什么是电磁辐射</a><br>3 <a href=""http://www.guokr.com/article/437267/"">WHO告诉你，电磁辐射对健康有什么影响？</a><br>4 <a href=""http://www.guokr.com/article/437344/"">电磁辐射的标准是如何建立的，WHO告诉你</a><br>5 <a href=""http://www.guokr.com/article/437275/"">家用电器的电磁辐射有多强，WHO告诉你</a><br>6 <a href=""http://www.guokr.com/article/8223/"">别慌！手机辐射对大脑的影响没那么恐怖</a>	</div></div>"
"医学健康","2015-04-20","用电脑时间长会得“胸廓出口症候群”","计算机族的杀手---胸廓出口症。常坐在计算机桌前的你，是否一坐就是好几个小时而且坐姿不正确，总感到莫名肩颈疼痛，甚至于无心工作？现在请你作个小测验，请你将你的头向左侧方向望去，然后将你的头４５度朝下慢慢弯下去，动作做到这里，你的脖子颈肩是否感到不正常的酸痛？对假使你有上述症状，你可要小心了，因为你很可能得到现代计算机文明病「胸廓出口症候群」的受害者。","假","","<div><div class=""rumor-desc""><strong>流言</strong><span class=""arrow-right""></span>计算机族的杀手---胸廓出口症。常坐在计算机桌前的你，是否一坐就是好几个小时而且坐姿不正确，总感到莫名肩颈疼痛，甚至于无心工作？现在请你作个小测验，请你将你的头向左侧方向望去，然后将你的头４５度朝下慢慢弯下去，动作做到这里，你的脖子颈肩是否感到不正常的酸痛？对假使你有上述症状，你可要小心了，因为你很可能得到现代计算机文明病「胸廓出口症候群」的受害者。</div></div><div><p class=""rumor-truth"">		<strong>真相</strong><span class=""arrow-right""></span>流言中提到的疾病与使用电脑没有必然联系。除了先天解剖结构异常，不良的姿势也与该病有关，比如长年累月的弯腰驼背姿势可能会加剧症状，所以重要的是维持良好的姿势，而不是把责任推卸给电脑。</p></div><div class=""rumor-content"">		<h2>论证</h2>	<div class=""content"">	胸廓出口综合征是一类较为罕见的疾病，发病的主要原因是先天解剖结构异常 （如额外的颈肋等），另外颈部较长、肩膀塌陷的人更容易罹患此病。虽然说不良的姿势也与该病有关，比如长年累月的弯腰驼背姿势可能会加剧症状，但是这和是不是在使用计算机并没有必然的联系。即使不用电脑，如果生活习惯不良的话，还是会引起疼痛。所以重要的是维持良好的姿势，而不是把责任推卸给电脑。<br><br>此外，不管是不是胸廓出口综合征，在使用计算机使都要注意保持良好的姿势，不要弯腰驼背、不要在电脑前坐太久；一旦出现肩颈部、手肘、手部的麻木、疼痛、无力等不适，请咨询专业的临床医师，不要擅自给自己下诊断，或尝试一些未经验证的偏方、理疗或其他疗法。像流言中提到的小测验对诊断该病价值不大<br><br><br><h4><strong>参考资料</strong></h4>[1]<a href=""http://www.guokr.com/article/103727/"">那个和“每天对着电脑4-6小时的人必看”相关的流言 </a>谣言粉碎机，果壳网谣言粉碎机<br><br>	</div></div>"
"医学健康","2015-04-16","唾液艾滋病检测试纸可以在家快速检测艾滋病","办公室有人买了试纸，用棉拭子在口腔取样，然后放入装有试剂的试管中，并插入试纸检测，20分钟后可以快速检验出是否感染艾滋病，准确度可达到99.8% 。美国卫生部2004年批准了唾液快速检测法。","真","","<div><div class=""rumor-desc""><strong>流言</strong><span class=""arrow-right""></span>办公室有人买了试纸，用棉拭子在口腔取样，然后放入装有试剂的试管中，并插入试纸检测，20分钟后可以快速检验出是否感染艾滋病，准确度可达到99.8% 。美国卫生部2004年批准了唾液快速检测法。<br></div></div><div><p class=""rumor-truth"">		<strong>真相</strong><span class=""arrow-right""></span>这种唾液快速检测方法的盛行一方面由于操作简单，自己在家就可以操作，另一方面是不用采血，减少病人痛苦的同时可以减少血液传播的可能性，但对检测样本采集质量要求较高，且敏度比较高，容易出现“假阳性”的结果，还需要进一步的检测。</p></div><div class=""rumor-content"">		<h2>论证</h2>	<div class=""content"">	艾滋病毒检测有很多方法，而这是最为快速的一种，一般30分钟病人就可以拿到检测结果了。这种唾液快速检测方法的盛行一方面由于操作简单，自己在家就可以操作，另一方面是不用采血，减少病人痛苦的同时可以减少血液传播的可能性。<br><br>这种快速的检测方法，医学上叫做胶体金快速检测法，就是采用金标记，免疫层析技术，双抗原夹心检测标本中的HIV抗体。有检测血液的，也有检测唾液的。其根本还是利用抗原抗体反应，也就是说如果如果病人的血液中或者唾液（确切的说是口腔黏膜渗出物）中有HIV抗体，就会验试纸中的抗原发生反应，而这种反应可以通过析出的形式表现为“红线”。<br><br>有些人会有这样的疑问，艾滋病病毒本身不会通过唾液传播，但为何能用唾液检测出艾滋病病毒？这是因为唾液中艾滋病病毒量极少，达不到传播艾滋病病毒的剂量。而艾滋病病毒抗体唾液快速检测试剂检测的是口腔黏膜渗出液艾滋病病毒抗体，不是艾滋病病毒本身。<br><br>关于这种唾液检测方法的准确率，云南省疾控中心曾经对2家唾液试剂做过评估，对200名HIV抗体阳性及阴性人员同时采用唾液快速检测试剂与常规检测方法进行比较，准确率在95%以上。但是这种检测的结果是否可靠对检测样本采集尤为重要，要严格按照说明书，将采样拭子伸到牙龈沟处后贴着龈沟线来回擦拭，简单地擦拭牙齿或沾点唾液会造成采样不完全而影响测试结果。<br><br>目前有研究显示这种快速检测的办法灵敏度比较高，这会使得检测假阳性率稍高。再换句话说就是检测出来的结果，不能说明一定是感染HIV。因此还有两种比较常用的检测方法，一种是酶联免疫吸附实验（ELISA），一般CDC和医院都用的是这种方法给病人进行HIV病毒的初筛，但是即便ELISA检测阳性，我们仍然不能确诊艾滋病病毒感染。而HIV确认检测，是蛋白印迹法（Western blot），这是目前检测HIV的金标准，准确率最高，但缺点是耗时。<br><br><br><h4><strong>内容来源</strong></h4><a href=""http://www.guokr.com/question/585931/"">唾液艾滋病检测试纸原理是什么？靠谱吗？</a>粉条er，果壳网问答<br>	</div></div>"
"医学健康","2015-04-15","头直接对着计算机睡觉，会得老人痴呆症或脑瘤","中午睡觉时要记得关计算机，因为只把屏幕关掉是无法杜绝辐射线的，而且我们都是趴着睡，头直接对着计算机，哪天得了老人痴呆症或脑瘤就来不及了！辐射线真的很可怕的！！小心啊~健康重于一切！","假","","<div><div class=""rumor-desc""><strong>流言</strong><span class=""arrow-right""></span>中午睡觉时要记得关计算机，因为只把屏幕关掉是无法杜绝辐射线的，而且我们都是趴着睡，头直接对着计算机，哪天得了老人痴呆症或脑瘤就来不及了！辐射线真的很可怕的！！小心啊~健康重于一切！</div></div><div><p class=""rumor-truth"">		<strong>真相</strong><span class=""arrow-right""></span>这种说法不符合科学原理。目前没有任何确切的证据证明计算机各部件产生的相应频率和大小的电磁辐射与老人痴呆症和脑瘤的发病有关系。</p></div><div class=""rumor-content"">		<h2>论证</h2>	<div class=""content"">	只把屏幕关掉，而不关闭计算机，辐射仍然存在是正确的，因为电脑机箱里的各部件也会产生辐射。但是目前没有任何确切的证据证明计算机各部件产生的相应频率和大小的电磁辐射与老人痴呆症和脑瘤的发病有关系。<br><br><h4><strong>参考资料</strong></h4>[1]<a href=""http://www.guokr.com/article/103727/"">那个和“每天对着电脑4-6小时的人必看”相关的流言 </a>谣言粉碎机，果壳网谣言粉碎机<br>	</div></div>"
"医学健康","2015-04-15","喝绿茶吃橘子可抵御电脑辐射","对于生活紧张而忙碌的人群来说，抵御电脑辐射最简单的办法就是在每天上午喝2至3杯的绿茶，吃一个橘子。茶叶中含有丰富的维生素Ａ原，它被人体吸收后，能迅速转化为维生素Ａ。维生素Ａ不但能合成视紫红质，还能使眼睛在暗光下看东西更清楚，因此，绿茶不但能消除电脑辐射的危害，还能保护和提高视力。如果不习惯喝绿茶，菊花茶同样也能起着抵抗电脑辐射和调节身体功能的作用,螺旋藻、沙棘油也具有抗辐射的作用。","假","","<div><div class=""rumor-desc""><strong>流言</strong><span class=""arrow-right""></span>对于生活紧张而忙碌的人群来说，抵御电脑辐射最简单的办法就是在每天上午喝2至3杯的绿茶，吃一个橘子。茶叶中含有丰富的维生素Ａ原，它被人体吸收后，能迅速转化为维生素Ａ。维生素Ａ不但能合成视紫红质，还能使眼睛在暗光下看东西更清楚，因此，绿茶不但能消除电脑辐射的危害，还能保护和提高视力。如果不习惯喝绿茶，菊花茶同样也能起着抵抗电脑辐射和调节身体功能的作用,螺旋藻、沙棘油也具有抗辐射的作用。</div></div><div><p class=""rumor-truth"">		<strong>真相</strong><span class=""arrow-right""></span>电脑辐射并不会对健康产生不利影响。健康饮食的关键在于均衡饮食，短期内摄入大量单一的食物对健康都没有特别的益处。 提到的菊花茶、螺旋藻和沙棘油的抗辐射作用也是同样的无稽之谈。</p></div><div class=""rumor-content"">		<h2>论证</h2>	<div class=""content"">	首先，没有证据表明电脑所释放的辐射对健康会造成不利影响，因此没有必要特别的防护。<br><br>绿茶中确实富含β-胡萝卜素（维生素A的前体），但是胡萝卜素为脂溶性物质，茶汤中溶解量较少，因此绿茶不是最好的补充维生素A的来源，况且一般来说正常人的每日饮食都能补充足够的维生素A或β胡萝卜素。缺乏维生素A会引起夜盲症，但是额外补充β-胡萝卜素并不会使人获得特别的益处，而摄入维生素A过多反而会引起中毒。总之，健康饮食的关键在于均衡饮食，短期内摄入大量单一的食物对健康都没有特别的益处。 提到的菊花茶、螺旋藻和沙棘油的抗辐射作用也是同样的无稽之谈。<br><br>【不同版本】<br><br>1，注意酌情多吃一些胡萝卜、豆芽、西红柿、瘦肉、动物肝等富含维生素A、C和蛋白质的食物，经常喝些绿茶等等。<br>2，经常在电脑前工作的人常会觉得眼睛干涩疼痛，所以，在电脑桌上放几支香蕉很有必要，香蕉中的钾可帮助人体排出多余的盐分，让身体达到钾钠平衡，缓解眼睛的不适症状。此外，香蕉中含有大量的β胡萝卜素，当人体缺乏这种物质时，眼睛就会变得疼痛、干涩、眼珠无光、失水少神，多吃香蕉不仅可减轻这些症状，还可在一定程度上缓解眼睛疲劳，避免眼睛过早衰老.<br><br><h4><strong>参考资料</strong></h4>[1]<a href=""http://www.guokr.com/article/103727/"">那个和“每天对着电脑4-6小时的人必看”相关的流言 </a>谣言粉碎机，果壳网谣言粉碎机<br><br><br>	</div></div>"
