"category","date","title","descrip","LiuyanType","answer","detail"
"医学健康","2013-08-14","坐月子不能喝水，可以用米酒代替","正在坐月子或未来即将坐月子的女性朋友们注意了，据女性博客微博信息，产后半个月内严禁喝水、饮料和汤，牛奶也不能喝。因为会喝成大水桶，会变胖，将来容易得风湿病或神经痛。可以用烧开的米酒代替水分（买商店里的瓶装米酒）。","假","","<div><div class=""rumor-desc""><strong>流言</strong><span class=""arrow-right""></span>正在坐月子或未来即将坐月子的女性朋友们注意了，据女性博客微博信息，产后半个月内严禁喝水、饮料和汤，牛奶也不能喝。因为会喝成大水桶，会变胖，将来容易得风湿病或神经痛。可以用烧开的米酒代替水分（买商店里的瓶装米酒）。</div></div><div><p class=""rumor-truth"">		<strong>真相</strong><span class=""arrow-right""></span>目前没有任何科学证据证明产褥期喝水会导致女性健康问题。哺乳期的母婴也不应摄入酒精。</p></div><div class=""rumor-content"">		<h2>论证</h2>	<div class=""content"">	<h2><strong>“孕期不能喝水”的错误之处</strong></h2>孕期由于营养胎儿的需要，女性体内血容量大大超出未孕时（最高时可达未孕时的140%），简单的说，就是体内“血太多”了。分娩后，机体需要通过排尿等方式恢复到正常的血容量，因此产妇生产后往往尿量很多。但这并不意味着产妇不需要喝水。血容量从大到小的恢复过程，并非海绵挤水那般一蹴而就。体液负荷的逐步减少，是在机体不断代谢的过程中同时进行的，而肾脏排出尿液和代谢废物更是受到一系列体液因子的精密调节，在此过程中体液内环境（如PH值，离子浓度）要维持稳定，血容量完全恢复正常的时间将达数周之久。在此期间受到饮食、哺乳、出汗等影响，人体仍时常需要摄入水分以参与代谢，至于何时喝水，喝多少水，则取决于渴感，并无一定之规。同样，饮料、汤和牛奶只要不含对母婴不利的成分，均无需禁忌。 <br> <br> <br><h2><strong>“产褥期喝水会导致女性罹患风湿病和神经痛”的错误之处</strong></h2>目前没有任何科学证据证明产褥期喝水会导致女性罹患风湿病和神经痛。风湿病常与自身免疫有千丝万缕的联系，但此类疾病虽然病名中有个“湿”字，却与饮水毫无瓜葛。神经痛也与喝水无关。 <br> <br> <br><h2><strong>产后不应摄入酒精</strong></h2>米酒是由稻米经发酵后的产物，其主要成分为水、酒精、糖类及氨基酸等。米酒的主要成分为水，也含有酒精。酒精学名乙醇，是一种中枢神经毒性物质。服用乙醇30-60分钟后即能在血液中检出。酒精可通过被动弥散的方式进入乳汁，含酒精的乳汁会对婴儿神经系统的发育造成影响。哺乳期母婴摄入酒精是十分不利的。同理，用米酒洗澡也不可靠，因为酒精也可经皮肤吸收入血。 <br> <br>流言的某些版本称：饮用米酒要先用大火煮沸15分钟。在100度的炙烤下，大部分酒精先于水分蒸发，剩下的是以糖水为主的液体混合物。这一做法与喝水并无本质不同水，且营养成分不一定比得上其他食品。 <br> <br> <br><h4><strong>参考资料：</strong><strong> </strong></h4>[1] 妇产科学，内科学。申素芳。人民卫生出版社 <br>[2] Alcohol, pregnancy and breastfeeding; a comparison of the 1995 and 2001 National Health Survey data. Giglia RC, Binns CW. Breastfeed Rev. 2008;16(1):17-24 <br>[3] <a href=""http://www.guokr.com/article/22385/"">坐月子不能喝水，用米酒代替？</a>赵承渊，果壳网谣言粉碎机	</div></div>"
"医学健康","2013-08-14","毛发越剃就会越浓、越硬、越黑","剪头发、剃毛会使毛发变得更多更粗更黑。","假","","<div><div class=""rumor-desc""><strong>流言</strong><span class=""arrow-right""></span>剪头发、剃毛会使毛发变得更多更粗更黑。</div></div><div><p class=""rumor-truth"">		<strong>真相</strong><span class=""arrow-right""></span>毛发多少、粗细和颜色主要是由基因和荷尔蒙决定的，与剪发、剃毛没有关系。</p></div><div class=""rumor-content"">		<h2>论证</h2>	<div class=""content"">	<h2><strong>【毛发数量】 </strong></h2>毛发的数量是由毛囊数量决定的，剪头发并不能改变毛囊数量。毛囊藏在皮肤的深处。表面的剪切不会影响到毛囊，所以也就不会对毛发的状态产生什么影响。 <br> <br><h2><strong>【毛发硬度】 </strong></h2>长的头发会显得更软一些，剪短以后显得更硬些，这是因为人的错觉。至于粗细问题，发梢的部位因为一段时间的摩擦，会比刚长出来的部分细一些。 <br> <br><h2><strong>【毛发颜色】 </strong></h2>暴露在空气中，阳光的照射会使头发的颜色变浅，使得新长出来的头发看起来要更黑。这和剪头发本身没有关系。 <br> <br> <br>参考资料：<br>[1] <a href=""http://www.guokr.com/article/598/"">毛发会越剃越浓，越硬，越黑吗？</a>秋秋，果壳网谣言粉碎机	</div></div>"
"医学健康","2013-08-14","经期吵架会瞬间引发子宫肌瘤、卵巢囊肿","你想害死你女友，那就跟她吵吧，让她盛怒！经期排血是排毒，也会流失大量营养，免疫下降调节力变弱，故女性很容易生气，她变得敏感是生理的敏感导致精神敏感，控制情绪能力下降。如果经期期间和你吵架，会瞬间引发子宫肌瘤，卵巢囊肿。倘若你不爱你女友，那就让她盛怒好了。","假","","<div><div class=""rumor-desc""><strong>流言</strong><span class=""arrow-right""></span>你想害死你女友，那就跟她吵吧，让她盛怒！经期排血是排毒，也会流失大量营养，免疫下降调节力变弱，故女性很容易生气，她变得敏感是生理的敏感导致精神敏感，控制情绪能力下降。如果经期期间和你吵架，会瞬间引发子宫肌瘤，卵巢囊肿。倘若你不爱你女友，那就让她盛怒好了。</div></div><div><p class=""rumor-truth"">		<strong>真相</strong><span class=""arrow-right""></span>目前的学术界并不认为心理因素与罹患肿瘤的几率之间有必然的关系。因为“经前期综合症”和其它因素，女性在经期确实比较易怒。虽然不会因此患上什么疾病，不过吵架也不是好的解决办法。</p></div><div class=""rumor-content"">		<h2>论证</h2>	<div class=""content"">	<h2><strong>不好的情绪会使人得肿瘤吗？</strong></h2>确实有学者认为情绪和疾病的发生有一定的关系。当代第一位探究持续的严重压力对于躯体的影响的科学家是加拿大的Hans Selye。根据他提出的应激理论，许多种应激源都会引发相同的反应或一般性的躯体反应。应激源带来的反应被他称为一般适应症候群（the general adaptation syndrome, GAS）。包括三个阶段：报警阶段、抵抗阶段和疲惫阶段。如果应激源持续的时间足够长或者强度足够大，就会对机体造成不利的影响。[2] <br> <br>一般适应症候群的应用被证明有助于解释某些不能完全用生理原因解释的疾病，而现代心理学为应激的研究加入了更多心理应激的内容。包括人们在面对重大的生活事件，比如亲人死亡，父母离异，工作负担等，到一般性的日常挫折时的反应。[3] 自然，就有人将目光投向了心理应激和肿瘤的关系，在1982年就有认为人格类型等心理因素能导致肿瘤发生的描述，当时，英国诺丁汉大学从事应激研究的Cox总结道，两大类心理因素与肿瘤的发生有关：一是童年与家庭成员缺乏联系，一是情感的不适当表达。[4] <br> <br>另外一种更为大众所知的理论是人格影响健康的理论。在这个理论中，A型人格（极端好胜，富有攻击性，缺乏耐心，有时间紧迫感和怀有敌意）被认为易患心脏病。[5] C型人格（隐忍，不果断，耐心，不外露消极情绪）被认为易患癌症。[6] 这个理论可以看做是心理因素影响健康理论的一个总结，也是一个通俗易懂的说法。 <br> <br>可是，上面这些理论多少有些“想当然”，现在有更新更完善的研究显示相反的结果。最近的研究倾向于心理因素对肿瘤的发生没有明显的影响。其中样本量比较大的一个实验，是日本东北大学的一个包括30277位居民，进行7年随访的研究，他们的研究结果显示，人格的不同对肿瘤的发生并没有明确的联系。[7]而对既往的32项有关心理因素和肿瘤关系研究的回顾分析则认为，目前的研究都还没有任何有力的证据显示诸如人格，生活中的重大事件等对肿瘤的发生有影响。[8] 两项对心理因素与乳腺癌的研究回顾也认为他们之间的联系很弱。[9][10] <br> <br>可以看出，虽然不健康的心理因素会对免疫，内分泌等因素造成不利的影响，但是情绪引起的这些因素的变化和肿瘤的发生是否有直接的关系还不确定的。并且，目前的有关研究大都不支持心理因素对肿瘤的发生有直接的关系。不过，确实也有少量研究认为情绪等因素和肿瘤的发生是有关系的。有学者指出，这其中大多数的临床流行病学的研究存在诸多缺陷，包括样本量不足，随访年限不足，对心理因素的评价标准不当等。[11] <br> <br>顺便说一句，流言里提到的“子宫肌瘤”是一种常见的子宫良性肿瘤，“卵巢囊肿”也基本都是良性的病变。尽管这些名词看上去又专业又吓人，但实际上并非什么非常可怕的疾病。 <br> <br><h2><strong>关于经期的各种误解。</strong></h2>一次正常经期的出血量为20-60ml，这是什么概念？一个成年人的全身总血量约为4.2-4.8L，一次献血的量为200-400ml，一次体检抽血的量约5-10ml。而失血到出现明显的反应，即失血性休克早期的失血量是800-1000ml。由此看来，一次经期的出血量实在是不多，不至于“流失大量的营养”。而免疫力下降的问题，从理论上来说，血液流失，白细胞免疫细胞等也会丢失一部分，免疫能力会有所下降，但是实际上，女性经期最容易出现的感染是生殖系统的感染，其主要原因是因为经期女性生殖系统的变化，而不是流失的血液。 <br> <br>女性在经期很容易生气的说法倒是有的，在医学上有一个专门的名词描述这种现象，叫“经前期综合症”，可表现为月经来临前女性精神症状或行为的改变，在月经来后会自然消失。而在经期，也可能有诸多的因素使女性的精神处于易怒的状态，比如痛经等。 <br> <br>至于流言中所说的“瞬间出现肿瘤”是纯粹无稽之谈。这个问题可以用数据粗略说明一下。一次细胞分裂M期（即真正进行分裂的时期）为30-60min，而两次分裂之间的时间间隔跨度很大，可以从几小时到数周以上。人的细胞分裂的完整周期约24h，M期30min。[12] 就算是在一瞬间突然一个普通细胞突变为肿瘤细胞，并且这个肿瘤细胞立即开始复制，也得要几十分钟后才能增殖成一小团细胞。 <br> <br> <br><h4><strong>参考资料 ： </strong></h4>[1] <a href=""http://t.sina.com.cn/1660209951/ezRohIuFNTi"">新浪微博</a> <br>[2] Selye, Hans. A syndrome produced by diverse nocuous agents. Nature. 1936, 138: 32.。 <br>[3] 心理学与生活（第十六版）, Richard J. Gerrig, 人民邮电出版社,2003. 364 <br>[4] Cox T, Mackay C. Psychosocial factors and psychophysiological mechanisms in the aetiology and development of cancers. Soc Sci Med. 1982;16(4):381-96. <br>[5] Friedman &amp; Rosenman. Type A behavior and your heart. New York: Knopf,1974. <br>[6] Eysenck HJ, Cancer, personality and stress: Prediction and prevention. Advances in Behaviour Research and Therapy. 1994,16 ;167-215. <br>[7] Nakaya N, Tsubono Y, Hosokawa T, et al. Personality and the risk of cancer. J Natl Cancer Inst. 2003;95:799–5. <br>[8] Schraub S, Sancho-Garnier H, Velten M. Should psychological events be considered cancer risk factors? Rev Epidemiol Sante Publique. 2009,57(2):113-23. <br>[9] Butow PN, Hiller JE, Price MA, et al. Epidemiological evidence for a relationship between life events, coping style, and personality factors in the development of breast cancer. J Psychosom Res. 2000,;49(3):169-81. <br>[10] Bleiker EM, van der Ploeg HM. Psychosocial factors in the etiology of breast cancer: review of a popular link. Patient Educ Couns. 1999,37(3):201-14. <br>[11] Schwarz S, Messerschmidt H, Dören M. Psychosocial risk factors for cancer development. Med Klin (Munich). 2007,15;102(12):967-79. <br>[12] 细胞生物学, 王金发, 科学出版社, 2003. 509 <br>[13] <a href=""http://www.guokr.com/article/48523/"">经期吵架会害死女友吗？</a>青年熊猫，果壳网谣言粉碎机	</div></div>"
"医学健康","2013-08-07","坐月子期间不能洗头洗澡、刷牙、吹风、出门，否则落下“月子病”","新科妈妈坐月子期间禁忌多，不能洗头洗澡、不能刷牙、不能开窗吹风、不能出门，甚至不能自己开冰箱，否则就可能落下怕冷，怕风，出虚汗，关节疼痛的“月子病”，必须要再坐一次月子才能好。","假","","<div><div class=""rumor-desc""><strong>流言</strong><span class=""arrow-right""></span>新科妈妈坐月子期间禁忌多，不能洗头洗澡、不能刷牙、不能开窗吹风、不能出门，甚至不能自己开冰箱，否则就可能落下怕冷，怕风，出虚汗，关节疼痛的“月子病”，必须要再坐一次月子才能好。</div></div><div><p class=""rumor-truth"">		<strong>真相</strong><span class=""arrow-right""></span>月子病的说法并不科学。产后应勤洗澡、勤刷牙、尽早下地活动、在注意保暖的同时及时通风换气。</p></div><div class=""rumor-content"">		<h2>论证</h2>	<div class=""content"">	<h2><strong>产后发“虚”是自我保护机制</strong></h2>怀孕对女性来说是一种应激状态，产后这种应激状态突然解除，会使女性对温度和天气等外界变化变得更为敏感。这种情况下也许正常人觉得无所谓的温度变化就会让产妇觉得热或者冷。但这种状态绝非是一种“病”，也和疾病的易感性没有关系。产妇对环境的敏感本身就是一种自我保护机制。 <br> <br>此外，孕期女性体内各种激素水平大多都有程度不一的增加。由于盐皮质激素的作用，体内会潴留大量水分，产后这些潴留的水分主要经肾形成尿液排出，也有一部分通过出汗的形式排出体外，称为“褥汗”，是皮肤排泄功能旺盛的表现，不属于病态。这些表现在产后一周内较为明显，一周后就会逐渐恢复正常。 <br> <br> <br><h2><strong>产妇更应勤洗澡，勤刷牙</strong></h2>正如前面提到的，产后初期出汗较多。大量汗液留于皮肤表面给细菌生长留下可乘之机，不仅影响哺乳时的卫生，身上的粘腻感也会影响产妇的情绪。通常顺产后4天由于伤口原因推荐暂时不洗澡，可以擦浴和洗头，伤口愈合后就可以淋浴了；剖腹产的妈妈应在伤口完全长好后（通常需要2周左右）再洗澡，期间也可以擦浴和洗头，但应注意不要让水污染伤口。清洗身体后，新妈妈会感到神清气爽，大大有利于恢复精神，解除分娩后的疲劳。需要提醒的是，盆浴是应当避免的，以防脏水流入阴道造成感染。 <br> <br>除去出汗，在产褥期产妇会有恶露经阴道排出，因此会阴部的分泌物较多，这时应保持会阴部清洁和干燥。正常恶露初为鲜红色，3~4天后颜色逐渐变浅，最后变为白色粘稠状，持续4~6周，可有血腥味但无臭味，如果恶露有臭味或者血性恶露持续时间延长提示宫腔残留或者合并感染，应该及时就医。 <br> <br>在怀孕期间，由于激素的作用，头发的正常生长周期延长了。当分娩后，激素水平急剧下降，就会表现出头发脱落。这是正常的生理现象，并不是因为梳头洗头所造成的，因此新妈妈无需对梳头洗头有所顾虑[1]。 <br> <br>产后不能刷牙的说法更是错误的。旧时人们大多不注重口腔卫生，很多人患有慢性牙龈炎。在孕期由于雌激素的毛细血管扩张作用，会使得原有的牙龈炎症加重，牙龈肿胀甚至形成龈瘤样改变，刷牙时容易出血。然而炎症和出血并非是由于刷牙导致的，而是原有牙龈炎症的加重，更应该注意口腔卫生[2]。新妈妈们在孕前就应当进行一次彻底的口腔治疗，去除牙石、菌斑等，并且认真地进行维护。产后更是应当一如既往地重视口腔清洁，每日刷牙，饭后漱口，保持口腔卫生。 <br> <br>产后不能开窗的说法也不靠谱。如果有亲朋好友登门探访道贺，家里客人一多，空气流通再不好，也很容易使产妇感染疾病。及时的通风换气，保证家中空气的清新，对于预防传染性疾病的发生还是很重要的。正如前面提到的，产妇对气温的变化比较敏感，这时注意保暖是应该的，但也不该盲目地闭门闭窗。 <br> <br><h2></h2><h2><strong>关节疼痛与坐月子无关</strong></h2>产后的关节痛通常是生产过程造成局部肌肉和关节劳损所致，通过适当的休息和理疗都可以逐渐缓解。部分关节肌肉疼痛是由于长期卧床不活动，深静脉形成血栓所引起的，因此，产后应该尽早下地活动。 <br> <br> <br><h4><strong>参考资料： </strong></h4>[1] <a href=""http://www.mayoclinic.com/health/postpartum-care/PR00142/NSECTIONGROUP=2"">Labor and delivery, postpartum care (MayoClinic)</a><br>[2] 张志愿主编，《口腔科学（第7版）》，人民卫生出版社，2008年 <br>[3] <a href=""http://www.guokr.com/article/34597/"">破除不科学的月子禁忌</a>，和谐大巴，果壳网谣言粉碎机<br> 	</div></div>"
"医学健康","2013-08-09","拿烙铁烫自己的伤口能止血","古装剧里经常有演，受伤了拿炽热的烙铁烫自己的伤口来止血。","真","","<div><div class=""rumor-desc""><strong>流言</strong><span class=""arrow-right""></span>古装剧里经常有演，受伤了拿炽热的烙铁烫自己的伤口来止血。</div></div><div><p class=""rumor-truth"">		<strong>真相</strong><span class=""arrow-right""></span>烙铁烫的确能止血，利用热效应使组织凝固，封闭血管。</p></div><div class=""rumor-content"">		<h2>论证</h2>	<div class=""content"">	相比来看，单就止血而论，烙铁类似于单极电凝，利用热效应使组织凝固，封闭血管。不过精确性低，杀伤范围大。<br><br>单极电凝使用的时候是要用纱布蘸掉伤口上的血，观察出血点在哪里，只针对出血点电凝就可以。在古代条件下未必有找“点”的意识，烙铁太精细的话热量又太低，对多个点需要多次操作在不麻醉的情况下可能会增加痛苦，古代没有无菌术的话反复蘸血又会造成伤口的污染。所以烙铁就一下子贴上去了。<br><br><br>参考资料：<br>[1] <a href=""http://www.guokr.com/question/470403/"">拿烙铁烫自己的伤口真能止血吗?</a>，小园听风，果壳网果壳问答<br>	</div></div>"
"医学健康","2013-08-09","古人不会得癌症","很多人都认为癌症是“现代病”，因为“从前听都没听说过”。貌似又有些研究支持这一观点，两位科学家通过研究木乃伊发现，古人无癌，癌症是“人造现代病”，甚至说“工业革命以来，人类的死亡率开始急速飙升”。","假","","<div><div class=""rumor-desc""><strong>流言</strong><span class=""arrow-right""></span>很多人都认为癌症是“现代病”，因为“从前听都没听说过”。貌似又有些研究支持这一观点，两位科学家通过研究木乃伊发现，古人无癌，癌症是“人造现代病”，甚至说“工业革命以来，人类的死亡率开始急速飙升”。</div></div><div><p class=""rumor-truth"">		<strong>真相</strong><span class=""arrow-right""></span>很多致癌因子自古以来并未发生什么变化，所以古人也无法从中幸免。人们之所以会有“古人不得癌”的印象，是因为古代人平均寿命短，大部分人活不到足以罹患癌症的年纪，同时，对癌症的认识以及漏诊等问题同样助长了这一印象。</p></div><div class=""rumor-content"">		<h2>论证</h2>	<div class=""content"">	<h2><strong>流言存在逻辑错误 </strong></h2>“人类的死亡率”从来都是100%，不存在“飙升”。自然界中的各种致癌因素，比如紫外线、环境毒素、霉变食物、致癌病毒等，也是自古存在的。 <br><br> <br><h2><strong>相关研究确实存在</strong></h2>流言提及的论文发表于最新一期《自然癌症综述》。作者戴维和齐默曼总结了过往公开发表的研究后认为，在数万根古人遗骨以及来自古埃及与南美等地的数百具木乃伊中，可确诊的癌症病例屈指可数，才得出了结论。不过，研究漏洞颇多，其论断并不可靠。<br> <br><h4><strong>1，古人寿命</strong><strong> </strong></h4>要研究癌症这种与衰老有莫大关联的疾病，需要了解那些古人遗骸平均寿命几何。那些木乃伊的死亡年龄大大低于现代人的平均寿命。智利和秘鲁等地的木乃伊很多是被献祭的青年甚至儿童。而根据铭文记载，古埃及的富裕阶层一般能活到40-50岁，平民则一般仅可活到25-30岁。 <br> <br>国际癌症研究署（IARC）环境与辐射部门负责人舒茨表示，年纪与癌症发生率紧密相关，90%的癌症发生在50岁之后的人群中。而古人则大多在活到能罹患癌症之前就因传染病等因素离世了。“癌症现代病”论文作者对此举出原发性骨癌的例子，认为这个病较常见于年轻人，却在古代样本中无法检出。对此舒茨强调，原发性骨癌在青年人群中的发病率仅万分之一。在为数不多的古代样本中无法检出并不能说明古人不会罹患此病。 <br> <br><h4><strong>2，“漏诊”问题</strong><strong> </strong></h4>该论文面临的第二个质疑是会不会有“漏诊”。论文作者主要依靠肉眼观察和以及偶尔的X光检查遗骨上的增生状况。对此，有评论者表示，这个做法相当不准确。一方面，必须是影响到骨骼的癌症才可能在遗骨上表现出来；另一方面，骨骼的保存状况对判断结果影响很大。论文作者也承认，骨转移造成的侵蚀和死后的自然侵蚀十分难以区分。对木乃伊的研究也面临困难。制作埃及木乃伊要将死者的绝大部分内脏取出，并清洗身体，癌组织可能受到破坏甚至完全被清除。其实，在论文末尾，作者也承认，因为诊断手段的局限造成误差，或者调查样本太小，那些统计数据本身就不足以提供一个可靠的癌症发病率。 <br><br> <br><h2><strong>恐龙也有癌症记录</strong><strong> </strong></h2>工业化以来的环境污染的确令周遭的某些致癌因子增加，但研究显示，占癌症原因比重最大的，是那些我们自己选择的生活方式：吸烟，喝酒，肥胖，缺少锻炼等等。癌症绝不是生活在现代社会避无可避的悲哀。在美国卡内基博物馆收藏的一件1.5亿年前的恐龙化石上，科学家都找到了明显的癌症痕迹。恐龙癌病显然与工业化没什么关系。 <br><br> <br><h4><strong>参考资料：</strong></h4>[1] <a href=""http://www.guokr.com/post/4689/"">古人真的不得癌 症吗？</a>游识猷，果壳网谣言粉碎机小组 	</div></div>"
