"category","date","title","descrip","LiuyanType","answer","detail"
"医学健康","2013-08-20","吃盐越多越健康","一篇题为 《高盐≠高血压》 的文章称：最新研究全面质疑食盐摄入量与高血压的关系。美国医药期刊一项研究比较了7800万美国人的钠摄入量和心脏病死亡率，时间跨度长达14年。结果却是，摄入钠越多的人，死于心脏病的几率反而越小。","假","","<div><div class=""rumor-desc""><strong>流言</strong><span class=""arrow-right""></span>一篇题为 《高盐≠高血压》 的文章称：最新研究全面质疑食盐摄入量与高血压的关系。美国医药期刊一项研究比较了7800万美国人的钠摄入量和心脏病死亡率，时间跨度长达14年。结果却是，摄入钠越多的人，死于心脏病的几率反而越小。</div></div><div><p class=""rumor-truth"">		<strong>真相</strong><span class=""arrow-right""></span>流言涉及的文章有失偏颇，仅仅片面报道了学术界争论的一个话题，即“高盐饮食是否增加了心脏病发病及死亡的风险”。目前来看，高盐饮食与高血压之间的正相关关系仍很明确。医学界的主流意见仍提倡低盐饮食以预防高血压及其并发症。</p></div><div class=""rumor-content"">		<h2>论证</h2>	<div class=""content"">	<h2><strong>关于高血压</strong></h2>从世界范围来看，高血压已经影响了接近25%的成年人口。科学家们预计，这一数字可能将在2025年达到60%。在罹患高血压的人群中，除少数（约5%）是由于某些特殊疾病造成的症状性高血压（又称继发性高血压）外，绝大部分是原发性高血压，此类高血压的发病往往与环境、遗传、心理、膳食等多种因素有关。由于高血压是心脑血管疾病的独立危险因素，而后者又是人类健康的第一杀手，因此防控高血压的意义重大。 <br> <br><h2><strong>关于食盐</strong></h2>食盐的主要成分是氯化钠。在人体体液中，钠离子是细胞外液最常见的阳离子，负责维持体液的晶体渗透压。细胞内外钠、钾、钙等带电离子的浓度相差较大，由此造成胞膜电位差，这是细胞产生及传导兴奋性的前提。人体每天都会经由尿液、汗液等途径排出钠，因此必须经由饮食补充钠离子，食盐是钠离子的主要来源。一般来说，成年人每日至少需摄入4.5克氯化钠，折合成钠离子则少于100mmol。 <br> <br><h2><strong>钠离子与高血压</strong></h2>实验证明，钠离子摄入过多会引起肾上腺和脑组织释放内源性“洋地黄样因子”（digitalis-like factor）。在低钾的共同作用下，细胞膜上钠泵受到抑制，动脉血管平滑肌细胞的胞膜电位差减小，细胞兴奋性增加，变得更容易“激动”，结果则表现为动脉收缩，血压升高。钠离子潴留还会通过减低舒血管介质的合成来导致血压升高。上述机制能够解释为何大多数原发性高血压患者并没有体内水的明显滞留。当然，一旦钠离子潴留过多，体液量明显增加，那么高血压就更好理解了。<br> <br>在每日摄入钠离子少于50mmol的人群中，极少能观察到年龄相关的血压升高；而后者在每日摄入100mmol以上钠离子的人群中较为常见。不过，尽管世界大多数人口的每日钠离子摄入量都高于100mmol，罹患高血压的人毕竟还是少数。因此，每日摄入多于100mmol钠离子对于高血压病来说只能算必要非充分条件。<br> <br>在一项名为“国际食盐与高血压研究”（International Study of Salt and Blood Pressure ，INTERSALT）的调查中，研究人员纳入了32个国家的10079名对象，结果发现，30年间每天多摄入50mmol钠，平均收缩压和舒张压将分别提高5mmHg和3mmHg。该研究在排除了其他混杂因素的干扰后仍然观察到钠离子摄入与血压之间的正相关关系。动物实验也证实了食盐与高血压之间的关系。当把黑猩猩的每日食盐摄入量提高到15克时，黑猩猩的收缩压和舒张压分别提高了33mmHg和10mmHg；当去除食盐供应后，黑猩猩的血压又恢复到正常。减低食盐摄入的降压效果在人类身上也获得了肯定。[2] <br> <br><h2><strong>关于限制食盐摄入与疾病风险的相关研究</strong></h2>长期血压控制不佳会导致动脉硬化，诱发心脑血管卒中，损害心脏、肾脏及全身各个脏器。既然过量摄入食盐与高血压有着密切关系，那么理论上食盐摄入也将间接与心脑血管疾病的发病率和死亡率等存在联系。<br><br>20多年来，已经有不少针对上述问题的调查研究。其结果多数都与之前的预测接近。例如2007年发表于《英国医学杂志》的一篇题为“限制饮食中钠摄入对于心血管疾病长期效果的观察：预防高血压实验的观察性随访”（Long term effects of dietary sodium reduction on cardiovascular disease outcomes: observational follow-up of the trials of hypertension prevention (TOHP)）的研究[3]就表明减少钠摄入不但能够预防高血压，而且将可能减低未来心血管疾病的长期风险。2010年发表于《新英格兰医学杂志》的一篇名为“减低食盐摄入对于未来心血管疾病的预测效果”（Projected effect of dietary salt reductions on future cardiovascular disease）的文章[4]则表明，适度减少食盐摄入将大大减少心血管事件以及医疗费用，值得作为公共健康目标来推动。正是基于类似上述的大量研究，国际权威医学部门，从世界卫生组织到各国的膳食指南均提倡限制饮食中的食盐摄入。<br><br>当然，在同时期也的确有一些研究文章称没有观察到限制摄入食盐的明显益处，但是这些意见并未成为主流。高盐与高血压之间存在较为明确的正相关关系，只是高盐与心血管疾病及总体死亡率之间的关系仍有争议。多数引起争议的研究结果都是针对后两者而进行的流行病学调查。流言中所引用的那篇《美国医学杂志》的研究结果[5]也属于此类情况。流言中声称这篇文章“研究了7800万美国人的钠摄入量和心脏病死亡率”，谣言粉碎机调查员对此数据甚为惊异，阅读原文才发现其实此项研究的样本数量应为7154人，只是抽样结果“代表了7890万非制度化的美国成年人”。这篇文章的结论也只是一家之言，与其类似的众多研究并未得出一致的结果。<br><br>今年五月发表于《美国医学会杂志》（JAMA）的一篇文章[6]更是宣称发现了低盐饮食的弊端：那些尿钠水平最低的对象因心血管疾病死亡的风险要比尿钠水平最高的对象高56%！这一颠覆性结果立即引起了广泛注意并占据了报纸的醒目位置。流言涉及的文章也将这项研究作为低盐饮食无益甚至有害的论据。但事实上，虽然《美国医学会杂志》是一本重量级权威期刊，但这篇文章却引发了激烈争论。哈佛大学公共健康学校就对这篇文章的质量不以为然。他们认为[7]，首先，JAMA这篇文章的研究对象只有不到4000人，其中由于心血管疾病死亡的仅有84人。要得出颠覆性结论，84这样的样本数未免太小；第二，这一结论与过去多年以来确认的食盐与高血压存在清晰联系的结论相悖；第三，该研究以尿钠作为长期摄入食盐的观察指标，但仅用24小时的尿钠结果不足以反映长期摄入食盐的情况；第四，那些高个子或大活动量的对象进食要更多，而多进食则常常意味着摄入食盐更多，但是，大活动量的人心脏往往要比缺乏活动的人要更健康，JAMA的研究没有将此类情况考虑在内并予以校正。此外，该研究还存在丢失大量数据的情况等等。总而言之，JAMA的这篇文章在科学上存在较多缺陷，其结果可信度有限。<br><br>另外，文章提到的关于低盐饮食会激活肾素-血管紧张素-醛固酮系统（RAAS）而导致高血压的观点也没有得到主流认可。没有证据证明在推荐食盐摄入量的范围内，低盐饮食会诱发交感兴奋和RAAS激活。事实上，当前人类的饮食多是加工工业的杰作，这些食物通常富含钠而缺乏钾。相反，自然界中的天然食物往往是低钠而高钾的。例如，两片火腿就含有32mmol钠和4mmol钾，而一个橙子则含有6mmol钾而不含钠。在与世隔绝的以天然食物为主的部落人群中，食物每日往往会提供高达150mmol的钾而仅有20-40mmol的钠，而这些人中高血压的发病率不足1%。在食品工业出现之前的很长一段时间里，人类的食谱其实就是低钠而高钾的，或许我们肾脏的任务原本就是为了更好地处理钾而不是钠。 <br> <br><h4></h4><h4><strong>参考资料：</strong></h4>[1] 《外科学》 人民卫生出版社 <br>[2] Horacio J. Adrogué, Nicolaos E. Madias. Sodium and Potassium in the Pathogenesis of Hypertension. N Engl J Med 2007; 356:1966-1978 <br>[3] Cook NR, Cutler JA, Obarzane kE, et al. Long term effects of dietary sodium reduction on cardiovascular disease outcomes:observational follow-up of the trials of hypertension prevention (TOHP). BMJ. 2007:28;334(7599):885-8. <br>[4] Kirsten BD, Glenn MC, Pamela GC, et al. Projected Effect of Dietary Salt Reductions on Future Cardiovascular Disease. N Engl J Med 2010; 362:590-599 <br>[5] Cohen HW, Hailpern SM, Fang J, Alderman MH. Sodium intake and mortality in the NHANES II follow-up study. Am J Med. 2006 Mar;119(3):275.e7-14. <br>[6] Stolarz-Skrzypek K, Kuznetsova T, Thijs L, et al. Fatal and Nonfatal Outcomes, Incidence of Hypertension, and Blood Pressure Changes in Relation to Urinary Sodium Excretion. JAMA. 2011; 305:1777–85. <br>[7] 哈佛公共健康学校：<a href=""http://www.hsph.harvard.edu/nutritionsource/salt/jama-sodium-study-flawed/""> Flawed Science on Sodium from JAMA </a><br>[8] <a href=""http://www.guokr.com/article/58388/"">重口味的逆袭？吃盐越多越健康？</a>赵承渊，果壳网谣言粉碎机<br><br>	</div></div>"
"医学健康","2013-08-21","大多数人都会怀2个孩子，只不过很多时候一个会把另一个吸收掉","我姐姐怀孕了，查出来是个龙凤胎，家里都很高兴。结果前些天再检查的时候发现女孩不见了！然后医生告诉我姐有这种情况，说其实大多数人都会怀2个孩子，只不过很多时候一个会把另一个吸收掉！","假","","<div><div class=""rumor-desc""><strong>流言</strong><span class=""arrow-right""></span>我姐姐怀孕了，查出来是个龙凤胎，家里都很高兴。结果前些天再检查的时候发现女孩不见了！然后医生告诉我姐有这种情况，说其实大多数人都会怀2个孩子，只不过很多时候一个会把另一个吸收掉！</div></div><div><p class=""rumor-truth"">		<strong>真相</strong><span class=""arrow-right""></span>双胞胎之一“不见了”，医学上称之为“双胎消失综合征”， 可能是一种自然选择的现象，也可能由于“双胎输血综合征”导致。这种情况的发生率并不高，不必大惊小怪。但如果发生在妊娠3个月后，则有可能造成母体和胎儿的严重并发症，应当谨慎处理。</p></div><div class=""rumor-content"">		<h2>论证</h2>	<div class=""content"">	<h2><strong>【双胞胎和多胞胎发生的几率】 </strong></h2>双胞胎或者多胞胎的发生率其实并不高。1895年，Hellin根据大量统计资料，推算出自然状态下，白人多胎妊娠发生率的公式为：1/89 (n-1) （n代表一次妊娠的胎儿数），也就是说，双胞胎的发生率约为1/89（约1.1%）[1]，三胞胎的发生率约为1/7921（约0.013%）[2]。亚洲人中双胎更不常见，在日本，双胎发生率仅有1/155（约0.65%）。也就是说，150多次妊娠中才会发生一次双胎，大多数人都不会怀2个孩子。当然，通过人工辅助生育技术促排卵的方式来增加多胎妊娠的几率不在这个讨论范围内。 <br> <br>上面所说的双胞胎发生率准确来说是实际分娩率。在早期妊娠时，经B超诊断的双胎数要比实际分娩的双胎数要高，不过也远没有达到“大多数”。有报道所有自然妊娠的孕妇中，在妊娠第8周时多胎率为3.3-5.4％[3]，但其中21～30%会发生多胎中的一胎或以上死亡或消失[4]，这种现象称为双胎消失综合征（VTS，Vanishing Twin Syndrome）。胎儿消失在三胎和四胎妊娠发生率更高，三胎妊娠中一个胎消失的发生率可能超过40%[2]。 <br> <br><h2><strong>【双胎消失综合征】 </strong></h2>双胎消失的原因目前虽然不很明确，但双胎消失综合征在基因或染色体异常的胎儿中更为常见。目前一个比较普遍的看法是双胎中消失的一个多是因为自然选择被淘汰了。此外，双胎消失还可能是由于母胎血型不合所引起的免疫排斥，或者由异常的血管吻合所致。“双胎输血综合征”也可导致双胎之一死亡和消失[5]。 <br> <br>早期死亡的胎儿由于骨骼尚未发育完成，不断受到正常妊娠胎儿的羊膜囊的挤压，加之死胎部分软组织被吸收，到存活胎儿生产时，这个死胎就变得又扁又薄，但胎儿整个轮廓仍清晰可辨，所以被称为“纸样胎”。这种情况更常发生在有“双胎输血综合征”的胎儿中。对于孕早期死亡的胎儿，机体对其产生的反应不同，死亡的胚胎最终可能变成一个胎盘上的囊肿，或者纤维化，或者无定形物质，或者干脆彻底被胎盘或母体吸收[6]。 <br> <br><h2><strong>【双胎输血综合征】</strong><strong> </strong></h2>双胎输血综合征（TTTS，Twin-to-twin transfusion syndrome）是一种特殊的双胎妊娠并发症。当两个胎儿共用一个胎盘时，通常胎盘血管间的相互吻合是彼此平衡的。但如果这样的血管吻合出现异常，比如其中以胎儿的深部动脉和另一胎儿的静脉发生吻合，那么一个胎儿的血便会借助这支大血管的吻合源源不断地输入另一个胎儿体内。供血胎儿由于不断地向受血胎输血，处于低血容量、贫血状态，胎儿发育迟缓、少尿、羊水少；受血胎儿则由于处于高血容量，尿量增加引起羊水增多，同时胎儿个体较大，其心、肝、肾等脏器增大，红细胞增多，红细胞比容增高，胎儿会出现水肿。如果供血胎儿及其血管受到受血胎儿一侧增大的羊膜腔的过度压迫，将会导致供血胎儿死亡，最终也会发展成双胞胎中的一个“不见了”。 <br> <br><h2><strong>【双胎之一消失的后果】 </strong></h2>在妊娠前3月内一胎消失，剩下的一个或多个胎通常可以正常发育不受影响，尽管孕妇可能会出现少量阴道出血。但妊娠3月之后发生的双胎之一消失，由于死胎体积较大，身体难以将其完全处理，会使母体和胎儿发生各种并发症的风险大大增加，包括使母体发生早产、宫腔内感染、严重的产后出血、凝血障碍和难产等情况[8]，增加他（她）幸存下来的兄弟（姐妹）脑瘫等脑部损伤的风险[6]，以及发生皮肤坏死、低血压乃至宫内死亡等情况[9]。因此，怀孕之后的定期B超检查是十分必要的。如果孕中晚期发生双胎之一消失的话，应该对孕妇和胎儿进行严密的观察，预防相关并发症的发生。 <br> <br> <br><h4><strong>参考资料： </strong></h4>[1] Fellman J, Eriksson AW. Statistical analyses of Hellin's law. Twin Res Hum Genet. 2009 Apr;12(2):191-200. <br>[2] (1, 2)<a href=""http://www.asrm.org/uploadedFiles/ASRM_Content/Resources/Patient_Resources/Fact_Sheets_and_Info_Booklets/multiples.pdf"">Multiple Pregnancy and Birth: Twins, Triplets, and Higher Order Multiples.</a> American Society for Reproductive Medicine, 2004 <br>[3] Landy HJ, Weiner S, Corson SL, et al. The ""vanishing twin"": ultrasonographic assessment of fetal disappearance in the first trimester. Am J Obstet Gynecol. Jul 1986;155(1):14-9. <br>[4] Sampson A, de Crespigny LC. Vanishing twins: the frequency of spontaneous fetal reduction of a twin pregnancy. Ultrasound Obstet Gynecol. Mar 1 1992;2(2):107-9. <br>[5] Landy HJ, Keith LG. The vanishing twin: a review. Hum Reprod Update. Mar-Apr 1998;4(2):177-83. <br>[6] (1, 2) Pharoah PO, Adi Y. Consequences of in-utero death in a twin pregnancy. Lancet. 2000 May 6;355(9215):1597-602. <br>[7] Brackley KJ, Kilby MD. Twin-twin transfusion syndrome. Hosp Med. Jun 1999;60(6):419-24. <br>[8] Yoshida K, Soma H. Outcome of the surviving cotwin of a fetus papyraceus or of a dead fetus. Acta Genet Med Gemellol (Roma). 1986;35(1-2):91-8. <br>[9] Classen DA. Aplasia cutis congenita associated with fetus papyraceous. Cutis. Aug 1999;64(2):104-6. <br>[10] 乐杰主编，《妇产科学》，人民卫生出版社，2008年 <br>[11] <a href=""http://www.guokr.com/article/61603/"">我外甥把我外甥女吃掉了！</a>和谐大巴，果壳网谣言粉碎机	</div></div>"
"医学健康","2013-08-16","艾滋病毒完全有可能穿透避孕套","艾滋病毒比精子小很多，目前市面上的避孕套只能避孕，并不能防止艾滋病传播！避孕套甚至不能预防一般的性传播疾病！","假","","<div><div class=""rumor-desc""><strong>流言</strong><span class=""arrow-right""></span>艾滋病毒比精子小很多，目前市面上的避孕套只能避孕，并不能防止艾滋病传播！避孕套甚至不能预防一般的性传播疾病！<br><br><br>据“《新英格兰医学杂志》的报告，使用避孕套预防艾滋的失败率为16.7% ； 英国《社会科学医学》杂志则说，失败率达31%；美国国立卫生研究院（NIH）、食品和药品监督管理局（FDA）等多家医学和相关政府部门联合声明：没有科学证据表明，避孕套能够有效预防大多数性传播疾病。”原因是避孕套的乳胶膜体存在五千到七万纳米之间的天然裂隙，对直径约3000纳米精子能有效阻隔，但直径42纳米的乙肝病毒、50～55纳米的人体乳头瘤病毒、120纳米的艾滋病毒完全有可能穿透。</div></div><div><p class=""rumor-truth"">		<strong>真相</strong><span class=""arrow-right""></span>决定病毒是否能从缝隙中穿过的重要因素是流体的流动，而非病毒的大小，所以艾滋病毒等是无法穿透的。除了对性行为的自律，目前安全套对于降低性传播疾病的感染起到了很重要的作用。</p></div><div class=""rumor-content"">		<h2>论证</h2>	<div class=""content"">	在国外，对安全套在预防性传播疾病方面的作用的质疑由来已久。主要的反对意见来自于保守人士主张通过杜绝婚前性行为和婚外性行为来预防性传播疾病。这样的立场，使得他们把重点放在使用了安全套的“中招率”上。而事实上，考察安全套的有效性，应该比较不使用和使用的差别。毕竟，不是所有人都能做到自律的性行为，而这部分人正是各种性传播疾病的易感人群，在他们中间推广安全套的作用尤为重要。<br><br>那么，安全套对于各种性传播疾病的预防到底有没有作用呢？针对这个问题，在2000年，美国国立卫生研究院（NIH）、食品和药品监督管理局（FDA）、疾病预防和控制中心（CDC）以及美国国际开发署（US－AID）联合主持评估会议，对关于安全套预防性传播疾病的有效性的科学研究结果进行了综合评估[1]。这个就是流言里提到的“联合声明”。这次评估的结论是, 安全套可以降低HIV和男性淋病的传染；而对于此外的其他性传播疾病，由于数据的缺乏，暂时不能得出结论。流言中的“没有科学证据表明，避孕套能够有效预防大多数性传播疾病”，是对结论的后半部分的描述，在缺乏上下文的情况下，理解起来就成了安全套没有什么预防作用。而事实上，这份评估报告恰恰是说明安全套是可以有效降低艾滋病的感染率的。<br><br>可喜的是，随着研究的不断深入，更多实验数据的收集，更多的实验证据都进一步证实安全套对其他性传播疾病——淋病和衣原体[2]、单纯性疱疹[3]、HPV[4]的预防都是有效的。<br><br>流言里“《新英格兰医学杂志》的报告，使用避孕套预防艾滋的失败率为16.7%”的说法的来源可能是题为《Condoms and Sexually-Transmitted Infections》的文章[5]。原文的说法是“研究表明，持续使用避孕套能80%~90%地降低艾滋病传染的危险”。这恰恰也是说明避孕套对于艾滋病预防是有作用的。<br><br>而流言里提到的英国《社会科学医学》杂志里的说法，出自Susan C. Weller的1993年的一篇文章。[6]里面确实提到安全套对艾滋病的预防有效率是69%，转换成流言里的说法就是“失败率为31%”。这个数据考虑了部分人并没有正确的使用安全套；如果能够做到持续、正确地使用，安全套在预防艾滋病的有效率会更高。作者也表示，目前的研究结果也需要更多实验数据的验证。<br><br>在“有效”还是“失败”这个问题上，流言应用了心理学上的“框架效应”，给我们耍了个小花招。这个流言在表达上有意将“有效率”转化成“失败率”，从而引导人们关注负面的效果，让人们对安全套的有效性产生怀疑。在医疗手术决策中也有类似的实例：对于同一项手术，如果用存活率来表达它的风险大小，会有75%的人选择手术治疗；如果改用死亡率来表达时，这个百分比将降到58%。<br><br>同样的说法，在国内则被利用来推广所谓的纳米级安全套新产品[7]。从所列举的病毒大小与避孕套材质空隙的对比数据来看，这样的安全套好像是存在隐患。而实际情况和想当然的不同。FDA的研究人员针对这种观点，考察了传统乳胶安全套的滤过性——测试高浓度的病毒溶液是否能透过多种不同类型的传统乳胶安全套[1]。结果显示，即使是最小的性传播病毒乙肝病毒（42纳米）也无法透过。因为决定病毒是否能从缝隙中穿过的重要因素是流体的流动，而非病毒的大小；即使是比病毒大上好多倍的空隙，因为流体不能通过，病毒也是无法穿透的。<br><br><br><h4><strong>参考资料：</strong></h4>[1] <a href=""http://www.niaid.nih.gov/about/organization/dmid/documents/condomreport.pdf"">Workshop summary: scientific evidence on condom effectiveness for sexually transmitted diseases (STD) prevention. </a>Bethesda, Md.: National Institute of Allergy and Infectious Diseases, July 20, 2001.<br>[2] Warner L, Stone KM, Macaluso M, Buehler JW, Austin HD. Condom use and risk of gonorrhea and chlamydia: a systematic review of design and measurement factors assessed in epidemiologic studies. Sex Transm Dis 2006;33:36-51<br>[3] Wald A, Langenberg AG, Krantz E, et al. The relationship between condom use and herpes simplex virus acquisition. Ann Intern Med 2005;143:707-713<br>[4] Winer et al. <a href=""http://www.nejm.org/doi/full/10.1056/NEJMoa053284"">Condom Use and the Risk of Genital Human Papillomavirus Infection in Young Women </a>N Engl J Med 2006; 354:2645-2654<br>[5] Markus J. Steiner, Ph.D., and Willard Cates, Jr., M.D., M.P.H.<a href=""http://www.nejm.org/doi/full/10.1056/nejmp068111""> Condoms and Sexually-Transmitted Infections</a> N Engl J Med 2006; 354:2642-2643<br>[6] Susan C. Weller A Meta-analysis of Condom Effectiveness in Reducing Sexually Transmitted HIV. Soc. Sci. Med. Vol. 36, No. 12. pp. 1635-1644, 1993<br>[7] <a href=""http://www.infzm.com/content/18316"">“安全”是个“圈套”？</a><br>[8] <a href=""http://www.guokr.com/article/3380/"">安全套有“漏洞”，防不住“纳米”HIV？</a>皮卡，果壳网谣言粉碎机<br><br><br>	</div></div>"
