"category","date","title","descrip","LiuyanType","answer","detail"
"医学健康","2013-08-05","坐月子期间绝对不能用力、不能做家务，要卧床休息","新科妈妈坐月子期间禁忌多，不能用力、不能做家务，要卧床休息，否则会患上子宫脱垂。","假","","<div><div class=""rumor-desc""><strong>流言</strong><span class=""arrow-right""></span>新科妈妈坐月子期间禁忌多，不能用力、不能做家务，要卧床休息，否则会患上子宫脱垂。</div></div><div><p class=""rumor-truth"">		<strong>真相</strong><span class=""arrow-right""></span>产后应当尽早下床活动，但应避免屏气用力增加腹压的动作。常期卧床不但不利于产后恢复，增加子宫脱垂的风险，还有可能引起致命的肺栓塞。</p></div><div class=""rumor-content"">		<h2>论证</h2>	<div class=""content"">	新妈妈在产褥期需要得到呵护是没错，但月子绝不是“坐”出来的。在充分休息恢复身体的同时，应当鼓励妈妈及时下床活动，这样不仅可以使身体精力充沛，更可促进产后恢复。 <br> <br><br><h2><strong>子宫脱垂，可能会有</strong></h2>支持盆腔器官的组织如果薄弱或受损，会使这些器官脱离正常位置，甚至脱出体外，这就是所谓的盆腔器官脱垂，比如子宫脱垂、阴道脱垂、直肠脱垂等。一般情况下，衰老是发生盆腔器官脱垂的主要原因，另外还有许多其他潜在因素，包括肌张力下降、绝经和雌激素水平降低、多次经阴道分娩、肥胖、有家族遗传倾向（结缔组织疾病）、骨盆外伤或既往手术史、反复负重，长期便秘，咳嗽等疾病。 <br><br>老人常说，坐月子期间不能用力，否则会患上子宫脱垂。大概是因为旧时妇女大多都有多次阴道分娩的经历。多次分娩加之助产技术的落后，容易造成支持子宫和宫颈的韧带发生损伤，对子宫的支持固定力减弱。加上产后从事洗尿布、洗菜这类会使腹压增加的蹲式劳动，更容易使子宫被推离正常位置，发生子宫脱垂。 <br> <br>现今我国女性大多只生一胎，助产术也发生了巨大进步，由于分娩时损伤导致的脏器脱垂已经大大减少。只要在产褥期避免搬运重物等需要屏气用力的重体力劳动，适当的活动不但不会造成子宫脱垂，反而有利于子宫位置的恢复。相反，如果产妇遵照旧习俗，“坐月子”时一直卧床，会增加发生子宫脱垂的风险。 <br> <br><br><h2><strong>长期卧床，增加子宫脱垂风险</strong></h2>许多人认为产妇体质虚弱，需静养，让她们长期卧床，甚至连饭菜都端到床上吃，其实这种做法弊多利少。因为膀胱肌张力降低，对膀胱内压的敏感性降低，加上外阴切口的疼痛等影响，产妇容易并发慢性尿潴留。这时如果长期卧床，在重力的作用下，充盈的膀胱会向后推挤子宫。再加上分娩结束后一段时间，子宫尚未恢复正常的前倾位，因此便更容易处于后位。这时子宫轴与阴道轴方向一致，当腹压增加（如咳嗽、用力排便）时，子宫会沿阴道方向下降而发生脱垂[1]。 <br> <br>产后长期卧床，还会使得肠蠕动减弱。一些月子习俗常常使得产妇的饮食里缺乏纤维素。这些都容易造成产妇便秘。便秘时用力排便的动作会导致腹压的升高，增加发生子宫脱垂的风险。 <br> <br><br><h2><strong>更大的风险，可能危及生命</strong></h2>产妇在怀孕和产后的一段时间里，血液都处于高凝状态。如果较长时间不活动甚至长期卧床，血液很容易在下肢静脉等血流缓慢处凝集，形成下肢静脉血栓，出现下肢浮肿、疼痛的症状。如果下肢静脉血栓发生脱落，随血流运动回到心脏，可能会阻塞肺部血管，造成“肺栓塞”。这是最危险的并发症之一，可能危及生命！所以，尽早下床活动是非常必要的！ <br> <br><br><h2><strong>什么程度的活动是合适的？</strong><strong> </strong></h2>产后活动应当循序渐进，早期下床慢步行走即可，适应之后再逐渐增加运动的强度。一般情况下，产后6-12小时就可起床轻微活动，产后第二天便可在室内随意走动并练习产后体操，有利于体力恢复，同时预防便秘和尿潴留。行会阴侧切或者剖宫产的产妇可以适当推迟活动时间。等到拆线后伤口不感疼痛时，也应该练习产后体操。常用的动作有“桥”式运动、骨盆倾斜运动、伸展运动、收腹运动等，具体的操作建议在专业人士的指导下进行[2]。 <br> <br><br><h4><strong>参考资料： </strong></h4>[1] 乐杰主编，《妇产科学（第7版）》，人民卫生出版社，2008年 <br>[2]Catherine Cram, M.S. <a href=""http://babyfit.sparkpeople.com/articles.asp?id=710"">Postpartum Recovery: The First Six Weeks, Gentle Exercises to Help You Recover.</a><br>[3] Halbreich U, Karkun S. Cross-cultural and social diversity of prevalence of postpartum depression and depressive symptoms. J Affect Disord. 2006;91:97-111. <br>[4] <a href=""http://www.guokr.com/article/33172/"">月子可不是“坐”出 来的</a>，和谐大巴，果壳网谣言粉碎机<br> <br> 	</div></div>"
"医学健康","2013-08-06","减肥也要分血型，根据不同的方法来减","这个理论是由美国的彼得•达达莫（Peter D'Adamo）“博士”提出的：“A型血：少吃肉类，素食为主，适当运动；B型血：通常不易长胖，但要避免暴食暴饮；AB型血：均衡饮食，简单烹饪，少吃多餐；O型血：三餐定时，大胆吃肉，少吃主食。” ","假","","<div><div class=""rumor-desc""><strong>流言</strong><span class=""arrow-right""></span>这个理论是由美国的彼得•达达莫（Peter D'Adamo）“博士”提出的：“A型血：少吃肉类，素食为主，适当运动；B型血：通常不易长胖，但要避免暴食暴饮；AB型血：均衡饮食，简单烹饪，少吃多餐；O型血：三餐定时，大胆吃肉，少吃主食。” <br> <br>O型血的历史最为悠久。它大约出现于公元前6万至4万年之间， 4万年前出现了克鲁马侬人，他们以狩猎为生。O型血的人，其消化器官的消化能力很强，拥有对食物过剩做出反应的免疫系统。这类血型的人饮食中最不可缺少的是动物性蛋白质，也就是肉类及鱼类等。对于O型血的人达达莫博士提出大胆的建议，想减肥，多吃肉。 <br>A型血出现在公元前2.5万年至1.5万年之间。当时，我们的以果实为生的祖先逐渐变成杂食。随着时间的推移，农耕成为住在现今欧洲土地上的人们的主要生产方式，野禽野兽开始接受驯养，人的饮食结构随之发生变化。A型血原来是农耕民族菜食主义者的血型，与O型血相比，其消化器官要弱得多。 <br> <br>B型血出现在约公元前1.5万年至新纪元之间。当时东非的一部分人被迫从热带稀树干草原迁徙到寒冷而贫瘠的喜马拉雅山一带。B型血易取得平衡，拥有较强的免疫系统。这种血型的人基本上属于身体强壮的那一类，对心脏病及癌症等众多现代疾病具有抵抗能力。对于B型血的人来说，导致肥胖的原因是土豆、荞麦、花生、胡麻以及小麦等食品。 <br><br>新闻来源：<a href=""http://jingyan.baidu.com/article/3a2f7c2e4c266026afd6118e.html"">http://jingyan.baidu.com/article/3a2f7c2e4c266026afd6118e.html</a></div></div><div><p class=""rumor-truth"">		<strong>真相</strong><span class=""arrow-right""></span>减肥方法和血型没有关系。无论什么血型的人都要依据自身的情况选择适合的方式去减肥。</p></div><div class=""rumor-content"">		<h2>论证</h2>	<div class=""content"">	<h2><strong>错误，从事实到逻辑</strong></h2>上述理论有不少事实上的错误。例如，一项分子进化的研究表明，A基因和O基因几乎同时出现，现有的科学证据并不支持O基因是A基因和B基因的祖先[1]。此外，科学研究也不认为B型血整体上有特殊的免疫力。对于某些特殊的疾病，B型血的抵抗力反而较弱。美国国立癌症研究所的一项研究发现，A，B，AB型血相对于O型血，更容易得胰腺癌[2]。 <br> <br>更大的缺陷是达达莫的逻辑。他的观点隐含着这样一个前提：如果一个特征出现于某个特殊的年代，那么保存了这个特征的现代人群也只能适应那个特殊年代的环境。按照达达莫的理论，O型血的人出现最早，而那个年代人类以捕猎为食，所以O型血的人适合肉食，“想减肥，多吃肉”。我们不能认为因为原始人类的文明存在限制而很少进食谷物和蔬菜，就默认这是一种健康的，或是能够减肥的生活方式。达达莫博士没有提到的是，在那个年代，人类的平均寿命大约只有20岁[3][4]，如果把当时的生活方式作为健康指导，恐怕并不那么明智。 <br> <br>即便O血型产生于人类狩猎为主的年代，也不能代表O型血是为了消化肉类而进化出来的，或者O型血的人就不能适应随后产生的谷物或是植物食物为主的食物组成。达达莫的理论，把血型产生的时间既作为血型和饮食有关的缘由，又作为血型和饮食有关的证明，形成了循环论证。要想这个理论能站得住脚，需要指出血型能影响消化的生理机理，或者是有大量的实验数据来说明这个方法的有效性。很遗憾，这两方面的证据都没有。单靠拍拍脑袋的联想是靠不住的。如果这样的推理也能接受的话，我们是不是也可以提出类似的理论：“姜”姓产生于奴隶社会，所以姓姜的人适合当奴隶或奴隶主；而“蟒”姓产生于封建社会，所以姓蟒的人适合做农民或者地主。 <br> <br>如果这个理论成立，那么全世界的饮食指导原则都必须修改，他也就做出了名动天下的革命性发现。可惜，达达莫并不愿意通过科学共同体来发表自己的理论，也不被科学界承认。今天，主流科学界的观点是，体重的增减取决于摄入热量和消耗热量之间的差值。一个常见的估计是，当摄入的热量比消耗的热量少3500卡路里时，就能减轻1磅（约453克）[5]，这个数据和血型并没有关联。如果控制摄入的热量，再合理地安排锻炼计划，持之以恒，就能减轻体重，没有捷径可走。而肉类的热量相对于蔬菜较高，无论是对O型血还是A型血都是如此。 <br> <br> <br><h2><strong>彼得·</strong><strong>达达莫其人</strong><strong> </strong></h2>事实上，这位达达莫既不是哲学博士（Ph.D)， 也不是医学博士（M.D），而是所谓的自然疗法博士（N.D）。自然疗法基于在科学界早已被驳倒的活力论，鼓吹依靠“自然的力量”以及“人体内在的智慧”治病[6][7]。不过，自然疗法在美国只能作为替代医学存在，从未被科学界接受。美国癌症协会（American Cancer Society）强调：已有的科学证据并不支持自然疗法可以医治癌症或其它疾病。[8] <br> <br><h4><strong>参考文献：</strong><strong> </strong></h4>[1] Evolution of primate ABO blood group genes and their homologous genes. Saitou N, Yamamoto F. Mol Biol Evol. 1997 Apr;14(4):399-411. <br>[2] Genome-wide association study identifies ABO Blood Group Susceptibility Variants for Pancreatic Cancer. Mundadottir L., et al. Nat Genet. 2009 Sep;41(9):986-90. Epub 2009 Aug 2. <br>[3] Food in History .p.18. Tannahi l l.R.1973.Steinand Day, New York. <br>[4] Risk assessment and regulatory decision making. Munro IC, Krewski DR. Food Cosmet Toxicol. 1981 Oct;19(5):549-60. <br>[5] Caloric equivalents of gained or lost weight. Wishnofsky M, Am J Clin Nutr. 1958 Sep-Oct；6（5）：542-6. <br>[6] <a href=""http://www.aanmc.org/naturopathic-medicine/the-6-principles.php"">Association of Accredited Naturopathic. The 6 principles.</a><br>[7] <a href=""http://nccam.nih.gov/health/naturopathy/naturopathyintro.htm"">National center for complementary and alternative medicine: Naturopathy: An Introduction</a><br>[8] <a href=""http://www.cancer.org/treatment/treatmentsandsideeffects/complementaryandalternativemedicine/mindbodyandspirit/naturopathic-medicine"">Ameirican Cancer Society: Naturopathic Medicine</a><br>[9] <a href=""http://www.guokr.com/article/22276/"">减肥也要分血型?</a>，乖乖娇小兔，果壳网谣言粉碎机	</div></div>"
"医学健康","2013-07-21","H7N9是高致病性禽流感","和H5N1型相同，H7N9也是高致病性禽流感","假","","<div><div class=""rumor-desc""><strong>流言</strong><span class=""arrow-right""></span>和H5N1型相同，H7N9也是高致病性禽流感</div></div><div><p class=""rumor-truth"">		<strong>真相</strong><span class=""arrow-right""></span>这是错的，H7N9是低致病性禽流感，因为禽类感染后症状较轻。</p></div><div class=""rumor-content"">		<h2>论证</h2>	<div class=""content"">	从流感病毒角度来讲，以下两个因素比较重要：<br><br>1.流感病毒血凝素HA裂解位点含有碱性氨基酸的数量。低致病性的病毒，如H1，H2和H3型人流感病毒的HA裂解位点只含有1个单独的碱性氨基酸。对于H5和H7型禽流感病毒，低致病性的病毒，其HA裂解位点一般仅含有1或2个碱性氨基酸；而高致病性H5和H7型病毒，其HA则往往含有4个以上的碱性氨基酸。<br><br>2. 流感病毒感染人体的部位。对于人流感病毒（H1，H2和H3型），由于它们的受体主要在人的上呼吸道。这使得病毒容易感染人体，但往往仅引起症状较轻的上呼吸道炎症；而现有的资料表明，H7N9禽流感病毒在感染人体后，主要影响下呼吸道甚至肺深部的细胞，会造成较为严重的肺部炎症，是病人出现重症和死亡的主要原因。<br><br>然而，判断一个流感病毒的致病性，不能仅仅依靠理论上的认识去下结论，还需要综合流行病学资料和实验室研究资料进行综合分析。<br><br><a href=""http://www.guokr.com/question/455416/"">http://www.guokr.com/question/455416/</a>	</div></div>"
"医学健康","2013-08-05","宿便是健康的杀手","宿便有多种危害，会压迫小肠绒毛的活力和弹性，发酵、胀气导致酸毒症，还会改变腹部和脊柱形状，让身材变形。 所以宿便要及时的用灌肠等方式清除。 ","假","","<div><div class=""rumor-desc""><strong>流言</strong><span class=""arrow-right""></span>宿便有多种危害，会压迫小肠绒毛的活力和弹性，发酵、胀气导致酸毒症，还会改变腹部和脊柱形状，让身材变形。 所以宿便要及时的用灌肠等方式清除。 <br> </div></div><div><p class=""rumor-truth"">		<strong>真相</strong><span class=""arrow-right""></span>“宿便”并非一个医学概念，它是被商家创造出来的概念，各种宣传中“宿便”的危害皆为夸大其辞的商业宣传。</p></div><div class=""rumor-content"">		<h2>论证</h2>	<div class=""content"">	<h2><strong>“宿便”是什么？</strong></h2>“宿便”并不是一个医学上的概念，因为翻遍教科书，并没有找到对它的定义。这样一来，就很难搞明白到底“宿便”是什么。 从字面上理解，应该是积存在体内的粪便，也就是积存在体内尚未排出的粪便。从食物的消化过程来看，食物在经过口腔的咀嚼和初步消化之后，通过食管进入胃部，和胃酸、各种消化液充分混合，然后进入肠道，通过十二指肠、空肠、回肠、结肠、乙状结肠、直肠，排出体外。在这个过程中，只有进入结肠，食物残渣中的水分被吸收，残渣开始聚集成形，才算开始形成粪便。所以，所谓的宿便，应该就是堆积在结肠末端准备排出体外的粪便了。<br><br><h2><strong>排便模式大变身？</strong></h2>根据这条微博的说法，人类在近20年来，排便量下降了20%，而食物的消化速度变慢了10倍。虽然找不到明确的数据来证明人类的排便量是否有下降，但是谣言粉碎机调查员认为这事是有可能的。因为随着生活条件的改善，饮食逐渐变得精细，粗纤维摄入减少，不能吸收的食物部分就少，所以排出量有可能减少。但是要说消化速度变慢了10倍，就显然有些信口雌黄了。不同的食物，进入胃部之后需要停留一段时间，但最多也就5-6个小时。而食物通过肠道的时间，主要是由肠蠕动的速度决定的，平均需要6-8个小时左右。在主要吃精细饮食的膳食结构中，即使缺乏纤维素的刺激，肠蠕动的速度也基本保持在正常范围，即便是便秘的患者，食物通过肠道的速度也不会超过10个小时。要想让食物经过消化道的时间增加10倍，就必须要让肠蠕动的速度减慢10倍，接近停止蠕动，这恐怕只会在肠梗阻患者身上出现。<br>“宿便”可能这么多吗？关于宿便，最耸人听闻的说法就是正常人体含有3-6KG宿便，肥胖便秘者体内有7-11KG宿便。这个说法很是有问题。首先不说人体每天能吃进去的东西，就算全都不吸收，也不大可能有6KG之多。更要命的是，6KG的宿便是好大一坨，堆在肠子里，会导致肠壁的压力感受器向大脑报告需要排便，产生便意。除非你憋着，否则这些宿便也就基本都排出去了。便秘的患者，因为粪便在结肠停留的时间较长，粪便的水分更少，直观感觉上粪便的量相对较少。另外，因为粪便干硬，排便的时候费时费力，身心俱疲而已，并不大可能积存更多的粪便。<br><br><h2><strong>“宿便”是健康杀手？</strong></h2>错误认识一：宿便会压迫小肠绒毛的活力和弹性？ 这简直是在开玩笑。要知道，食物在运行到结肠被吸收水分之前，都是粥样的物质，和小肠绒毛充分接触，吸收养分。这条微博的作者大概天真地认为食物经过胃，在小肠里就都是粪便样的物质，所以会压迫小肠绒毛。<br><br>错误认识二：粪便发酵、胀气导致酸毒症。 这样的说法就更搞笑了。如果说酸性物质进入血液就算酸毒症，那么随着食物进入肠腔的胃酸早就害死人了。事实上小肠中的肠液是碱性的，即使食物发酵产酸，也会被肠液迅速中和，根本不可能堆积酸性物质，更不可能进入血液搞出所谓的酸毒症。<br><br>错误认识三：宿便会改变腹部和脊柱形状，会让身材变形。 这是在为身材不满意找理由吗？粪便并非如铁一样坚硬，而是柔软的食物残渣集合体。即使粪便碰到了脊柱，也会被脊柱给弄变形了，怎么可能压迫脊柱！反过来想，如果脊柱连粪便这样的柔软物质都能使之变形，那睡在席梦思上的人一晚上都要变成罗锅了。腹部肥胖是粪便堆积在腹部所致，更是无稽之谈。真正能在腹部看到胃肠被撑起来的形状，那叫做胃肠型，是一种疾病的表现。而中年男性腹围增大，主要是脂肪堆积在腹部所致，和宿便一点关系都没有。<br><br>宣传宿便危害的人往往危言耸听，臆想出许多毫无根据的说法，而对可能的真实的危害却视而不见。粪便积存在肠道里过久确实会产生一些问题。积存在肠道的粪便会随着水分被不断吸收而变得愈发干硬，导致排便费力，这在患有心血管疾病的患者身上是非常危险的，因为突然增加的腹压和交感神经兴奋可能会导致阿斯综合征，即心源性晕厥。而排便不畅，同时也有可能造成肛门处的静脉发生曲张，导致痔疮的发生。对于已经发生痔疮的患者，干硬的粪便还有可能划破痔疮上曲张的静脉，导致出血。<br><br><h2><strong>如何清“宿便”？</strong></h2>严格的按照医学知识的科学说法，应该是如何预防便秘。散步，多喝水，多吃蔬菜水果，都是不错的建议。长时间坐着，肠蠕动会减慢，不时的起身活动活动，有助于肠蠕动。多吃蔬果，无论是什么颜色，也都是增加膳食纤维以促进肠蠕动的方式。至于酸奶+地瓜+苹果这一类的食品，谣言粉碎机调查员虽然没有亲身体验，但从地瓜含有比较多的纤维素来看有增加肠蠕动、刺激肠胃排便的作用，食用之后可能会缓解便秘、增加排便次数。如果会直接导致腹泻，将“马桶坐穿”，那这样的方法并不应该推荐。还有一点，有便意时不要憋着，及时排便对于预防便秘有很大的帮助。如果深信“宿便危害说”，而极端的采用泻药来排便，是很危险的事。泻药造成的腹泻会对肠道的功能造成影响，导致水分从肠道丢失、肠道大量分泌肠液等，虽然不是什么器质性的病变，但严重者可能造成水电酸碱紊乱、昏迷甚至生命危险。如果实在是觉得需要清洗肠道，请到正规医院洗胃灌肠。不过相信那种感觉，许多人一辈子都不会想再有一次的。<br><br>这条微博，是借着养生的顺风车，宣传自己空想出来的产物。虽然部分话语有道理，但大多数都是不科学的。排便上遇到的问题，大多不是大问题，如果希望保持健康的排便习惯，就需要保持规律的饮食，经常食用一些粗粮、以及富含纤维素的蔬菜，多饮水。坚持做到这些，胃肠道疾病是不会找上门来的。当然，如果你身上出现了血便、强烈的腹泻腹痛等问题，就可能是大问题了，需要立即到医院就诊。<br><br><h4><strong>参考资料：</strong></h4>[1] <a href=""http://www.guokr.com/article/47850/"">宿便是健康的杀手？</a>，大仑丁，果壳网谣言粉碎机<br>	</div></div>"
"医学健康","2013-07-21","H7N9禽流感当普通感冒治也能治好","江苏省卫生厅通报，一位轻症女患者按照普通感冒的流程治疗很快便康复了，因症状发现得比较早，治疗及时。","论","","<div><div class=""rumor-desc""><strong>流言</strong><span class=""arrow-right""></span>江苏省卫生厅通报，一位轻症女患者按照普通感冒的流程治疗很快便康复了，因症状发现得比较早，治疗及时。</div></div><div><p class=""rumor-truth"">		<strong>真相</strong><span class=""arrow-right""></span>有些人因为自身的遗传因素，对流感抵抗能力较强，加上及早开始治疗所以很快康复了。</p></div><div class=""rumor-content"">		<h2>论证</h2>	<div class=""content"">	有一些人由于本身的遗传因素，其对于特定病原体可能具有较强的抵抗能力，或者对于特定治疗方法更为敏感。<br>虽然现有的认识并不能告诉我们确定的机制，却能够让我们理解为什么有一些人感染了H7N9不会出现严重的症状，有一些人容易被治愈。<br><br>当然，事情并不总是好的，也有一些人会由于本身的遗传因素，导致其更容易患上一些疾病。<br><br>	</div></div>"
