url,ans,author,avatar,date,descrip,detail,platform,points,source,title,type,...
https://vp.fact.qq.com/article?id=01fdc799e251abf7787aaeb9df1f25b4,"<p>新京报快讯（记者 陈琳）随着新型冠状病毒疫情的发展，最近一段时间，不少居民涌入超市抢购生鲜果蔬、米面粮油、方便面和消毒液等生活用品，部分超市货架被抢空。1月28日，有消息称，“北京超市、菜市场要关门一周”。新京报记者从多家超市和市场了解到，这是不实消息。目前多家超市已开始紧急调货满足市民需求。</p><p>北京市商务局也表示，北京的蔬菜货源是充足的，个别门店货架缺货，主要是春节假期人车紧张配送跟不上，所以也请市民理性购买。</p><p><strong>超市现抢购潮，部分货架空置</strong></p><p>记者走访部分超市发现，很多居民推的购物车上，都堆满了米面、蔬菜、方便面，甚至消毒液。“我妈到楼下买菜，回来听说菜市场和超市要关了，吓得她又赶紧出去，说是去另一个超市再买点。”市民王女士说，老人家去了超市后发现，很多超市菜都快没了，更加剧了她的担心。</p><p>在管庄一家超市里记者看到，大部分都是老年人，拖着小车、拎着大袋子，装得满满的蔬菜等生活用品，还有一个阿姨买了十几瓶消毒液，她告诉记者，是听朋友说的，“要往家里的花旁边摆点消毒液。”</p><p>盒马部分门店里，绿叶菜、方便面，也都被抢光。今天中午，市民吴女士在西直门盒马买肉，发现猪肉缺货，超市里只剩下牛肉和鸡肉、牛奶，酸奶、蔬菜柜台上，也只剩下不多的几种，袋装牛奶全都没了。</p><p>1月27日，市民崔先生到四元桥家乐福店买生活用品，结果他想买的都没了，鸡蛋挂面、衣物除菌用滴露等商品全部抢光。</p><p><strong>超市正在紧急调货，菜市场供应充足</strong></p><p>记者从盒马了解到，近一段时间受新型肺炎疫情的影响，北京市民集中采购蔬菜和日常食品的需求激增，尤其是对生鲜食品的需求增长明显，一些门店出现缺货现象。他们已经增加了散装蔬菜供应，1月28日到店30吨，北京29家门店均会上架。包装菜到货也是平时3倍左右。相关负责人表示，目前部分商品的短暂缺货可能出现，采购人员已联系多个渠道确保进行补货。如果遇到线上配送约满，建议消费者可以在做好防护措施的前提下，前往门店采购。</p><p>家乐福表示，北京23家家乐福门店会持续保障供货稳定，尽全力保障不断供、不打烊。“我们会持续增派车辆、增派人员，保证门店有充足供应量，今日北京到货160吨蔬菜，我们还会继续加大采购量，确保顾客能买到可心的蔬菜”，家乐福相关负责人表示。</p><p>超市发表示，为保障老百姓生活必需品稳定供应，超市发采购部第一时间梳理现有防护用品渠道供应商及代理商，并在渠道上迅速转向外地工厂，通过自有的110个直采基地和配送中心，严格把关商品质量，快速启动定量收货。采购部、配送中心同时启动24小时收货，保证每日配送到北京市区及外阜旗下各门店，以确保备货量充足。</p><p>记者也走访部分菜市场看到，目前各菜市场蔬菜等农副产品供应充足。在位于马家堡东路的西罗园菜市场，各种蔬菜都有，价格上浮不大，西葫芦一斤5元，生菜一斤6元，芹菜一斤6元，黄瓜一斤8元。前来买菜的居民表示，在春节期间菜价属于正常，“目前市场上供应很充足，没有囤菜的理由。”一位居民表示。</p><p><strong>北京市商务局：蔬菜货源充足，请市民理性购买</strong></p><p>记者从北京市商务局了解到，北京市已建立了包括9家生猪屠宰企业、7家批发市场、20家大型连锁超市、52家社区菜市场和7家蔬菜直营直供企业，共12大类生活必需品108种商品的监测制度。</p><p>春节期间，北京市商务局对每日市场销售与运营情况进行监测，实时了解市场供应和价格情况，及时研判、调度市场货源供应，保障主要生活必需品市场供应不脱销、不断档。保供期间较日常供应增加蔬菜货源10%左右，日均增加约2000吨。</p><p>春节前，北京市商务局已开展生活必需品政府储备和应急投放网络检查。经实地检查，目前，北京市生活必需品政府储备商品数量到位，质量合格，应急投放网络畅通，能够保障市场应急供应需求。</p><p>北京市商务局表示，北京的蔬菜货源是充足的，个别门店货架缺货，主要是春节假期人车紧张配送跟不上，所以也请市民理性购买。</p><p>新京报记者 陈琳</p><p>编辑 李国君 校对 李世辉</p>",综合类大型城市日报,https://jiaozhen-70111.picnjc.qpic.cn/c7397870f87b4b43ae2d045143207a85?imageView2/2/w/300/h/300,2020-01-28,1月28日，有消息称，“北京超市、菜市场要关门一周”。,"<strong>流行说法：</strong>1月28日，有消息称，“北京超市、菜市场要关门一周”。<div class=""check_content_mark""><span class=""check_content_text"">较真鉴定：</span>            <span class=""mark_total""><span class=""mark_title fake_mark"">假</span><span class=""mark_text fake_mark_text "">谣言</span></span>        </div>        <div class=""check_content_text"">查证要点：</div>        <div class=""check_content_points"">            <ul>                <li><span class=""point_num"">1</span>新京报记者从多家超市和市场了解到，这是不实消息。目前多家超市已开始紧急调货满足市民需求。</li>                <li><span class=""point_num"">2</span>北京市商务局表示，北京的蔬菜货源是充足的，个别门店货架缺货，主要是春节假期人车紧张配送跟不上，所以也请市民理性购买。</li>            </ul>        </div>        <div class=""check_content_text check_content_writer"">查证者：新京报<span style=""font-weight: normal;margin-left: 0.1rem;"">综合类大型城市日报</span></div>        <div class=""check_content_bottom"">            <span>时间 : 2020-01-28</span>            <span style=""margin-left: 21px"">来源 : 新京报</span>            <span style=""margin-left: 21px""><a href=""https://view.inews.qq.com/a/20200128A0ACIR00"">查看原文</a></span>        </div><p>新京报快讯（记者 陈琳）随着新型冠状病毒疫情的发展，最近一段时间，不少居民涌入超市抢购生鲜果蔬、米面粮油、方便面和消毒液等生活用品，部分超市货架被抢空。1月28日，有消息称，“北京超市、菜市场要关门一周”。新京报记者从多家超市和市场了解到，这是不实消息。目前多家超市已开始紧急调货满足市民需求。</p><p>北京市商务局也表示，北京的蔬菜货源是充足的，个别门店货架缺货，主要是春节假期人车紧张配送跟不上，所以也请市民理性购买。</p><p><strong>超市现抢购潮，部分货架空置</strong></p><p>记者走访部分超市发现，很多居民推的购物车上，都堆满了米面、蔬菜、方便面，甚至消毒液。“我妈到楼下买菜，回来听说菜市场和超市要关了，吓得她又赶紧出去，说是去另一个超市再买点。”市民王女士说，老人家去了超市后发现，很多超市菜都快没了，更加剧了她的担心。</p><p>在管庄一家超市里记者看到，大部分都是老年人，拖着小车、拎着大袋子，装得满满的蔬菜等生活用品，还有一个阿姨买了十几瓶消毒液，她告诉记者，是听朋友说的，“要往家里的花旁边摆点消毒液。”</p><p>盒马部分门店里，绿叶菜、方便面，也都被抢光。今天中午，市民吴女士在西直门盒马买肉，发现猪肉缺货，超市里只剩下牛肉和鸡肉、牛奶，酸奶、蔬菜柜台上，也只剩下不多的几种，袋装牛奶全都没了。</p><p>1月27日，市民崔先生到四元桥家乐福店买生活用品，结果他想买的都没了，鸡蛋挂面、衣物除菌用滴露等商品全部抢光。</p><p><strong>超市正在紧急调货，菜市场供应充足</strong></p><p>记者从盒马了解到，近一段时间受新型肺炎疫情的影响，北京市民集中采购蔬菜和日常食品的需求激增，尤其是对生鲜食品的需求增长明显，一些门店出现缺货现象。他们已经增加了散装蔬菜供应，1月28日到店30吨，北京29家门店均会上架。包装菜到货也是平时3倍左右。相关负责人表示，目前部分商品的短暂缺货可能出现，采购人员已联系多个渠道确保进行补货。如果遇到线上配送约满，建议消费者可以在做好防护措施的前提下，前往门店采购。</p><p>家乐福表示，北京23家家乐福门店会持续保障供货稳定，尽全力保障不断供、不打烊。“我们会持续增派车辆、增派人员，保证门店有充足供应量，今日北京到货160吨蔬菜，我们还会继续加大采购量，确保顾客能买到可心的蔬菜”，家乐福相关负责人表示。</p><p>超市发表示，为保障老百姓生活必需品稳定供应，超市发采购部第一时间梳理现有防护用品渠道供应商及代理商，并在渠道上迅速转向外地工厂，通过自有的110个直采基地和配送中心，严格把关商品质量，快速启动定量收货。采购部、配送中心同时启动24小时收货，保证每日配送到北京市区及外阜旗下各门店，以确保备货量充足。</p><p>记者也走访部分菜市场看到，目前各菜市场蔬菜等农副产品供应充足。在位于马家堡东路的西罗园菜市场，各种蔬菜都有，价格上浮不大，西葫芦一斤5元，生菜一斤6元，芹菜一斤6元，黄瓜一斤8元。前来买菜的居民表示，在春节期间菜价属于正常，“目前市场上供应很充足，没有囤菜的理由。”一位居民表示。</p><p><strong>北京市商务局：蔬菜货源充足，请市民理性购买</strong></p><p>记者从北京市商务局了解到，北京市已建立了包括9家生猪屠宰企业、7家批发市场、20家大型连锁超市、52家社区菜市场和7家蔬菜直营直供企业，共12大类生活必需品108种商品的监测制度。</p><p>春节期间，北京市商务局对每日市场销售与运营情况进行监测，实时了解市场供应和价格情况，及时研判、调度市场货源供应，保障主要生活必需品市场供应不脱销、不断档。保供期间较日常供应增加蔬菜货源10%左右，日均增加约2000吨。</p><p>春节前，北京市商务局已开展生活必需品政府储备和应急投放网络检查。经实地检查，目前，北京市生活必需品政府储备商品数量到位，质量合格，应急投放网络畅通，能够保障市场应急供应需求。</p><p>北京市商务局表示，北京的蔬菜货源是充足的，个别门店货架缺货，主要是春节假期人车紧张配送跟不上，所以也请市民理性购买。</p><p>新京报记者 陈琳</p><p>编辑 李国君 校对 李世辉</p>",腾讯较真,"<li><span class=""point_num"">1</span>新京报记者从多家超市和市场了解到，这是不实消息。目前多家超市已开始紧急调货满足市民需求。</li>                <li><span class=""point_num"">2</span>北京市商务局表示，北京的蔬菜货源是充足的，个别门店货架缺货，主要是春节假期人车紧张配送跟不上，所以也请市民理性购买。</li>","新京报,综合类大型城市日报",北京超市、菜市场要关门一周,谣言,{}
https://vp.fact.qq.com/article?id=8c0686fe6b56c6e674e16a7fffa377bf,"<p>纸币在流通过程中，本身接触的物体、流通的环节比较多，正常情况也是难免会携带病毒、细菌、真菌等病原体。本次新型冠状病毒疫情可能会增加纸币上病毒的种类，但是不一定会增加病毒数量或者提升传染性。毕竟病毒要发生突变，需要借助宿主提供的有利环境。离开了宿主，病毒怕酸怕碱怕高温，生存能力堪忧。</p><p>而根据《新型冠状病毒感染的肺炎诊疗方案第四版》中的描述，“新型冠状病毒经呼吸道飞沫传播是主要的传播途径，亦可通过接触传播”。</p><p>这里面有提到“接触传播”，但并不是说接触了纸币，病毒就顺着人体皮肤造成感染。人的皮肤具有屏障功能，每一分每一秒都在给人体提供防护。这里的接触传播主要是指“接触了被病毒附着的物品后，自己再进行揉眼睛、吃东西、挖鼻孔、吸吮手指或者身体本身有伤口”。</p><p>所以，无论有没有本次疫情，使用纸币，拿快递，甚至使用频次更频繁的手机时，勤洗手、注意卫生都是必要的防护措施。</p><p>另外，新型冠状病毒怕酒精、不耐高温，56℃ 持续 30 分钟，冠状病毒就死亡了。按照以往对冠状病毒的经验，乙醚、75% 乙醇、含氯的消毒剂，还有过氧乙酸等等，均可有效灭活病毒。建议疫情期间勤洗手，碗筷可以高温消毒，衣物使用普通洗涤剂即可，家庭地面等可以购买84消毒液消毒。</p>",药理学硕士，知贝儿科药师,https://jiaozhen-70111.picnjc.qpic.cn/25e5607ed20448fba979189a8198bf21?imageView2/2/w/300/h/300,2020-01-28,外出不要收现金，特别是小朋友不要收压岁钱，因为新型冠状病毒会通过现金纸币传播。,"<strong>流行说法：</strong>外出不要收现金，特别是小朋友不要收压岁钱，因为新型冠状病毒会通过现金纸币传播。<div class=""check_content_mark""><span class=""check_content_text"">较真鉴定：</span>            <span class=""mark_total""><span class=""mark_title doubt_mark"">疑</span><span class=""mark_text doubt_mark_text "">有失实</span></span>        </div>        <div class=""check_content_text"">查证要点：</div>        <div class=""check_content_points"">            <ul>                <li><span class=""point_num"">1</span>纸币在流通过程中难免会携带病毒、细菌、真菌等病原体。本次新型冠状病毒疫情可能会增加纸币上病毒的种类，但是不一定会增加病毒数量或者提升传染性。病毒离开了宿主，其生存能力堪忧。</li>                <li><span class=""point_num"">2</span>根据《新型冠状病毒感染的肺炎诊疗方案第四版》中的描述，“新型冠状病毒经呼吸道飞沫传播是主要的传播途径，亦可通过接触传播”，这里的“接触传播”，但并不是说接触了纸币，病毒就顺着人体皮肤造成感染，而是指“接触了被病毒附着的物品后，自己再进行揉眼睛、吃东西、挖鼻孔、吸吮手指或者身体本身有伤口”。</li>                <li><span class=""point_num"">3</span>无论有没有本次疫情，使用纸币，拿快递，甚至使用频次更频繁的手机时，勤洗手、注意卫生都是必要的防护措施。</li>            </ul>        </div>        <div class=""check_content_text check_content_writer"">查证者：谢望时<span style=""font-weight: normal;margin-left: 0.1rem;"">药理学硕士，知贝儿科药师</span></div>        <div class=""check_content_bottom"">            <span>时间 : 2020-01-28</span>            <span style=""margin-left: 21px"">来源 : 腾讯较真</span>            <span style=""margin-left: 21px""><a href=""https://vp.fact.qq.com/article?id=8c0686fe6b56c6e674e16a7fffa377bf"">查看原文</a></span>        </div><p>纸币在流通过程中，本身接触的物体、流通的环节比较多，正常情况也是难免会携带病毒、细菌、真菌等病原体。本次新型冠状病毒疫情可能会增加纸币上病毒的种类，但是不一定会增加病毒数量或者提升传染性。毕竟病毒要发生突变，需要借助宿主提供的有利环境。离开了宿主，病毒怕酸怕碱怕高温，生存能力堪忧。</p><p>而根据《新型冠状病毒感染的肺炎诊疗方案第四版》中的描述，“新型冠状病毒经呼吸道飞沫传播是主要的传播途径，亦可通过接触传播”。</p><p>这里面有提到“接触传播”，但并不是说接触了纸币，病毒就顺着人体皮肤造成感染。人的皮肤具有屏障功能，每一分每一秒都在给人体提供防护。这里的接触传播主要是指“接触了被病毒附着的物品后，自己再进行揉眼睛、吃东西、挖鼻孔、吸吮手指或者身体本身有伤口”。</p><p>所以，无论有没有本次疫情，使用纸币，拿快递，甚至使用频次更频繁的手机时，勤洗手、注意卫生都是必要的防护措施。</p><p>另外，新型冠状病毒怕酒精、不耐高温，56℃ 持续 30 分钟，冠状病毒就死亡了。按照以往对冠状病毒的经验，乙醚、75% 乙醇、含氯的消毒剂，还有过氧乙酸等等，均可有效灭活病毒。建议疫情期间勤洗手，碗筷可以高温消毒，衣物使用普通洗涤剂即可，家庭地面等可以购买84消毒液消毒。</p>",腾讯较真,"<li><span class=""point_num"">1</span>纸币在流通过程中难免会携带病毒、细菌、真菌等病原体。本次新型冠状病毒疫情可能会增加纸币上病毒的种类，但是不一定会增加病毒数量或者提升传染性。病毒离开了宿主，其生存能力堪忧。</li>                <li><span class=""point_num"">2</span>根据《新型冠状病毒感染的肺炎诊疗方案第四版》中的描述，“新型冠状病毒经呼吸道飞沫传播是主要的传播途径，亦可通过接触传播”，这里的“接触传播”，但并不是说接触了纸币，病毒就顺着人体皮肤造成感染，而是指“接触了被病毒附着的物品后，自己再进行揉眼睛、吃东西、挖鼻孔、吸吮手指或者身体本身有伤口”。</li>                <li><span class=""point_num"">3</span>无论有没有本次疫情，使用纸币，拿快递，甚至使用频次更频繁的手机时，勤洗手、注意卫生都是必要的防护措施。</li>","谢望时,药理学硕士，知贝儿科药师",新型冠状病毒会通过现金纸币传播，外出不要收现金,有失实,{}
https://vp.fact.qq.com/article?id=370af4f14b8b0bee72481e2425137bd6,"<p>大河报·大河客户端记者 李鑫</p><p>信阳市新型冠状病毒感染的肺炎疫情防控工作指挥部公告</p><p>一、信阳市新型冠状病毒感染的肺炎疫情发生以来，市委市政府高度重视，主要领导坐镇指挥，及时采取了紧急措施。请广大市民群众积极配合，响应党委政府号召，支持全市疫情防控工作大局。</p><p>二 、针对疫情发展态势，本着对人民群众生命安全高度负责的态度，对重点防控方向路口设卡监测检查。请广大市民群众积极配合，给您出行带来不便敬请谅解。</p><p>三、提醒广大市民群众：认真学习国家卫健部门发布的权威防护知识：不串门、不聚餐、不走亲访友，勤通风、多洗手，戴口罩、少外出。</p><p>四、个别网友传播今天下午两点信阳“封城”消息不属实，不可信。有关部门正在调查，对制造谣言引起混乱者将坚决打击。</p><p>五、各级党委政府要第一时间向指挥部如实报告本地疫情。广大市民群众如有相关发热症状要第一时间到卫健委指定医院就诊。如有隐瞒不报造成严重后果的，将依法追究责任。欢迎广大市民举报，举报电话： 6319227。</p><p>六、请广大市民群众不造谣、不信谣、不传谣。相信、支持党委政府坚强有力领导。只要我们万众一心，众志成城，就一定会打赢抗击疫情攻坚战!祝全市人民在家安享亲情，愉快度过一个平安祥和的春节。</p><p>信阳市新型冠状病毒感染的肺炎疫情防控工作指挥部</p><p>2020年1月25日</p>",河南日报报业集团主办的综合性都市生活日报,https://jiaozhen-70111.picnjc.qpic.cn/8f35b679f64f40f6b3166a47303a3ccc?imageView2/2/w/300/h/300,2020-01-25,网传为防治新型冠状病毒肺炎，信阳开始封城。,"<strong>流行说法：</strong>网传为防治新型冠状病毒肺炎，信阳开始封城。<div class=""check_content_mark""><span class=""check_content_text"">较真鉴定：</span>            <span class=""mark_total""><span class=""mark_title fake_mark"">假</span><span class=""mark_text fake_mark_text "">谣言</span></span>        </div>        <div class=""check_content_text"">查证要点：</div>        <div class=""check_content_points"">            <ul>                <li>信阳市新型冠状病毒感染的肺炎疫情防控工作指挥部公告称个别网友传播今天下午两点信阳“封城”消息不属实。</li>            </ul>        </div>        <div class=""check_content_text check_content_writer"">查证者：大河报<span style=""font-weight: normal;margin-left: 0.1rem;"">河南日报报业集团主办的综合性都市生活日报</span></div>        <div class=""check_content_bottom"">            <span>时间 : 2020-01-25</span>            <span style=""margin-left: 21px"">来源 : 大河报</span>            <span style=""margin-left: 21px""><a href=""https://vp.fact.qq.com/article?id=370af4f14b8b0bee72481e2425137bd6"">查看原文</a></span>        </div><p>大河报·大河客户端记者 李鑫</p><p>信阳市新型冠状病毒感染的肺炎疫情防控工作指挥部公告</p><p>一、信阳市新型冠状病毒感染的肺炎疫情发生以来，市委市政府高度重视，主要领导坐镇指挥，及时采取了紧急措施。请广大市民群众积极配合，响应党委政府号召，支持全市疫情防控工作大局。</p><p>二 、针对疫情发展态势，本着对人民群众生命安全高度负责的态度，对重点防控方向路口设卡监测检查。请广大市民群众积极配合，给您出行带来不便敬请谅解。</p><p>三、提醒广大市民群众：认真学习国家卫健部门发布的权威防护知识：不串门、不聚餐、不走亲访友，勤通风、多洗手，戴口罩、少外出。</p><p>四、个别网友传播今天下午两点信阳“封城”消息不属实，不可信。有关部门正在调查，对制造谣言引起混乱者将坚决打击。</p><p>五、各级党委政府要第一时间向指挥部如实报告本地疫情。广大市民群众如有相关发热症状要第一时间到卫健委指定医院就诊。如有隐瞒不报造成严重后果的，将依法追究责任。欢迎广大市民举报，举报电话： 6319227。</p><p>六、请广大市民群众不造谣、不信谣、不传谣。相信、支持党委政府坚强有力领导。只要我们万众一心，众志成城，就一定会打赢抗击疫情攻坚战!祝全市人民在家安享亲情，愉快度过一个平安祥和的春节。</p><p>信阳市新型冠状病毒感染的肺炎疫情防控工作指挥部</p><p>2020年1月25日</p>",腾讯较真,<li>信阳市新型冠状病毒感染的肺炎疫情防控工作指挥部公告称个别网友传播今天下午两点信阳“封城”消息不属实。</li>,"大河报,河南日报报业集团主办的综合性都市生活日报",河南信阳今天下午两点封城,谣言,{}
